headline,url
In the county of the Donald Trump assassination attempt: ‘The attack has emboldened his supporters’,https://english.elpais.com/usa/elections/2024-09-23/in-the-county-of-the-donald-trump-assassination-attempt-the-attack-has-emboldened-his-supporters.html
The cost of Trump’s mass deportation plan: More than 10 times immigration’s budget ,https://english.elpais.com/usa/elections/2024-09-23/the-cost-of-trumps-mass-deportation-plan-more-than-10-times-immigrations-budget-and-a-possible-recession.html
Taking care of children for a shot at the American dream,https://english.elpais.com/usa/2024-09-23/taking-care-of-children-for-a-shot-at-the-american-dream.html
DeSantis’s desperate attempts to torpedo abortion protections,https://english.elpais.com/usa/elections/2024-09-22/desantiss-desperate-attempts-to-torpedo-abortion-protections-at-the-polls-in-florida.html
James Middleton: Why Kate’s brother is making more headlines than the Princess of Wales,https://english.elpais.com/people/2024-09-23/james-middleton-why-kates-brother-is-making-more-headlines-than-the-princess-of-wales.html
"Lessons from Ireland, the first country to put health warnings on alcohol",https://english.elpais.com/health/2024-09-23/lessons-from-ireland-the-first-country-to-put-health-warnings-on-alcohol-many-people-drink-without-being-aware-of-the-risk.html
"Eva Mendes, the actress who became a children’s book author: ‘When I had a family, my ambition became about home’",https://english.elpais.com/people/2024-09-23/eva-mendes-the-actress-who-became-a-childrens-book-author-when-i-had-a-family-my-ambition-became-about-home.html
Report for Spanish Ethics Committee confirms ‘systematic manipulation’ of Salamanca University rector’s resume,https://english.elpais.com/science-tech/2024-09-23/report-for-spanish-ethics-committee-confirms-systematic-manipulation-of-salamanca-university-rectors-resume.html
Thousands of displaced people in Gaza live trapped between bombs and rising tides: ‘We could drown in our sleep’,https://english.elpais.com/international/2024-09-23/thousands-of-displaced-people-in-gaza-live-trapped-between-bombs-and-rising-tides-we-could-drown-in-our-sleep.html
"The trail of El Mayo and Los Chapitos in Sinaloa: Narco-blockades, executions and more than 50 dead",https://english.elpais.com/international/2024-09-23/the-trail-of-el-mayo-and-los-chapitos-in-sinaloa-narco-blockades-executions-and-more-than-50-dead.html
"Tak Mak, immunologist: ‘The immune system is the orchestra for most of life’s symphonies’",https://english.elpais.com/health/2024-09-22/tak-mak-immunologist-the-immune-system-is-the-orchestra-for-most-of-lifes-symphonies.html
"Emma Coronel, wife of ‘El Chapo’ Guzmán, arrives at Milan Fashion Week to resume her modeling career",https://english.elpais.com/international/2024-09-22/emma-coronel-wife-of-el-chapo-guzman-arrives-at-milan-fashion-week-to-resume-her-modeling-career.html
"Russian companies desperately looking for staff, but are not paying enough",https://english.elpais.com/international/2024-09-23/russian-companies-desperately-looking-for-staff-but-are-not-paying-enough.html
"EL PAÍS and the Spain-US Chamber of Commerce present forum on ‘Latin America, the United States and Spain in the Global Economy’ ",https://english.elpais.com/economy-and-business/2024-09-23/el-pais-and-the-spain-us-chamber-of-commerce-present-forum-on-latin-america-the-united-states-and-spain-in-the-global-economy.html
How a damaged painting hesitatingly attributed to Velázquez could change the art market in Spain,https://english.elpais.com/culture/2024-09-22/how-a-damaged-painting-hesitatingly-attributed-to-velazquez-could-change-the-art-market-in-spain.html
Tirana Hassan: ‘Sexual violence is so prevalent in Darién that women crossing the border carry the morning-after pill’,https://english.elpais.com/international/2024-09-22/tirana-hassan-sexual-violence-is-so-prevalent-in-darien-that-women-crossing-the-border-carry-the-morning-after-pill.html
"Cod, pickles and lots of wine: This was the diet on an 18th century ship ",https://english.elpais.com/culture/2024-09-22/cod-pickles-and-lots-of-wine-this-was-the-diet-on-an-18th-century-ship.html
"Peggy Gallagher, the ‘angel’ who fled an abusive husband and got Oasis back on stage",https://english.elpais.com/culture/2024-09-23/peggy-gallagher-the-angel-who-fled-an-abusive-husband-and-got-oasis-back-on-stage.html
"At 17, Nai managed to escape her forced wedding on the very day of the ceremony: The silent revolution of the Maasai of Tanzania  ",https://english.elpais.com/international/2024-09-21/at-17-nai-managed-to-escape-her-forced-wedding-on-the-very-day-of-the-ceremony-the-silent-revolution-of-the-maasai-of-tanzania.html
Kerstin Noëlle Vokinger: ‘New cancer therapies are being approved for patient groups not included in clinical trials’,https://english.elpais.com/health/2024-09-21/kerstin-noelle-vokinger-new-cancer-therapies-are-being-approved-for-patient-groups-not-included-in-clinical-trials.html
"How to use AI against conspiracy theories: ‘No, immigration does not increase crime’",https://english.elpais.com/technology/2024-09-20/how-to-use-ai-against-conspiracy-theories-no-immigration-does-not-increase-crime.html
The mysterious rise of cancer in young adults,https://english.elpais.com/health/2024-09-20/the-unknowns-surrounding-the-mysterious-rise-of-cancer-in-young-adults.html
Ukraine’s great scientific project advances in the only city that is safe from bombs  ,https://english.elpais.com/international/2024-09-21/ukraines-great-scientific-project-advances-in-the-only-city-that-is-safe-from-bombs.html
"Inditex, owner of Zara stores, is planning ambitious expansion in the US",https://english.elpais.com/economy-and-business/2024-09-20/inditex-owner-of-zara-stores-is-planning-ambitious-expansion-in-the-us.html
Five keys to understand the Fed’s aggressive interest rate cut,https://english.elpais.com/economy-and-business/2024-09-19/five-keys-to-understand-the-feds-aggressive-interest-rate-cut.html
How the entertainment industry could be missing out on $18 billion by failing to engage Latinos,https://english.elpais.com/economy-and-business/2024-09-17/how-the-entertainment-industry-could-be-missing-out-on-18-billion-by-failing-to-engage-latinos.html
Artificial intelligence will affect 60 million US and Mexican jobs within the year,https://english.elpais.com/economy-and-business/2024-09-15/artificial-intelligence-will-affect-60-million-us-and-mexican-jobs-within-the-year.html
"LL Cool J: ‘You don’t lose the flow. It’s like Prince playing a guitar, Mick Jagger singing songs onstage’",https://english.elpais.com/culture/2024-09-22/ll-cool-j-you-dont-lose-the-flow-its-like-prince-playing-a-guitar-mick-jagger-singing-songs-onstage.html
The robbery of the century: How two students stole 124 pieces from an iconic Mexican museum in 1985  ,https://english.elpais.com/culture/2024-09-22/the-robbery-of-the-century-how-two-students-stole-124-pieces-from-an-iconic-mexican-museum-in-1985.html
The archaeological trail of the Coronado expedition that discovered the Grand Canyon,https://english.elpais.com/culture/2024-09-19/crossbow-bolts-and-coins-the-archaeological-trail-of-the-coronada-expedition-that-discovered-the-grand-canyon.html
Another surrealism existed: There were not only European men in the movement that changed the 20th century   ,https://english.elpais.com/culture/2024-09-21/another-surrealism-existed-there-were-not-only-european-men-in-the-movement-that-changed-the-20th-century.html
"Teresa Ruiz, actress: ‘Migrants don’t go to the United States because of the American dream, but because of the Mexican nightmare’",https://english.elpais.com/culture/2024-09-17/teresa-ruiz-actress-migrants-dont-go-to-the-united-states-because-of-the-american-dream-but-because-of-the-mexican-nightmare.html
Sunday syndrome: How to spot the signs that you need a new job ,https://english.elpais.com/lifestyle/2024-09-22/sunday-syndrome-how-to-spot-the-signs-that-you-need-a-new-job.html
"‘Tourists also want an authentic city, not a theme park’: The redevelopment plan that seeks to give La Rambla back to  Barcelona residents",https://english.elpais.com/international/2024-09-21/tourists-also-want-an-authentic-city-not-a-theme-park-the-redevelopment-plan-that-seeks-to-give-la-rambla-back-to-barcelona-residents.html
What should I do if I can’t stand my best friend’s partner?,https://english.elpais.com/lifestyle/2024-09-20/what-should-i-do-if-i-cant-stand-my-best-friends-partner.html
Good manners become collateral victims of mass tourism in Japan,https://english.elpais.com/travel/2024-09-15/good-manners-become-collateral-victims-of-mass-tourism-in-japan.html
"In search of ‘Celebrity Number 6’: How the internet went crazy for Leticia Sardá, a former Spanish model",https://english.elpais.com/culture/2024-09-18/in-search-of-celebrity-number-6-how-the-internet-went-crazy-for-leticia-sarda-a-former-spanish-model.html
Why not a gay James Bond? The return of an eternal debate    ,https://english.elpais.com/culture/2024-09-21/why-not-a-gay-james-bond-the-return-of-an-eternal-debate.html
Cryptomnesia: The unconscious plagiarism affecting the music industry ,https://english.elpais.com/culture/2024-09-21/cryptomnesia-the-unconscious-plagiarism-affecting-the-music-industry.html
Pélicot and the banality of evil,https://english.elpais.com/international/2024-09-16/pelicot-and-the-banality-of-evil.html
Democracies are facing a crisis of electoral legitimacy,https://english.elpais.com/usa/2024-09-17/democracies-are-facing-a-crisis-of-electoral-legitimacy.html
Kids left behind by migration: The challenging rescue of children who have been victims of violence in Mexico,https://english.elpais.com/international/2024-09-15/kids-who-migration-left-behind-the-challenging-rescue-of-children-who-have-been-victims-of-violence-in-mexico.html
Listen now LOS40 USA,https://los40.us/
"Bad Bunny Drops ‘Una Velita’: Meaning, Lyrics in English",https://los40.us/2024/bad-bunny-drops-una-velita-meaning-lyrics-in-english-24783.html
Peso Pluma’s Viral Jewelry: How Much Is It Worth?,https://los40.us/2024/peso-plumas-viral-jewelry-how-much-is-it-worth-24770.html
EL PAÍS offers free Spanish lessons with Gymglish,https://english.elpais.com/economy-and-business/2021-11-15/el-pais-offers-free-spanish-lessons-with-gymglish.html
Who does the Secret Service protect and other keys to understand the agency,https://english.elpais.com/usa/elections/2024-09-18/who-does-the-secret-service-protect-and-other-keys-to-understand-the-agency.html
"Who won the presidential debate: Prediction markets, analysts and early polls declare Kamala Harris the winner",https://english.elpais.com/usa/elections/2024-09-11/who-won-the-presidential-debate-prediction-markets-analysts-and-early-polls-declare-kamala-harris-the-winner.html
"Witnesses to Lebanon pager attack: ‘We started to hear blasts everywhere around us, one after the other’",https://english.elpais.com/international/2024-09-19/witnesses-to-lebanon-pager-attack-we-started-to-hear-blasts-everywhere-around-us-one-after-the-other.html
"A summer away from the bombing of Ukraine, thanks to the Spanish province of Jaén",https://english.elpais.com/international/2024-09-16/ukraine-loses-confidence-in-zelenskiys-newscast.html
Dora María Téllez: ‘We must act for Nicaragua once more’,https://english.elpais.com/international/2024-09-14/dora-maria-tellez-we-must-act-for-nicaragua-once-more.html
Venezuela kicks off its most uncertain presidential campaign,https://english.elpais.com/culture/2024-09-07/its-chiles-titanic-and-yet-no-one-remembers-it-the-forgotten-story-of-the-19th-century-church-fire-that-killed-2000-women.html
Authorities warn about surge in Bitcoin ATM scams,https://english.elpais.com/economy-and-business/2024-09-06/authorities-warn-about-surge-in-bitcoin-atm-scams.html
An economic paradox: When savings are both a good and a bad idea,https://english.elpais.com/economy-and-business/2024-09-06/cooling-us-job-market-will-set-the-pace-of-rate-cuts-as-recession-fears-loom.html
Mexican singer Jaramar Soto’s intense passion for rescuing the voices of women in baroque music,https://english.elpais.com/culture/2024-09-08/mexican-singer-jaramar-sotos-intense-passion-for-rescuing-the-voices-of-women-in-baroque-music.html
‘Synchronicity’: The experimental album that went gold and broke up The Police  ,https://english.elpais.com/culture/2024-09-07/synchronicity-the-experimental-album-that-went-gold-and-broke-up-the-police.html
"Noelia Ferruz, the chemist creating AI with ‘supernatural’ powers",https://english.elpais.com/science-tech/2024-09-06/noelia-ferruz-the-chemist-creating-ai-with-supernatural-powers.html
Science analyzes 150 years of literature: How fiction has reinforced the stereotype of the passive woman,https://english.elpais.com/culture/2024-09-03/science-analyzes-150-years-of-literature-how-fiction-has-reinforced-the-stereotype-of-the-passive-woman.html
‘This is not your normal masturbation’: Artificial intelligence comes to male sex toys  ,https://english.elpais.com/lifestyle/2024-09-01/this-is-not-your-normal-masturbation-artificial-intelligence-comes-to-male-sex-toys.html
"Hope, the secret weapon of philosopher Byung-Chul Han",https://english.elpais.com/lifestyle/2024-08-28/hope-the-secret-weapon-of-philosopher-byung-chul-han.html
Javier Milei’s government scores own goal with Diego Maradona snub,https://english.elpais.com/international/2024-08-14/javier-mileis-government-scores-own-goal-with-diego-maradona-snub.html
"Climbing without a rope, between freedom and psychopathy",https://english.elpais.com/sports/olympic-games/2024-08-13/olympic-medal-table-by-population-and-wealth-which-countries-fared-the-best-at-the-paris-games.html
