headline,url
Joe Biden: “My memory is fine. How in the hell dare he? I don’t need anyone to remind me when he passed away”,https://english.elpais.com/usa/2024-02-09/joe-biden-my-memory-is-fine-how-in-the-hell-dare-he-i-dont-need-anyone-to-remind-me-when-he-passed-away.html
Supreme Court appears to lean toward allowing Donald Trump to run for office ,https://english.elpais.com/usa/2024-02-08/supreme-court-appears-to-lean-toward-allowing-donald-trump-to-run-for-office.html
Ukraine and Israel aid bill edges forward in US Senate,https://english.elpais.com/usa/2024-02-08/ukraine-and-israel-aid-bill-edges-forward-in-us-senate.html
Trump charges in advance,https://english.elpais.com/opinion/2024-02-08/trump-charges-in-advance.html
Zelenskiy appoints new army leader at pivotal moment in war with Russia,https://english.elpais.com/international/2024-02-08/ukraines-president-appoints-new-army-leader-at-pivotal-moment-in-war-with-russia.html
Brazilian police accuse Bolsonaro and military officers in his inner circle of plotting a coup,https://english.elpais.com/international/2024-02-08/brazilian-police-accuse-jair-bolsonaro-and-military-officers-in-his-inner-circle-of-plotting-a-coup.html
"‘Mean Girls,’ 20 years later: The villain’s triumph ",https://english.elpais.com/culture/2024-02-08/mean-girls-20-years-later-the-villains-triumph.html
‘The helicopter was half-sunk and they couldn’t get him out’: This is how Sebastián Piñera died  ,https://english.elpais.com/international/2024-02-08/the-helicopter-was-half-sunk-and-they-couldnt-get-him-out-this-is-how-sebastian-pinera-died.html
Mexico surpasses China as main exporter to the US for first time since 2002,https://english.elpais.com/economy-and-business/2024-02-08/mexico-surpasses-china-as-main-exporter-to-the-us-for-first-time-since-2002.html
Pressure mounts on Hungary’s president to resign over pardon in child sexual abuse case ,https://english.elpais.com/international/2024-02-08/pressure-mounts-on-hungarys-president-to-resign-over-pardon-in-child-sexual-abuse-case.html
Haiti’s prime minister calls for calm as violent protests seek his ouster ,https://english.elpais.com/international/2024-02-08/haitis-prime-minister-calls-for-calm-as-violent-protests-seek-his-ouster.html
200 victims allege child sex abuse in Maryland youth detention facilities ,https://english.elpais.com/usa/2024-02-08/200-victims-allege-child-sex-abuse-in-maryland-youth-detention-facilities.html
CIA terminates whistleblower who prompted flood of sexual misconduct complaints ,https://english.elpais.com/usa/2024-02-08/cia-terminates-whistleblower-who-prompted-flood-of-sexual-misconduct-complaints.html
"Google rebrands its AI services as Gemini, launches new app and subscription service ",https://english.elpais.com/technology/2024-02-08/google-rebrands-its-ai-services-as-gemini-launches-new-app-and-subscription-service.html
"In rural Utah, concern over efforts to use Colorado River water to extract lithium ",https://english.elpais.com/climate/2024-02-08/in-rural-utah-concern-over-efforts-to-use-colorado-river-water-to-extract-lithium.html
California bill would ban all plastic shopping bags at grocery stores ,https://english.elpais.com/climate/2024-02-08/california-bill-would-ban-all-plastic-shopping-bags-at-grocery-stores.html
‘The white we demand in our teeth does not exist in nature’: How Hollywood established impossible dental perfection,https://english.elpais.com/people/2024-02-08/the-white-we-demand-in-our-teeth-does-not-exist-in-nature-how-hollywood-established-impossible-dental-perfection.html
"Ibrahim Iskandar, an eccentric billionaire and now Malaysia’s new king, does not want to be a puppet",https://english.elpais.com/people/2024-02-08/ibrahim-iskandar-an-eccentric-billionaire-and-now-malaysias-new-king-does-not-want-to-be-a-puppet.html
What are the rules that determine scientific names?,https://english.elpais.com/science-tech/2024-02-08/what-are-the-rules-that-determine-scientific-names.html
"Rodrigo Quian Quiroga, neuroscientist: ‘Forgetting is the essential trait of intelligence’",https://english.elpais.com/health/2024-02-08/rodrigo-quian-quiroga-neuroscientist-forgetting-is-the-essential-trait-of-intelligence.html
Why are perennial gardens so popular? Because they are vibrant and enduring landscapes,https://english.elpais.com/lifestyle/2024-02-08/why-are-perennial-gardens-so-popular-because-they-are-vibrant-and-enduring-landscapes.html
Inside Nayib Bukele’s Alcatraz: ‘It is impossible to escape. These psychopaths are going to spend their whole lives behind bars here’,https://english.elpais.com/international/2024-02-07/inside-nayib-bukeles-alcatraz-it-is-impossible-to-escape-these-psychopaths-are-going-to-spend-their-whole-lives-behind-bars-here.html
"Unprecedented Amazon drought was primarily caused by climate change, not El Niño, study finds",https://english.elpais.com/climate/2024-02-08/unprecedented-amazon-drought-was-primarily-caused-by-climate-change-not-el-nino-study-finds.html
Underground ocean found on Saturn’s moon Mimas,https://english.elpais.com/science-tech/2024-02-08/underground-ocean-found-on-saturns-moon-mimas.html
Scientists have identified an immune cell that can cause allergies,https://english.elpais.com/health/2024-02-08/scientists-have-identified-an-immune-cell-that-can-cause-allergies.html
"Human pathogens like pneumonia, tuberculosis and yellow fever are killing primates",https://english.elpais.com/science-tech/2024-02-08/human-pathogens-like-pneumonia-tuberculosis-and-yellow-fever-are-killing-primates.html
"Deepfakes accelerate cryptocurrency scams: ‘It is very easy to fall for them, they are becoming more and more sophisticated’",https://english.elpais.com/technology/2024-02-08/deepfakes-accelerate-cryptocurrency-scams-it-is-very-easy-to-fall-for-them-they-are-becoming-more-and-more-sophisticated.html
Exxon Mobil to explore for oil and gas in offshore area under dispute by Guyana and Venezuela ,https://english.elpais.com/economy-and-business/2024-02-07/exxon-mobil-to-explore-for-oil-and-gas-in-offshore-area-under-dispute-by-guyana-and-venezuela.html
An economic paradox: When savings are both a good and a bad idea,https://english.elpais.com/economy-and-business/2024-02-06/an-economic-paradox-when-savings-are-both-a-good-and-a-bad-idea.html
"China replaces its top securities regulator, moving to reassure investors and end a market slump ",https://english.elpais.com/economy-and-business/2024-02-07/china-replaces-its-top-securities-regulator-moving-to-reassure-investors-and-end-a-market-slump.html
Left the keys inside your car? These tricks might be of help,https://english.elpais.com/lifestyle/2024-02-08/left-the-keys-inside-your-car-these-tricks-might-be-of-help.html
A day in the life of a private chef: A trend that is sweeping social media  ,https://english.elpais.com/lifestyle/2024-02-06/a-day-in-the-life-of-a-private-chef-a-trend-that-is-sweeping-social-media.html
"Sword-swallowing, running backwards or rowing a giant pumpkin: The latest Guinness World Records",https://english.elpais.com/lifestyle/2024-02-06/sword-swallowing-running-backwards-or-rowing-a-giant-pumpkin-the-latest-guinness-world-records.html
What an old friendship that has ended says about us,https://english.elpais.com/society/2024-02-05/what-an-old-friendship-that-has-ended-says-about-us.html
‘Upon Entry’: how a low-budget thriller that cost 100 times less than ‘Society of the Snow’ sneaked into the Goya Awards,https://english.elpais.com/culture/2024-02-08/upon-entry-how-a-low-budget-thriller-that-cost-100-times-less-than-society-of-the-snow-sneaked-into-the-goya-awards.html
Jon Cazenave: When nature creates its own images,https://english.elpais.com/culture/2024-02-08/jon-cazenave-when-nature-creates-its-own-images.html
‘Masters of the Air’ looks to the sky to close Steven Spielberg and Tom Hanks’ WW2 trilogy,https://english.elpais.com/culture/2024-02-07/masters-of-the-air-looks-to-the-sky-to-close-steven-spielberg-and-tom-hanks-ww2-trilogy.html
How James Gandolfini’s addictions to alcohol and drugs caused chaos during filming of ‘The Sopranos’,https://english.elpais.com/culture/2024-02-07/how-james-gandolfinis-addictions-to-alcohol-and-drugs-caused-chaos-during-filming-of-the-sopranos.html
Behind the scenes with the ‘Society of the Snow’ makeup team,https://english.elpais.com/culture/2024-02-07/behind-the-scenes-with-the-society-of-the-snow-makeup-team-bayona-set-aside-the-shot-of-severed-heads-because-he-found-them-unbearable.html
Felicity Huffman returns to acting after the college admissions scandal that landed her in jail: ‘It’s sort of like your old life died and you died with it’,https://english.elpais.com/people/2024-02-07/felicity-huffman-returns-to-acting-after-the-college-admissions-scandal-that-landed-her-in-jail-its-sort-of-like-your-old-life-died-and-you-died-with-it.html
‘Mandalorian’ actress Gina Carano sues Disney for firing her over Holocaust post ,https://english.elpais.com/people/2024-02-07/mandalorian-actress-gina-carano-sues-disney-for-firing-her-over-holocaust-post.html
"A world champion, two-spirit boxer: Everything that shouldn’t be challenging viewers about the new star of ‘True Detective’ ",https://english.elpais.com/people/2024-02-07/a-world-champion-two-spirit-boxer-everything-that-shouldnt-be-challenging-viewers-about-the-new-star-of-true-detective.html
Oscars 2024: Where to stream the nominated movies,https://english.elpais.com/culture/2024-01-26/oscars-2024-where-to-stream-the-nominated-movies.html
Live now in Los40,https://los40.us/ 
Rosalía Is Back: The Explosive Female Artist She’s Collaborating With,https://los40.us/2024/rosalia-is-back-the-explosive-female-artist-with-whom-shes-collaborating-16817.html
‘Slut-Shaming’ in Music: Female Artists Criticized for Their Sexual Expression,https://los40.us/2024/slut-shaming-in-music-female-artists-criticized-for-their-sexual-expression-16830.html
UEFA president Čeferin says he will leave in 2027 and aims testy barbs at critics ,https://english.elpais.com/sports/2024-02-08/uefa-president-ceferin-says-he-will-leave-in-2027-and-aims-testy-barbs-at-critics.html
The Paris Olympics medals are made with pieces of the Eiffel Tower ,https://english.elpais.com/sports/2024-02-08/the-paris-olympics-medals-are-made-with-pieces-of-the-eiffel-tower.html
"2026 World Cup Calendar: Matches, cities and stadiums in the US, Mexico and Canada",https://english.elpais.com/sports/2024-02-06/2026-world-cup-calendar-matches-cities-and-stadiums-in-the-us-mexico-and-canada.html
Super Bowl 2024: Where to watch live and all the things you need to know,https://english.elpais.com/sports/2024-02-08/super-bowl-2024-where-to-watch-live-and-all-the-things-you-need-to-know.html
The European countryside shows its strength,https://english.elpais.com/international/2024-02-06/the-european-countryside-shows-its-strength.html
Sebastián Piñera: The millionaire politician who liked to gamble and win,https://english.elpais.com/international/2024-02-07/sebastian-pinera-the-millionaire-politician-who-liked-to-gamble-and-win.html
Residente: ‘The urban genre fights over nonsense. Nobody says anything about Palestine. I don’t want to belong to that scene’,https://english.elpais.com/culture/2024-02-06/residente-the-urban-genre-fights-over-nonsense-nobody-says-anything-about-palestine-i-dont-want-to-belong-to-that-scene.html
Bukele in El Salvador: The era of the single party and the single leader is born,https://english.elpais.com/international/2024-02-06/bukele-expands-his-power-in-el-salvador-the-era-of-the-single-party-and-the-single-leader-is-born.html
EL PAÍS offers free Spanish lessons with Gymglish,https://english.elpais.com/economy-and-business/2021-11-15/el-pais-offers-free-spanish-lessons-with-gymglish.html
Republicans fail in their attempt to impeach Secretary of Homeland Security Mayorkas,https://english.elpais.com/usa/2024-02-07/republicans-fail-in-their-attempt-to-impeach-secretary-of-homeland-security-alejandro-mayorkas.html
Nikki Haley is trounced by the ‘none of these candidates’ option in Nevada’s Republican primary,https://english.elpais.com/usa/2024-02-07/nikki-haley-is-trounced-by-the-none-of-these-candidates-option-in-nevadas-republican-primary.html
The Netherlands is having trouble forming a new far-right government. Here’s why ,https://english.elpais.com/international/2024-02-07/the-netherlands-is-having-trouble-forming-a-new-far-right-government-heres-why.html
Vladimir Putin grants former Fox host Tucker Carlson his first interview with a Western broadcaster,https://english.elpais.com/international/2024-02-07/vladimir-putin-grants-former-fox-host-tucker-carlson-his-first-interview-with-a-western-broadcaster.html
Venezuela’s ruling party is preparing this year’s electoral calendar to win the presidency ‘by hook or by crook’,https://english.elpais.com/international/2024-02-07/venezuelas-ruling-party-is-preparing-this-years-electoral-calendar-to-win-the-presidency-by-hook-or-by-crook.html
López Obrador proposes package of constitutional reforms that are both a personal legacy and a campaign program,https://english.elpais.com/international/2024-02-06/lopez-obrador-proposes-package-of-constitutional-reforms-that-are-both-a-personal-legacy-and-a-campaign-program.html
"Planes, storage, and suppliers nearby: How businesses are dealing with the Red Sea crisis",https://english.elpais.com/economy-and-business/2024-02-05/planes-storage-and-suppliers-nearby-how-businesses-are-dealing-with-the-red-sea-crisis.html
Political storm over the Federal Reserve,https://english.elpais.com/economy-and-business/2024-02-05/political-storm-over-the-federal-reserve.html
"Lily Gladstone, Oscar nominee for ‘Killers of the Flower Moon’: ‘The world has to start getting worried about the return of Trump’",https://english.elpais.com/culture/2024-02-05/lily-gladstone-oscar-nominee-for-killers-of-the-flower-moon-the-world-has-to-start-getting-worried-about-the-return-of-trump.html
What does sadness sound like? The ‘key’ is in 18th century opera ,https://english.elpais.com/society/2024-02-04/what-does-sadness-sound-like-the-key-is-in-18th-century-opera.html
Neanderthals: More knowable now than ever ,https://english.elpais.com/science-tech/2024-02-07/neanderthals-more-knowable-now-than-ever.html
Why do the effects of Botox last for less and less time? The mystery that has aesthetic medicine perplexed,https://english.elpais.com/health/2024-02-07/why-do-the-effects-of-botox-last-for-less-and-less-time-the-mystery-that-has-aesthetic-medicine-perplexed.html
How trauma can reveal personal strength,https://english.elpais.com/health/2024-02-05/how-trauma-can-reveal-personal-strength.html
"Harry James, the influencer who advocates for bald pride",https://english.elpais.com/society/2024-02-03/harry-james-the-influencer-who-advocates-for-bald-pride.html
John McEnroe: ‘Nadal and Saudi Arabia? There is a phrase: money talks’,https://english.elpais.com/sports/2024-01-26/john-mcenroe-nadal-and-saudi-arabia-there-is-a-phrase-money-talks.html
"‘Society of the Snow,’ the spirit of Numa Turcatti and the soccer team named after him",https://english.elpais.com/sports/2024-01-22/society-of-the-snow-the-spirit-of-numa-turcatti-and-the-soccer-team-named-after-him.html
