headline,url
Trump orders pause of all student visa interviews at US embassies,https://english.elpais.com/usa/2025-05-27/trump-orders-pause-of-all-student-visa-interviews-at-us-embassies.html
Trump increases pressure on Harvard by canceling all federal contracts with the university,https://english.elpais.com/usa/2025-05-27/trump-increases-pressure-on-harvard-by-canceling-all-federal-contracts-with-the-university.html
"In hiding in the US after a deportation order: ‘I have nothing here, but even less there’",https://english.elpais.com/usa/2025-05-27/in-hiding-in-the-us-after-a-deportation-order-i-have-nothing-here-but-even-less-there.html
"Cristina Jiménez, activist: ‘Being a good immigrant doesn’t protect us from being deported’",https://english.elpais.com/usa/2025-05-27/cristina-jimenez-activist-being-a-good-immigrant-doesnt-protect-us-from-being-discriminated-against-abused-and-deported.html
US entrepreneur buys abandoned village in Spain,https://english.elpais.com/international/2025-05-27/us-entrepreneur-buys-abandoned-village-in-spain-hoping-to-turn-it-into-a-tourist-magnet-where-others-have-failed.html
‘God’s judge’: The scandal that could overturn the trial for Diego Maradona’s death,https://english.elpais.com/international/2025-05-27/gods-judge-the-scandal-that-could-overturn-the-trial-for-diego-maradonas-death.html
"Israel believes Hamas has 40,000 fighters in Gaza, the same number as before the October 7, 2023 attacks ",https://english.elpais.com/international/2025-05-27/israel-believes-hamas-has-40000-fighters-in-gaza-the-same-number-as-before-the-october-7-2023-attacks.html
"Inside Spain’s slaughterhouse of horrors: Dying animals, severed heads, and dead rats",https://english.elpais.com/spain/2025-05-27/inside-spains-slaughterhouse-of-horrors-dying-animals-severed-heads-and-dead-rats.html
Sick and forgotten: The lives of over 100 Russian political prisoners are in danger ,https://english.elpais.com/international/2025-05-27/sick-and-forgotten-the-lives-of-over-100-russian-political-prisoners-are-in-danger.html
Drug violence reaches Quito: ‘Gangs want to take over our area’ ,https://english.elpais.com/international/2025-05-27/drug-violence-reaches-quito-gangs-want-to-take-over-our-area.html
"Scientists on how to age well: ‘Sleep is democratic, universal, cheap, and free, and yet no one sleeps enough’",https://english.elpais.com/science-tech/2025-05-27/scientists-on-how-to-age-well-sleep-is-democratic-universal-cheap-and-free-and-yet-no-one-sleeps-enough.html
"The filming of Robin Williams’ ‘Popeye,’ where cocaine was hidden in walkie-talkies: ‘You couldn’t escape it’",https://english.elpais.com/culture/2025-05-27/the-filming-of-robin-williams-popeye-where-cocaine-was-hidden-in-walkie-talkies-you-couldnt-escape-it.html
‘The Last of Us’: The last shall be first,https://english.elpais.com/culture/2025-05-27/the-last-of-us-the-last-shall-be-first.html
"Janet Jackson’s 50 years in music, carrying the weight of her famous family name ",https://english.elpais.com/culture/2025-05-26/janet-jacksons-50-years-in-music-carrying-the-weight-of-her-famous-family-name.html
Orwell was right: The dystopia of ‘1984’ is already here,https://english.elpais.com/culture/2025-05-26/orwell-was-right-the-dystopia-of-1984-is-already-here.html
Should we wipe out the pests now that we can?,https://english.elpais.com/science-tech/2025-05-26/should-we-wipe-out-the-pests-now-that-we-can.html
Do we need publicly-owned social networks to escape Silicon Valley?,https://english.elpais.com/opinion/2025-05-25/do-we-need-publicly-owned-social-networks-to-escape-silicon-valley.html
"Lisa Randall, the theoretical physicist nominated for a Nobel Prize who wrote an opera about the fifth dimension",https://english.elpais.com/science-tech/2025-05-25/lisa-randall-the-theoretical-physicist-nominated-for-a-nobel-prize-who-wrote-an-opera-about-the-fifth-dimension.html
Hyperconnectivity and holographic calls: Telecoms race to meet growing demands,https://english.elpais.com/technology/2025-05-24/hyperconnectivity-and-holographic-calls-telecoms-race-to-meet-growing-demands.html
"Carl H. June, creator of CAR-T therapies: ‘The genetic medicine of the future will be able to treat everything’",https://english.elpais.com/health/2025-05-24/carl-h-june-creator-of-car-t-therapies-the-genetic-medicine-of-the-future-will-be-able-to-treat-everything-from-diabetes-to-chronic-infections.html
Erectile dysfunction ‘can be a warning of a cardiovascular problem’,https://english.elpais.com/health/2025-05-23/erectile-dysfunction-can-be-a-warning-of-a-cardiovascular-problem.html
The 3.5% tax on remittances: A blow of over $2.7 billion for undocumented Mexican migrants,https://english.elpais.com/economy-and-business/2025-05-26/the-35-tax-on-remittances-a-blow-of-over-27-billion-for-undocumented-mexican-migrants.html
"David Lammy, UK Foreign Secretary: ‘The British have moved on from Brexit and they want a pragmatic government’",https://english.elpais.com/international/2025-05-20/david-lammy-uk-foreign-secretary-the-british-have-moved-on-from-brexit-and-they-want-a-pragmatic-government.html
"He Lifeng, the trusted aide to Xi Jinping who broke the trade deadlock",https://english.elpais.com/economy-and-business/2025-05-19/he-lifeng-the-trusted-aide-to-xi-jinping-who-broke-the-trade-deadlock.html
"The US, the country with which Mexico has co-produced the most films in the last year",https://english.elpais.com/economy-and-business/2025-05-18/the-us-the-country-with-which-mexico-has-co-produced-the-most-films-in-the-last-year.html
"Slavoj Žižek, philosopher: ‘Wisdom is what I hate most, it is absolute conformist stupidity’",https://english.elpais.com/culture/2025-05-25/slavoj-zizek-philosopher-wisdom-is-what-i-hate-most-it-is-absolute-conformist-stupidity.html
Spike Lee: ‘I don’t know how we can talk about American values considering who the president is’,https://english.elpais.com/culture/2025-05-25/spike-lee-i-dont-know-how-we-can-talk-about-american-values-considering-who-the-president-is.html
The journey of Gaudí’s Batlló chair: Casa Valle’s redesign captivates US audiences,https://english.elpais.com/culture/2025-05-24/the-journey-of-gaudis-batllo-chair-casa-valles-redesign-captivates-us-audiences.html
The artistic movement that anticipated the algorithm,https://english.elpais.com/culture/2025-05-25/the-artistic-movement-that-anticipated-the-algorithm.html
Why it’s better not to listen to Spotify playlists,https://english.elpais.com/culture/2025-05-24/why-its-better-not-to-listen-to-spotify-playlists.html
AI recreates the faces of enslaved people in Brazil based on descriptions by an abolitionist,https://english.elpais.com/international/2025-05-26/ai-recreates-the-faces-of-enslaved-people-in-brazil-based-on-descriptions-by-an-abolitionist.html
"Food Runners, the dating app alternative: Run, eat, meet someone new",https://english.elpais.com/lifestyle/2025-05-12/food-runners-the-dating-app-alternative-run-eat-meet-someone-new.html
Reflections on the Netflix series ‘Adolescence’: How to steer boys away from the manosphere,https://english.elpais.com/culture/2025-05-18/reflections-on-the-netflix-series-adolescence-how-to-steer-boys-away-from-the-manosphere.html
How emos survived their sadness: The ashes of an extinct urban tribe on the verge of resurrection,https://english.elpais.com/culture/2025-05-03/how-emos-survived-their-sadness-the-ashes-of-an-extinct-urban-tribe-on-the-verge-of-resurrection.html
Welcome to the ‘antisocial century’: Are we lonelier now than ever?,https://english.elpais.com/lifestyle/2025-05-03/welcome-to-the-antisocial-century-are-we-lonelier-now-than-ever.html
Jeff Bezos’ bachelor party: Highlights from his Madrid stag night ,https://english.elpais.com/people/2025-05-22/jeff-bezos-bachelor-party-highlights-from-his-madrid-stag-night.html
"Meet MrBeast, the controversial YouTuber with millions of followers",https://english.elpais.com/people/2025-05-24/meet-mrbeast-the-controversial-youtuber-with-millions-of-followers.html
Rihanna’s baby bump steals the show again at Cannes: A look back at her maternity fashion statements,https://english.elpais.com/people/2025-05-22/rihannas-baby-bump-steals-the-show-again-at-cannes-a-look-back-at-her-maternity-fashion-statements.html
"Lamine Yamal: ‘I listen to old-school rappers like 50 Cent, Eminem... and some flamenco’",https://english.elpais.com/sports/2025-05-17/lamine-yamal-i-listen-to-old-school-rappers-like-50-cent-eminem-and-some-flamenco.html
"Ezra Klein, journalist and writer: ‘The Democrats were more loyal to Biden than to their own chances of winning’ ",https://english.elpais.com/usa/2025-05-24/ezra-klein-journalist-and-writer-the-democrats-were-more-loyal-to-biden-than-to-their-own-chances-of-winning.html
"Miami turns its back on Marco Rubio, its prodigal son in Washington",https://english.elpais.com/usa/2025-05-24/miami-turns-its-back-on-marco-rubio-its-prodigal-son-in-washington.html
"Spain, the only major European country to extradite people to China despite the ‘generalized violence’ in its prisons",https://english.elpais.com/international/2025-05-25/spain-the-only-major-european-country-to-extradite-people-to-china-despite-the-generalized-violence-in-its-prisons.html
Netanyahu advances the Israeli far right’s most extreme agenda in Gaza ,https://english.elpais.com/international/2025-05-26/netanyahu-advances-the-israeli-far-rights-most-extreme-agenda-in-gaza.html
Listen now LOS40 USA,https://los40.us/
Billie Eilish Adds New Dates to Hit Me Hard and Soft Tour,https://los40.us/2025/billie-eilish-adds-new-dates-to-hit-me-hard-and-soft-tour-34020.html
"Luis de Javier, the Designer Who’s Dressed Celebrities Like Lady Gaga and Beyoncé: “I’m Inspired by Women Who Don’t Take No for an Answer”",https://los40.us/2025/luis-de-javier-the-hispanic-designer-whos-dressed-lady-gaga-beyonce-and-rosalia-im-inspired-by-working-women-who-dont-take-no-for-an-answer-34025.html
EL PAÍS offers free Spanish lessons with Gymglish,https://english.elpais.com/economy-and-business/2021-11-15/el-pais-offers-free-spanish-lessons-with-gymglish.html
"Pride, defiance and jubilation among Trump supporters at rally to mark his first 100 days in office",https://english.elpais.com/usa/2025-04-30/pride-defiance-and-jubilation-among-trump-supporters-at-rally-to-mark-his-first-100-days-in-office.html
The US targets La Familia Michoacana in its crusade against fentanyl,https://english.elpais.com/usa/2025-04-16/the-us-targets-la-familia-michoacana-in-its-crusade-against-fentanyl.html
Chancellor Merz’s international challenge: Make Germany ‘independent’ from the US or maintain the link despite Trump,https://english.elpais.com/international/2025-05-06/chancellor-merzs-international-challenge-make-germany-independent-from-the-us-or-maintain-the-link-despite-trump.html
Israel deals yet another blow to Gaza’s decimated healthcare system,https://english.elpais.com/international/2025-04-15/israel-deals-yet-another-blow-to-gazas-decimated-healthcare-system.html
The Trump effect and the mistakes of Correismo hand Daniel Noboa victory in Ecuador,https://english.elpais.com/international/2025-04-15/the-trump-effect-and-the-mistakes-of-correismo-hand-daniel-noboa-victory-in-ecuador.html
Venezuela kicks off its most uncertain presidential campaign,https://english.elpais.com/international/2025-04-14/don-neto-and-the-sinaloa-old-guard-who-reinvented-drug-trafficking-in-guadalajara.html
Living like a nobleman: The highly profitable trend of restoring historic buildings,https://english.elpais.com/economy-and-business/2025-04-26/living-like-a-nobleman-the-highly-profitable-trend-of-restoring-historic-buildings.html
An economic paradox: When savings are both a good and a bad idea,https://english.elpais.com/economy-and-business/2025-04-10/a-financial-crisis-in-the-age-of-misinformation-more-market-volatility-and-greater-liquidity-risks.html
Jason Isaacs: The villain who managed to dodge fame until ‘The White Lotus’,https://english.elpais.com/people/2025-04-12/jason-isaacs-the-villain-who-managed-to-dodge-fame-until-the-white-lotus.html
Jon Hamm: ‘I don’t think very much about Don Draper’,https://english.elpais.com/culture/2025-04-11/jon-hamm-i-dont-think-very-much-about-don-draper.html
Using brain-dead people for medical experiments: The new debate at the frontier of bioethics,https://english.elpais.com/science-tech/2025-05-02/using-brain-dead-people-for-medical-experiments-the-new-debate-at-the-frontier-of-bioethics.html
Mapping a tiny piece of mouse brain opens up new path to understanding human intelligence,https://english.elpais.com/science-tech/2025-04-09/mapping-a-tiny-piece-of-mouse-brain-opens-up-new-path-to-understanding-human-intelligence.html
Welcome to the ‘antisocial century’: Are we lonelier now than ever?,https://english.elpais.com/lifestyle/2025-05-03/welcome-to-the-antisocial-century-are-we-lonelier-now-than-ever.html
"Different ideal, same pressure: Gen Z’s fixation on ‘perfect’ skin echoes millennials’ obsession on being thin",https://english.elpais.com/lifestyle/2025-03-15/different-ideal-same-pressure-gen-zs-fixation-on-perfect-skin-echoes-millennials-obsession-on-being-thin.html
Canadians put their elbows up: Hockey becomes a symbol of resistance against Trump,https://english.elpais.com/international/2025-04-07/canadians-put-their-elbows-up-hockey-becomes-a-symbol-of-resistance-against-trump.html
"Climbing without a rope, between freedom and psychopathy",https://english.elpais.com/sports/2025-03-11/could-maradonas-death-have-been-avoided-trial-of-soccer-stars-carers-begins-in-buenos-aires.html
