headline,url
Solar eclipse: A shadow beam crosses America,https://english.elpais.com/science-tech/2024-04-08/solar-eclipse-a-shadow-beam-crosses-america.html
Calls to suspend military aid to Israel gather strength with Democrats,https://english.elpais.com/usa/2024-04-08/calls-to-suspend-military-aid-to-israel-gather-strength-among-us-democrats.html
"Six months since the start of the war in Gaza, Israel feels increasingly threatened and isolated",https://english.elpais.com/international/2024-04-08/six-months-since-the-start-of-the-war-in-gaza-israel-is-feeling-increasingly-threatened-and-isolated.html
Assault on Mexican Embassy plunges Ecuador into political chaos,https://english.elpais.com/international/2024-04-08/assault-on-mexican-embassy-in-quito-plunges-ecuador-into-political-chaos.html
Trump declines to endorse a national abortion ban and says it should be left to the states,https://english.elpais.com/usa/2024-04-08/trump-declines-to-endorse-a-national-abortion-ban-and-says-it-should-be-left-to-the-states.html
New York appeals judge rejects Donald Trump’s request to delay his April 15 hush money trial,https://english.elpais.com/usa/2024-04-08/new-york-appeals-judge-rejects-donald-trumps-request-to-delay-his-april-15-hush-money-trial.html
A new battle for Ukrainian soldiers: Reintegrating into civilian life,https://english.elpais.com/international/2024-04-08/a-new-battle-for-ukrainian-soldiers-reintegrating-into-civilian-life.html
Brazil issues solemn apology to Indigenous people for the atrocities committed during the dictatorship,https://english.elpais.com/international/2024-04-08/brazil-issues-solemn-apology-to-indigenous-people-for-the-atrocities-committed-during-the-dictatorship.html
"Rwanda, 30 years on from genocide: Security, cleanliness, modernity and a heavy hand",https://english.elpais.com/international/2024-04-08/rwanda-30-years-on-from-genocide-security-cleanliness-modernity-and-a-heavy-hand.html
May Phaw’s dangerous escape from Myanmar: ‘I have a son to save’,https://english.elpais.com/international/2024-04-08/may-phaws-dangerous-escape-from-myanmar-i-have-a-son-to-save.html
The security threats looming over this summer’s Olympics in Paris,https://english.elpais.com/sports/2024-04-08/the-security-threats-looming-over-this-summers-olympics-in-paris.html
"Chinese overproduction in clean energy, the new source of friction between the US and China",https://english.elpais.com/economy-and-business/2024-04-08/chinese-overproduction-in-clean-energy-the-new-source-of-friction-between-the-us-and-china.html
A journey to the heart of China’s ‘new productive forces’,https://english.elpais.com/economy-and-business/2024-04-08/a-journey-to-the-heart-of-chinas-new-productive-forces.html
IBM’s Darío Gil: ‘This year we’ll have the first Spanish-language AI model with use cases’,https://english.elpais.com/technology/2024-04-08/ibms-dario-gil-this-year-well-have-the-first-spanish-language-ai-model-with-use-cases.html
"Vatican blasts gender-affirming surgery, surrogacy and gender theory as violations of human dignity ",https://english.elpais.com/international/2024-04-08/vatican-blasts-gender-affirming-surgery-surrogacy-and-gender-theory-as-violations-of-human-dignity.html
NAIA all but bans transgender athletes from women’s sports. NCAA vows to ensure ‘fair competition’,https://english.elpais.com/sports/2024-04-08/naia-all-but-bans-transgender-athletes-from-womens-sports-ncaa-vows-to-ensure-fair-competition.html
"Nero’s Rome was not so different from today’s world: Stratospheric rents, gentrification and chaotic traffic",https://english.elpais.com/culture/2024-04-08/neros-rome-was-not-so-different-from-todays-world-stratospheric-rents-gentrification-and-chaotic-traffic.html
Armenian photographer Nazik Armenakyan: ‘There are women who find out they have HIV when they get pregnant and go to the hospital’,https://english.elpais.com/culture/2024-04-07/armenian-photographer-nazik-armenakyan-there-are-women-who-find-out-they-have-hiv-when-they-get-pregnant-and-go-to-the-hospital.html
"Joe Keery, the actor who plays the endearing Steve Harrington on ‘Stranger Things,’ is now a music star",https://english.elpais.com/people/2024-04-08/joe-keery-the-actor-who-plays-the-endearing-steve-harrington-on-stranger-things-is-now-a-music-star.html
"Dani Alves seeks reversal of rape conviction, restoration of his public image and a return to soccer",https://english.elpais.com/sports/2024-04-08/dani-alves-seeks-reversal-of-rape-conviction-restoration-of-his-public-image-and-a-return-to-soccer.html
"Hahaha, LOL or 555: How laughter on the internet is evolving",https://english.elpais.com/lifestyle/2024-04-08/hahaha-lol-or-555-how-laughter-on-the-internet-is-evolving.html
"Nadège Vanhee, creative director of Hermès; ‘Silent luxury is marketing. We’re not silent here, we’re something more’",https://english.elpais.com/culture/2024-04-08/nadege-vanhee-creative-director-of-hermes-silent-luxury-is-marketing-were-not-silent-here-were-something-more.html
"From fulfilling our fantasies to altering our desires, how far can AI go in sex?  ",https://english.elpais.com/technology/2024-04-08/from-fulfilling-our-fantasies-to-altering-our-desires-how-far-can-ai-go-in-sex.html
Industrialization began in Britain a century before the Industrial Revolution,https://english.elpais.com/international/2024-04-05/industrialization-began-in-britain-a-century-before-the-industrial-revolution.html
Interstellar interlopers are much more common than previously thought,https://english.elpais.com/science-tech/2024-04-06/interstellar-interlopers-like-oumuamua-and-borisov-are-much-more-common-than-previously-thought.html
Discovery of the mechanism behind asthma may help find an effective treatment for it,https://english.elpais.com/science-tech/2024-04-05/discovery-of-the-mechanism-behind-asthma-may-help-find-an-effective-treatment-for-it.html
"Jorge Vallejo, general director of Chinese auto company BYD: ‘We want to democratize the use of electric cars in Mexico’",https://english.elpais.com/economy-and-business/2024-04-06/jorge-vallejo-director-general-of-chinese-auto-company-byd-we-want-to-democratize-the-use-of-electric-cars-in-mexico.html
Financial sector faces challenges amid climate crisis   ,https://english.elpais.com/climate/2024-04-07/financial-sector-faces-challenges-amid-climate-crisis.html
The quirky Italian village where banknotes feature Maradona’s face,https://english.elpais.com/international/2024-04-03/the-quirky-italian-village-where-banknotes-feature-maradonas-face.html
Between gold fever and cacao fever  ,https://english.elpais.com/economy-and-business/2024-04-03/between-gold-fever-and-cacao-fever.html
Six plants that will stop you being a ‘plant killer’,https://english.elpais.com/lifestyle/2024-04-03/six-plants-that-will-stop-you-being-a-plant-killer.html
What it means to be a ‘divorcee’ in young people’s language: How the word lost its negative connotation,https://english.elpais.com/lifestyle/2024-04-01/what-it-means-to-be-a-divorcee-in-young-peoples-language-how-the-word-lost-its-negative-connotation.html
Why it is better not to drink if you have emotional problems ,https://english.elpais.com/health/2024-04-05/why-it-is-better-not-to-drink-if-you-have-emotional-problems.html
‘Nicotine wakes you up’: How Zyn pouches became the US extreme right’s latest obsession with regaining ‘lost’ manhood,https://english.elpais.com/usa/2024-04-02/nicotine-wakes-you-up-how-zyn-pouches-became-the-us-extreme-rights-latest-obsession-with-regaining-lost-manhood.html
"‘Not a Pretty Picture,’ the movie that took on rape culture 50 years ago",https://english.elpais.com/culture/2024-04-08/not-a-pretty-picture-the-movie-that-took-on-rape-culture-50-years-ago.html
‘The Iron Claw’: a grand director turns the pathos of wrestling into tragedy,https://english.elpais.com/culture/2024-04-08/the-iron-claw-a-grand-director-turns-the-pathos-of-wrestling-into-tragedy.html
"Laurie Anderson is obsessed with resuscitating husband, Lou Reed, with AI",https://english.elpais.com/culture/2024-04-05/laurie-anderson-is-obsessed-with-resuscitating-husband-lou-reed-with-ai.html
"‘Ripley,’ or the best treatment of the Patricia Highsmith classic that delves into the cursed human condition ",https://english.elpais.com/culture/2024-04-05/ripley-or-the-best-treatment-of-the-patricia-highsmith-classic-that-delves-into-the-cursed-human-condition.html
Tropicana: The refuge of the mafia and the Rat Pack in Las Vegas closes after 67 years,https://english.elpais.com/usa/2024-04-04/tropicana-the-refuge-of-the-mafia-and-the-rat-pack-in-las-vegas-closes-after-67-years.html
"Actor Jonathan Majors avoids jail time, sentenced to counseling for assaulting ex-girlfriend ",https://english.elpais.com/people/2024-04-08/actor-jonathan-majors-avoids-jail-time-sentenced-to-counseling-for-assaulting-ex-girlfriend.html
Beyoncé on horseback: The artistic relationship between Queen Isabella and the (new) queen of country music,https://english.elpais.com/culture/2024-04-04/beyonce-on-horseback-the-artistic-relationship-between-queen-isabella-and-the-new-queen-of-country-music.html
"The case of Scott Adkins, ‘the last true action hero’ you have never seen in movie theaters",https://english.elpais.com/culture/2024-04-04/the-case-of-scott-adkins-the-last-true-action-hero-you-have-never-seen-in-movie-theaters.html
"In a lawsuit, Angelina Jolie accuses Brad Pitt of physically abusing her ",https://english.elpais.com/people/2024-04-05/in-a-lawsuit-angelina-jolie-accuses-brad-pitt-of-physically-abusing-her.html
Live now in Los40,https://los40.us/ 
Rauw Alejandro & Rosalía’s Songs That Explore Bisexuality,https://los40.us/2024/the-songs-by-rauw-alejandro-and-rosalia-that-expose-her-bisexuality-18836.html
The Kiss of Anitta and Peso Pluma and 10 Other Iconic Moments of Latin Pop Culture,https://los40.us/2024/the-kiss-of-anitta-and-peso-pluma-and-10-other-iconic-moments-of-latin-pop-culture-18880.html
Caitlin Clark set out to turn Iowa into a winner. She redefined women’s college hoops along the way,https://english.elpais.com/sports/2024-04-07/caitlin-clark-set-out-to-turn-iowa-into-a-winner-she-redefined-womens-college-hoops-along-the-way.html
Endrick and the unfulfilled dream of a father who cleaned football stadiums,https://english.elpais.com/sports/2024-03-28/endrick-and-the-unfulfilled-dream-of-a-father-who-cleaned-football-stadiums.html
A look at the NBA’s record-breaking high-scoring season,https://english.elpais.com/sports/2024-04-01/a-look-at-the-nbas-record-breaking-high-scoring-season.html
Verstappen bounces back with dominant win at Japanese Grand Prix,https://english.elpais.com/sports/2024-04-07/verstappen-bounces-back-with-dominant-win-at-japanese-grand-prix.html
Me Too in Cuba: Four students denounce sexual abuse at film school  ,https://english.elpais.com/culture/2024-04-03/me-too-in-cuba-four-students-denounce-sexual-abuse-at-film-school.html
"Jane C. Ginsburg, intellectual property expert: ‘We are not ready to accept the idea of the machine being the author’",https://english.elpais.com/technology/2024-04-02/jane-c-ginsburg-intellectual-property-expert-we-are-not-ready-to-accept-the-idea-of-the-machine-being-the-author.html
The dark side of Medellín’s sex tourism: Child prostitutes and depraved men ,https://english.elpais.com/international/2024-04-07/the-dark-side-of-medellins-sex-tourism-child-prostitutes-and-depraved-men.html
The Palestinian ‘heroes’ who support humanitarian aid in Gaza,https://english.elpais.com/international/2024-04-07/the-palestinian-heroes-who-support-humanitarian-aid-in-gaza.html
EL PAÍS offers free Spanish lessons with Gymglish,https://english.elpais.com/economy-and-business/2021-11-15/el-pais-offers-free-spanish-lessons-with-gymglish.html
"Thieves carry out movie-like heist in Los Angeles, making off with $30 million",https://english.elpais.com/usa/2024-04-05/thieves-carry-out-movie-like-heist-in-los-angeles-making-off-with-30-million.html
Florida Supreme Court approves ballot initiative on enshrining abortion rights in state constitution,https://english.elpais.com/usa/2024-04-02/florida-supreme-court-approves-ballot-initiative-on-enshrining-abortion-rights-in-state-constitution.html
The EU envoy for peace in the Middle East: ‘Cutting off access to water and food is illegal’,https://english.elpais.com/international/2024-04-05/the-eu-envoy-for-peace-in-the-middle-east-using-hunger-as-a-weapon-of-war-is-illegal.html
Israel withdraws ground troops from southern Gaza ,https://english.elpais.com/international/2024-04-07/israel-withdraws-ground-troops-from-southern-gaza.html
Argentina’s public sector unions challenge Milei,https://english.elpais.com/international/2024-04-04/argentinas-public-sector-unions-challenge-milei.html
"The murder of Gisela Gaytán:
A Mexican candidate with no bodyguards at the mercy of hitmen",https://english.elpais.com/international/2024-04-03/the-murder-of-gisela-gaytan-a-mexican-candidate-without-bodyguards-and-at-the-mercy-of-hitmen.html
An economic paradox: When savings are both a good and a bad idea,https://english.elpais.com/international/2024-03-16/the-middle-class-turns-out-the-lights-in-france.html
An economic paradox: When savings are both a good and a bad idea,https://english.elpais.com/economy-and-business/2024-03-16/china-steps-on-the-gas-in-the-mexican-auto-market-the-long-term-goal-is-the-us.html
Twisting the six strings: Guitars are once again electrifying jazz,https://english.elpais.com/culture/2024-04-03/twisting-the-six-strings-guitars-are-once-again-electrifying-jazz.html
"In a museum, the Netherlands reflects on its colonial past and recognizes that it has progressed because of slavery  ",https://english.elpais.com/culture/2024-04-03/in-a-museum-holland-reflects-on-its-colonial-past-and-recognizes-that-it-has-progressed-because-of-slavery.html
Ethnographer Kristen Ghodsee: ‘We are too tired to have an imagination’,https://english.elpais.com/lifestyle/2024-04-02/ethnographer-kristen-ghodsee-we-are-too-tired-to-have-an-imagination.html
Is regular exercise the solution for insomnia?,https://english.elpais.com/health/2024-04-03/is-regular-exercise-the-solution-for-insomnia.html
"Why is it so difficult to forgive, especially our parents?",https://english.elpais.com/lifestyle/2024-03-31/why-is-it-so-difficult-to-forgive-especially-our-parents.html
Here’s the deal: A little work for a ticket to Fiji,https://english.elpais.com/economy-and-business/2024-03-31/heres-the-deal-a-little-work-for-a-ticket-to-fiji.html
The Caitlin Clark effect is revolutionizing college basketball in the United States  ,https://english.elpais.com/sports/2024-03-20/the-caitlin-clark-effect-is-revolutionizing-college-basketball-in-the-united-states.html
2026 World Cup: What you need to know about the stadiums in the US ,https://english.elpais.com/sports/2024-03-15/2026-world-cup-what-you-need-to-know-about-the-stadiums-in-the-us.html
