headline,url
US Supreme Court upholds access to abortion pill in unanimous ruling,https://english.elpais.com/usa/2024-06-13/us-supreme-court-upholds-access-to-abortion-pill-in-unanimous-ruling.html
"Black, Latina and Native women are the tipped workers most exposed to poverty",https://english.elpais.com/usa/2024-06-13/black-latina-and-native-women-are-the-tipped-workers-most-exposed-to-poverty.html
San Diego’s Imperial  beach tops list of most polluted in the United States,https://english.elpais.com/usa/2024-06-13/san-diegos-beach-tops-list-of-most-polluted-in-the-united-states.html
"Andrew Garfield, the understated, all-purpose actor who’s back in the limelight ",https://english.elpais.com/people/2024-06-13/andrew-garfield-the-understated-all-purpose-actor-whos-back-in-the-limelight.html
What should you do if you find a rubber ducky on your car?,https://english.elpais.com/lifestyle/2024-06-13/what-should-you-do-if-you-find-a-rubber-ducky-on-your-car.html
Israelis who fled Hezbollah’s rockets eight months ago find themselves back under air raid sirens,https://english.elpais.com/international/2024-06-13/israelis-who-fled-hezbollahs-rockets-eight-months-ago-find-themselves-back-under-air-raid-sirens.html
A morgue in Ecuador struggles with over 200 rotting corpses of murder victims,https://english.elpais.com/international/2024-06-13/a-morgue-in-ecuador-struggles-with-over-200-rotting-corpses-of-murder-victims.html
Increase in armed conflicts causes record of 120 million displaced people in the world,https://english.elpais.com/international/2024-06-13/increase-in-armed-conflicts-causes-record-of-120-million-displaced-people-in-the-world.html
"Mirjana Spoljaric, president of the Red Cross Committee: ‘Gaza is a paradigm shift because of the high level of destruction’",https://english.elpais.com/international/2024-06-13/mirjana-spoljaric-president-of-the-red-cross-committee-gaza-is-a-paradigm-shift-because-of-the-high-level-of-destruction.html
MEPs in search of a political family cause anxiety in Brussels,https://english.elpais.com/international/2024-06-12/newly-elected-meps-in-search-of-a-political-family-cause-anxiety-in-brussels.html
Fecal transplant pill replaces antibiotics for serious infections for the first time,https://english.elpais.com/health/2024-06-13/fecal-transplant-pill-replaces-antibiotics-for-serious-infections-for-the-first-time.html
The 30-meter pass in the Pyrenees through which millions of insects migrate,https://english.elpais.com/climate/2024-06-13/the-30-meter-pass-in-the-pyrenees-through-which-millions-of-insects-migrate.html
"Bruce Hood, psychologist: ‘Happiness focused on oneself doesn’t go very far’",https://english.elpais.com/health/2024-06-12/bruce-hood-psychologist-happiness-focused-on-oneself-doesnt-go-very-far.html
"Fentanyl: What is it, what are its effects, how is it consumed and how does it cause an overdose?",https://english.elpais.com/usa/2024-06-12/fentanyl-what-is-it-what-are-its-effects-how-is-it-consumed-and-how-does-it-cause-an-overdose.html
Formerly incarcerated Latinos make their way in New York’s cannabis industry,https://english.elpais.com/society/2024-06-08/from-the-corner-to-a-dispensary-formerly-incarcerated-latinos-make-their-way-in-new-yorks-cannabis-industry.html
A hit like Coca-Cola: The cannabis industry generates $40 billion,https://english.elpais.com/economy-and-business/2024-06-08/a-hit-like-coca-cola-the-cannabis-industry-generates-40-billion.html
Keys to understanding Biden’s proposed marijuana reclassification,https://english.elpais.com/usa/2024-06-08/keys-to-understanding-bidens-proposed-marijuana-reclassification.html
"‘The high point of my life was not a movie’: Kevin Costner, a classic heartthrob in search of his last chance",https://english.elpais.com/people/2024-06-11/the-high-point-of-my-life-was-not-a-movie-kevin-costner-a-classic-heartthrob-in-search-of-his-last-chance.html
DNA uncovers the mystery of the children sacrificed by the Mayans in Chichén Itzá,https://english.elpais.com/culture/2024-06-12/dna-uncovers-the-mystery-of-the-children-sacrificed-by-the-mayans-in-chichen-itza.html
Why the skies are changing,https://english.elpais.com/science-tech/2024-06-11/why-the-skies-are-changing.html
Elephants address each other with name-like calls,https://english.elpais.com/science-tech/2024-06-10/elephants-address-one-another-with-name-like-calls.html
One in five children is overweight,https://english.elpais.com/health/2024-06-11/one-in-five-children-is-overweight.html
"Branko Milanovic, the political economist of global inequality",https://english.elpais.com/economy-and-business/2024-06-11/branko-milanovic-the-political-economist-of-global-inequality.html
From a pizzeria in Mexico to flooding Europe with fast food: Alsea is growing at a rate of 100 openings a year,https://english.elpais.com/economy-and-business/2024-06-04/from-a-pizzeria-in-mexico-to-flooding-europe-with-fast-food-alsea-is-growing-at-a-rate-of-100-openings-a-year.html
Global South pays more to service its debt than it receives in development aid,https://english.elpais.com/economy-and-business/2024-05-27/global-south-pays-more-to-service-its-debt-than-it-receives-in-development-aid.html
California minimum wage: What you should know about the change in 2024,https://english.elpais.com/economy-and-business/2024-06-08/california-minimum-wage-what-you-should-know-about-the-change-in-2024.html
"Kermit the Frog, ‘Eric’ and other stories from the mean streets of 1980s New York",https://english.elpais.com/culture/2024-06-11/kermit-the-frog-eric-and-other-stories-from-the-mean-streets-of-1980s-new-york.html
In the ‘morgue’ of ‘The New York Times’,https://english.elpais.com/culture/2024-06-11/in-the-morgue-of-the-new-york-times.html
"The pilot episode, an American television tradition in danger of extinction",https://english.elpais.com/culture/2024-06-09/the-pilot-episode-an-american-television-tradition-in-danger-of-extinction.html
‘Born in the U.S.A.’ at 40: When Bruce Springsteen ruled the rock world and refused to become the voice of Republicans,https://english.elpais.com/culture/2024-06-08/born-in-the-usa-at-40-when-bruce-springsteen-ruled-the-rock-world-and-refused-to-become-the-voice-of-republicans.html
‘Hit Man’: A nonsensical script with very little flair,https://english.elpais.com/culture/2024-06-07/hit-man-a-nonsensical-script-with-very-little-flair.html
Why scantily clad ‘booth babes’ are still a draw at tech fairs like Computex,https://english.elpais.com/technology/2024-06-12/why-scantily-clad-booth-babes-are-still-a-draw-at-tech-fairs-like-computex.html
"What is talent, and how do we use it at work?",https://english.elpais.com/lifestyle/2024-06-09/what-is-talent-and-how-do-we-use-it-at-work.html
"For the women of ancient Rome, underwear was hardly sexy",https://english.elpais.com/culture/2024-06-09/no-fancy-lingerie-at-the-forum-for-the-women-of-ancient-rome-underwear-was-hardly-sexy.html
Existential doubts? Go see a philosopher instead of a psychologist,https://english.elpais.com/society/2024-06-09/existential-doubts-go-see-a-philosopher-instead-of-a-psychologist.html
How are Taylor Swift’s ‘tortured poets’ handling the heat?,https://english.elpais.com/people/2024-06-10/how-are-taylor-swifts-tortured-poets-handling-the-heat.html
Kate Hudson morphs from movie to rock star at 45: ‘They told me I was too old’ ,https://english.elpais.com/people/2024-06-10/kate-hudson-morphs-from-movie-to-rock-star-at-45-they-told-me-i-was-too-old.html
"The ‘Saltburn’ effect, or the dangers of renting out your castle to a film or TV crew",https://english.elpais.com/culture/2024-06-05/the-saltburn-effect-or-the-dangers-of-renting-out-your-castle-to-a-film-or-tv-crew.html
"Kendall and Kylie Jenner’s vacation in Mallorca: Beer, walks and sunsets",https://english.elpais.com/people/2024-06-05/kendall-and-kylie-jenners-vacation-in-mallorca-beer-walks-and-sunsets.html
Rafa Nadal and Carlos Alcaraz: Spain confirms doubles dream team for Paris Olympics,https://english.elpais.com/sports/olympic-games/2024-06-12/rafa-nadal-and-carlos-alcaraz-spain-confirms-doubles-dream-team-for-paris-olympics.html
The challenge of Puerto Rico’s Arecibo Observatory: What will fill the void left by the world’s most powerful radio telescope?,https://english.elpais.com/science-tech/2024-06-12/the-challenge-of-puerto-ricos-arecibo-observatory-what-will-fill-the-void-left-by-the-worlds-most-powerful-radio-telescope.html
Mass arrests and forced transfers: How migrants are exiled in North Africa with European money,https://english.elpais.com/international/2024-06-01/mass-arrests-and-forced-transfers-how-migrants-are-exiled-in-north-africa-with-european-money.html
Summer 2024 is a death threat for US agricultural workers,https://english.elpais.com/usa/2024-06-01/summer-2024-is-a-death-threat-for-us-agricultural-workers.html
"The Dreamers of a decade ago are today teachers, nurses, journalists, lawyers — but still lack US citizenship",https://english.elpais.com/usa/2024-06-10/the-dreamers-of-a-decade-ago-are-today-teachers-nurses-journalists-lawyers-but-still-lack-us-citizenship.html
Listen now LOS40 USA,https://los40.us/
Top 10 Most Listened to Latina Artists in 2024,https://los40.us/2024/top-10-most-listened-to-latina-artists-in-2024-21469.html
Karol G Accidentally ‘Steals’ Fan’s Phone in Germany: Watch,https://los40.us/2024/karol-gs-steals-fans-phone-germany-21431.html
EL PAÍS offers free Spanish lessons with Gymglish,https://english.elpais.com/economy-and-business/2021-11-15/el-pais-offers-free-spanish-lessons-with-gymglish.html
Gaza war pushes US-Israel relations to ‘unprecedented low point’,https://english.elpais.com/usa/elections/2024-06-03/the-billionaires-who-abandoned-trump-rush-back-to-his-side-despite-guilty-verdict.html
Vermont passes bill to make oil companies pay for climate change,https://english.elpais.com/climate/2024-05-10/vermont-passes-bill-to-make-oil-companies-pay-for-climate-change.html
Socialist victory in Catalan election closes the door on separatist movement,https://english.elpais.com/international/2024-05-13/socialist-victory-in-catalan-election-closes-the-door-on-separatist-movement.html
Sergeant Petrichenko’s posthumous victory: Ukraine bans gambling in the army,https://english.elpais.com/international/2024-04-23/sergeant-petrichenkos-posthumous-victory-ukraine-bans-gambling-in-the-army.html
A surge of violence in a small town in Ecuador is met with a strategy of war,https://english.elpais.com/international/2024-06-04/a-surge-of-violence-in-a-small-town-in-ecuador-is-met-with-a-strategy-of-war.html
Argentina opposition questions Milei’s use of public funds to pay for trips abroad,https://english.elpais.com/international/2024-05-21/argentina-opposition-questions-mileis-use-of-public-funds-to-pay-for-trips-abroad.html
The ‘Ghostbusters project’ or how Facebook planned to spy on Snapchat users,https://english.elpais.com/technology/2024-05-08/the-ghostbusters-project-or-how-facebook-planned-to-spy-on-snapchat-users.html
An economic paradox: When savings are both a good and a bad idea,https://english.elpais.com/economy-and-business/2024-05-06/teslas-plans-in-mexico-are-not-dead-theyve-just-lost-steam.html
"Isabel Allende: ‘It would be terrible for the United States, and for humanity, if Trump were to be elected president again’ ",https://english.elpais.com/culture/2024-06-01/isabel-allende-it-would-be-terrible-for-the-united-states-and-for-humanity-if-trump-were-to-be-elected-president-again.html
"Barbara Kingsolver, writer: ‘You buy a book to take a break, not to be taught a lesson’  ",https://english.elpais.com/culture/2024-05-11/barbara-kingsolver-writer-you-buy-a-book-to-take-a-break-not-to-be-taught-a-lesson.html
Generative AI digs the graves of traditional search engines and virtual assistants,https://english.elpais.com/technology/2024-05-26/generative-ai-digs-the-graves-of-traditional-search-engines-and-virtual-assistants.html
Diabetes drugs test a new side effect: slowing down symptoms of Parkinson’s ,https://english.elpais.com/science-tech/2024-05-01/diabetes-drugs-test-a-new-side-effect-slowing-down-symptoms-of-parkinsons.html
Life after orgasm: What happens to the body and mind after reaching climax,https://english.elpais.com/lifestyle/2024-04-30/life-after-orgasm-what-happens-to-the-body-and-mind-after-reaching-climax.html
A wolf in IT’s clothing: Why Mark Zuckerberg’s style choices matter  ,https://english.elpais.com/technology/2024-04-28/a-wolf-in-its-clothing-why-mark-zuckerbergs-style-choices-matter.html
"The finest political hour of Sócrates, one of the most unique footballers Brazil ever produced",https://english.elpais.com/international/2024-04-25/the-finest-political-hour-of-socrates-one-of-the-most-unique-footballers-brazil-ever-produced.html
Korbin Albert: A contrarian view sneaks into the US women’s national soccer team,https://english.elpais.com/sports/2024-04-29/korbin-albert-a-contrarian-view-sneaks-into-the-us-womens-national-soccer-team.html
