headline,url
‘Fascist!’ ‘Enemy within!’: Polarization intensifies in final stretch of US election,https://english.elpais.com/usa/elections/2024-10-21/fascist-enemy-within-polarization-intensifies-in-final-stretch-of-us-election.html
Free but disenfranchised: The struggle of four million ex-convicts to regain their political voice,https://english.elpais.com/usa/elections/2024-10-21/free-citizens-but-disenfranchised-the-struggle-of-four-million-ex-convicts-to-regain-their-political-voice.html
"An inside look at Elon Musk’s rallies: Rockets to Mars, conspiracy theories and a lot of Trumpism",https://english.elpais.com/usa/elections/2024-10-21/an-inside-look-at-elon-musks-rallies-rockets-to-mars-conspiracy-theories-and-a-lot-of-trumpism.html
North Carolina: Voting amid conspiracy theories and the hurricane aftermath ,https://english.elpais.com/usa/elections/2024-10-21/north-carolina-voting-amid-conspiracy-theories-and-the-hurricane-aftermath.html
"Sleeping like Paris Hilton: The heiress designs a suite in her family hotel for $1,111 a night",https://english.elpais.com/lifestyle/2024-10-21/living-and-sleeping-like-paris-hilton-the-heiress-designs-a-suite-in-her-family-hotel-for-1111-a-night.html
"The Jesus and Mary Chain, the brothers who hated each other before Oasis",https://english.elpais.com/culture/2024-10-21/the-jesus-and-mary-chain-the-brothers-who-hated-each-other-before-oasis.html
Los Chapitos’ lawyer confirms Joaquín and Ovidio Guzmán are considering a plea deal with the United States,https://english.elpais.com/international/2024-10-21/los-chapitos-lawyer-confirms-joaquin-and-ovidio-guzman-are-negotiating-deal-with-the-united-states.html
Luxury handbag found in Gaza tunnel stars in Israel’s latest campaign against Hamas,https://english.elpais.com/international/2024-10-21/luxury-handbag-found-in-gaza-tunnel-stars-in-israels-latest-campaign-against-hamas.html
Ukraine does not have enough soldiers to stop Russia,https://english.elpais.com/international/2024-10-21/ukraine-does-not-have-enough-soldiers-to-stop-russia.html
"Meet the Seminoles, owners of Hard Rock Café and its cornucopia of casino and hotel properties  ",https://english.elpais.com/economy-and-business/2024-10-20/meet-the-seminoles-owners-of-hard-rock-cafe-and-its-cornucopia-of-casino-and-hotel-properties.html
Breaking with Guatemala’s authoritarian past,https://english.elpais.com/international/2024-10-21/breaking-with-guatemalas-authoritarian-past.html
Cuba’s obsolete electricity infrastructure is keeping the country in the dark,https://english.elpais.com/international/2024-10-21/cubas-obsolete-electricity-infrastructure-is-keeping-the-country-in-the-dark.html
The Evo Morales case: When sexual violence against women gets stuck in the political mud ,https://english.elpais.com/international/2024-10-20/the-evo-morales-case-when-sexual-violence-against-women-gets-stuck-in-the-political-mud.html
Don Norman: ‘Apple has fallen prey to the most disastrous part of design’,https://english.elpais.com/culture/2024-10-20/don-norman-apple-has-fallen-prey-to-the-most-disastrous-part-of-design-which-thinks-its-about-making-something-beautiful-and-elegant.html
A guide to COP16 in Colombia,https://english.elpais.com/climate/2024-10-21/a-guide-to-cop21-in-colombia.html
"Kerry Washington: ‘The United States is ready to turn the page on the culture of hate, fear, racism and bullying’",https://english.elpais.com/culture/2024-10-19/kerry-washington-the-united-states-is-ready-to-turn-the-page-on-the-culture-of-hate-fear-racism-and-bullying.html
"Paola Ricaurte, researcher: ‘Large technology companies are allies of authoritarian governments’  ",https://english.elpais.com/international/women-leaders-of-latin-america/2024-10-19/paola-ricaurte-researcher-large-technology-companies-are-allies-of-authoritarian-governments.html
"Stephen Ibaraki, international tech consultant: ‘We need to prepare for what will happen in five years’",https://english.elpais.com/technology/2024-10-14/stephen-ibaraki-international-tech-consultant-we-need-to-prepare-for-what-will-happen-in-five-years.html
From cloning to CRISPR: The center that created Dolly designs epidemic-resistant animals,https://english.elpais.com/science-tech/2024-10-13/from-cloning-to-crispr-the-center-that-created-dolly-designs-epidemic-resistant-animals.html
AI’s black box problem: Why is it still indecipherable to researchers,https://english.elpais.com/technology/2024-10-15/ais-black-box-problem-why-is-it-still-indecipherable-to-researchers.html
"Terence Tao, mathematician: ‘It’s not good for something as important as AI to be a monopoly held by one or two companies’",https://english.elpais.com/science-tech/2024-10-12/terence-tao-mathematician-its-not-good-for-something-as-important-as-ai-to-be-a-monopoly-held-by-one-or-two-companies.html
Trump’s proposed mass deportations could ‘decimate’ US food supply,https://english.elpais.com/usa/elections/2024-10-15/trumps-proposed-mass-deportations-could-decimate-the-us-food-supply.html
Iron falls like lead: The problem facing the commodities market,https://english.elpais.com/economy-and-business/2024-10-15/iron-falls-like-lead-the-problem-facing-the-commodities-market.html
Trade wars also have winners: Vietnam and Mexico,https://english.elpais.com/economy-and-business/2024-10-13/trade-wars-also-have-winners-vietnam-and-mexico.html
The female rebels of the Spanish empire: The women who armed America’s fight for independence,https://english.elpais.com/culture/2024-10-20/the-female-rebels-of-the-spanish-empire-the-women-who-armed-americas-fight-for-independence.html
"Al Pacino, memoirs of a survivor from the Bronx",https://english.elpais.com/culture/2024-10-18/al-pacino-memoirs-of-a-survivor-from-the-bronx.html
Elizabeth Taylor was fed up with her own beauty,https://english.elpais.com/culture/2024-10-18/elizabeth-taylor-was-fed-up-with-her-own-beauty.html
"From Reagan to Trump, a movie marathon before the US elections",https://english.elpais.com/culture/2024-10-19/from-reagan-to-trump-a-movie-marathon-before-the-us-elections.html
"Coralie Fargeat, director of ‘The Substance’: ‘Demi Moore was willing to take the risks of exposing herself, of getting naked’",https://english.elpais.com/culture/2024-10-15/coralie-fargeat-director-of-the-substance-demi-moore-was-willing-to-take-the-risks-of-exposing-herself-of-getting-naked.html
"Can dogs suffer from depression too, or is it just a human issue?",https://english.elpais.com/lifestyle/2024-10-20/can-dogs-suffer-from-depression-too-or-is-it-just-a-human-issue.html
"‘Pretty girls love Jesus’: From Hakuna to Generation God, Christian fashion brands for young people are on the rise",https://english.elpais.com/culture/2024-10-19/pretty-girls-love-jesus-from-hakuna-to-generation-god-christian-fashion-brands-for-young-people-are-on-the-rise.html
Why is excessive optimism worse than being sad?,https://english.elpais.com/lifestyle/2024-10-13/why-is-excessive-optimism-worse-than-being-sad.html
"What sports science has to say about CrossFit, a challenge for transforming bodies and minds  ",https://english.elpais.com/lifestyle/2024-10-12/what-sports-science-has-to-say-about-crossfit-a-challenge-for-transforming-bodies-and-minds.html
Non-alcoholic beer: Tom Holland’s new business venture after almost three years of sobriety,https://english.elpais.com/people/2024-10-18/non-alcoholic-beer-tom-hollands-new-business-venture-after-almost-three-years-of-sobriety.html
"‘The Apprentice’: The origin story of Donald Trump, a man lacking his own ideology ",https://english.elpais.com/culture/2024-10-11/the-apprentice-the-origin-story-of-donald-trump-a-man-lacking-his-own-ideology.html
"How Blake Lively became the most hated person on the internet, in five steps",https://english.elpais.com/culture/2024-10-09/how-blake-lively-became-the-most-hated-person-on-the-internet-in-five-steps.html
One Direction fans gather in Buenos Aires to pay tribute to Liam Payne: ‘He was part of our adolescence’,https://english.elpais.com/people/2024-10-17/one-direction-fans-gather-in-buenos-aires-to-pay-tribute-to-liam-payne-he-was-part-of-our-adolescence.html
Shopping in Trump Town: A journey to the center of the Trumpist universe,https://english.elpais.com/usa/elections/2024-10-20/shopping-in-trump-town-a-journey-to-the-center-of-the-trumpist-universe.html
"Helicopter pads, infinity pools and wine cellars at 400 feet: The growing fever to build mansions in the sky  ",https://english.elpais.com/lifestyle/2024-10-13/helicopter-pads-infinity-pools-and-wine-cellars-at-400-feet-the-growing-fever-to-build-mansions-in-the-sky.html
Palestinian cartoonist Mohammad Sabaaneh: ‘The blood on the streets of Gaza cannot be erased from our memory’,https://english.elpais.com/culture/2024-10-15/palestinian-cartoonist-mohammad-sabaaneh-the-blood-on-the-streets-of-gaza-cannot-be-erased-from-our-memory.html
María Hinojosa: ‘It would be incredible to have two women leading North America with an inclusive and female vision’,https://english.elpais.com/usa/elections/2024-10-19/maria-hinojosa-it-would-be-incredible-to-have-two-women-leading-north-america-with-an-inclusive-and-female-vision.html
Listen now LOS40 USA,https://los40.us/
2024 Latin Grammy Performances Announced: Full List of Artists,https://los40.us/2024/2024-latin-grammy-performances-announced-full-list-of-artists-25919.html
"Shakira Announces New U.S. ‘Las Mujeres Ya No Lloran’ Tour in 2025: Dates, Tickets, Cities…",https://los40.us/2024/shakira-announces-new-u-s-las-mujeres-ya-no-lloran-world-tour-in-2025-dates-tickets-cities-25926.html
EL PAÍS offers free Spanish lessons with Gymglish,https://english.elpais.com/economy-and-business/2021-11-15/el-pais-offers-free-spanish-lessons-with-gymglish.html
Hoaxes and threats force North Carolina to reorganize Hurricane Helene relief operations,https://english.elpais.com/usa/2024-10-15/hoaxes-and-threats-force-north-carolina-to-reorganize-hurricane-helene-relief-operations.html
US Supreme Court enters fourth year of conservative revolution with possible Trump cases on horizon,https://english.elpais.com/usa/elections/2024-10-07/us-supreme-court-enters-fourth-year-of-conservative-revolution-with-possible-trump-cases-on-horizon.html
Sinwar’s death presents Netanyahu with an opportunity to reach a Gaza ceasefire deal,https://english.elpais.com/international/2024-10-18/sinwars-death-presents-netanyahu-with-an-opportunity-to-reach-a-gaza-ceasefire-deal.html
"A summer away from the bombing of Ukraine, thanks to the Spanish province of Jaén",https://english.elpais.com/international/2024-10-18/putin-warns-he-will-not-allow-ukraine-to-have-nuclear-weapons-under-any-circumstances.html
Passing the knowledge: How Ogiek peoples conserve medicinal plants for future generations,https://english.elpais.com/culture/2024-10-11/passing-the-knowledge-how-ogiek-peoples-conserve-medicinal-plants-for-future-generations.html
Venezuela kicks off its most uncertain presidential campaign,https://english.elpais.com/international/2024-10-07/the-latest-attack-by-the-cuban-government-against-independent-journalists-interrogations-threats-confiscations-and-exile.html
From self-driving cars in 2017 to a million robotaxis in 2020: Will the Cybercab be another one of Elon Musk’s unfulfilled promises?,https://english.elpais.com/technology/2024-10-11/from-self-driving-cars-in-2017-to-a-million-robotaxis-in-2020-will-the-cybercab-be-another-one-of-elon-musks-unfulfilled-promises.html
An economic paradox: When savings are both a good and a bad idea,https://english.elpais.com/economy-and-business/2024-10-03/the-shadow-of-hormuz-why-oil-prices-are-finally-reacting-to-middle-east-crisis.html
Megan Fox: ‘The Hollywood of my time was a misogynistic hell’,https://english.elpais.com/culture/2024-10-05/megan-fox-the-hollywood-of-my-time-was-a-misogynistic-hell.html
"Yalitza Aparicio: ‘When you get another perspective on life, you discover things you weren’t taught growing up’  ",https://english.elpais.com/international/2024-10-12/yalitza-aparicio-when-you-get-another-perspective-on-life-you-discover-things-you-werent-taught-growing-up.html
"Lucy Gilson, researcher: ‘The health system is a picture of how we live on the planet’",https://english.elpais.com/health/2024-10-11/lucy-gilson-researcher-the-health-system-is-a-picture-of-how-we-live-on-the-planet.html
CERN trains AI models to revolutionize cancer treatment,https://english.elpais.com/health/2024-10-05/cern-trains-ai-models-to-revolutionize-cancer-treatment.html
A psychoanalyst in search of the logic of the absurd,https://english.elpais.com/health/2024-10-03/a-psychoanalyst-in-search-of-the-logic-of-the-absurd.html
"Get up, stand up: How a job that ties us to a chair affects our body",https://english.elpais.com/lifestyle/2024-10-01/get-up-stand-up-how-a-job-that-ties-us-to-a-chair-affects-our-body.html
An ‘Olympics’ that allows doping? A billionaire’s controversial dream that could change sport forever,https://english.elpais.com/sports/2024-09-18/an-olympics-that-allows-doping-a-billionaires-controversial-dream-that-could-change-sport-forever.html
"Climbing without a rope, between freedom and psychopathy",https://english.elpais.com/sports/2024-09-11/steve-kerr-no-company-in-the-world-would-hire-someone-with-trumps-resume.html
