headline,url
Migrants seeking to reach the US before Trump takes office run up against Biden’s closed border,https://english.elpais.com/usa/2024-11-20/migrants-seeking-to-reach-the-us-before-trump-takes-office-run-up-against-bidens-closed-border.html
Brazil’s G20 summit ends with minimal consensus under Trump’s shadow,https://english.elpais.com/international/2024-11-20/brazils-g20-summit-ends-with-minimal-consensus-under-trumps-shadow.html
US recognizes Edmundo González as ‘president-elect’ of Venezuela,https://english.elpais.com/international/2024-11-20/us-recognizes-edmundo-gonzalez-as-president-elect-of-venezuela.html
Gaza aid looting surges amid chaos of Israeli incursion ,https://english.elpais.com/international/2024-11-20/gaza-aid-looting-surges-amid-chaos-of-israeli-incursion.html
"Demis Hassabis, Nobel Prize winner in Chemistry: ‘We will need a handful of breakthroughs before we reach AGI’",https://english.elpais.com/science-tech/2024-11-20/demis-hassabis-nobel-prize-winner-in-chemistry-we-will-need-a-handful-of-breakthroughs-before-we-reach-artificial-general-intelligence.html
"More than 3,600 scientists are building a manual of all human cells",https://english.elpais.com/science-tech/2024-11-20/more-than-3600-scientists-are-building-a-manual-of-all-human-cells-a-google-maps-of-biology.html
"Daniel Clowes, a comic book artist who portrays American pathos: ‘I am angry and appalled’",https://english.elpais.com/culture/2024-11-20/daniel-clowes-a-comic-book-artist-who-portrays-american-pathos-i-am-angry-and-appalled.html
From bloody attacks to donations in schools: How gangs plan to gain power in Haiti,https://english.elpais.com/international/2024-11-20/from-bloody-attacks-to-donations-in-schools-how-gangs-plan-to-gain-power-in-haiti.html
The eternal wait at the EU’s largest refugee center in the former Berlin airport,https://english.elpais.com/international/2024-11-19/the-eternal-wait-at-the-eus-largest-refugee-center-in-the-former-berlin-airport.html
"Pete Hegseth, the Fox host accused of sexual assault who wants to end diversity policies in the US military",https://english.elpais.com/usa/elections/2024-11-19/pete-hegseth-the-fox-host-accused-of-sexual-assault-who-wants-to-end-diversity-policies-in-the-us-military.html
US missiles inside Russia: A major political decision with limited impact on Ukraine war,https://english.elpais.com/international/2024-11-19/us-missiles-inside-russia-a-major-political-decision-with-limited-impact-on-ukraine-war.html
Scavengers hold the secret to fighting infections,https://english.elpais.com/science-tech/2024-11-20/scavengers-hold-the-secret-to-fighting-infections.html
Morocco sends help to flood-hit Valencia: ‘They are soldiers of the Sahara who work without stopping to eat or rest’,https://english.elpais.com/spain/2024-11-19/morocco-sends-help-to-flood-hit-valencia-they-are-soldiers-of-the-sahara-who-work-without-stopping-to-eat-or-rest.html
"Julia Bullock, soprano: ‘Violence underscores the culture of the United States. I am so relieved to not have to live there anymore’",https://english.elpais.com/culture/2024-11-20/julia-bullock-soprano-violence-underscores-the-culture-of-the-united-states-i-am-so-relieved-to-not-have-to-live-there-anymore.html
Cher publishes (but doesn’t read) her memoirs: From living in an orphanage to Sonny Bono’s betrayal,https://english.elpais.com/people/2024-11-20/cher-publishes-but-doesnt-read-her-memoirs-from-living-in-an-orphanage-to-sonny-bonos-betrayal.html
"Alan Mislove, researcher: ‘There are technology companies with an incredible influence on how we speak and think’",https://english.elpais.com/technology/2024-11-19/alan-mislove-researcher-there-are-technology-companies-with-an-incredible-influence-on-how-we-speak-and-think.html
"‘At work, I was a machine, more productive’: Why do people take drugs in the office?",https://english.elpais.com/society/2024-11-19/at-work-i-was-a-machine-more-productive-why-do-people-take-drugs-in-the-office.html
"Grandiose luxury and 1,400 dead workers: The palace that wanted to be bigger than the Vatican",https://english.elpais.com/culture/2024-11-19/grandiose-luxury-and-1400-dead-workers-the-palace-that-wanted-to-be-bigger-than-the-vatican.html
The dirt on biocrusts: Why scientists are working to save Earth’s living skin ,https://english.elpais.com/science-tech/2024-11-18/the-dirt-on-biocrusts-why-scientists-are-working-to-save-earths-living-skin.html
New antibiotic resistance gene discovered hidden in the microbiome,https://english.elpais.com/science-tech/2024-11-18/new-antibiotic-resistance-gene-discovered-hidden-in-the-microbiome.html
An intact 80-million-year-old fossil is the ‘Rosetta Stone’ that promises to decipher bird evolution,https://english.elpais.com/science-tech/2024-11-18/an-intact-80-million-year-old-fossil-is-the-rosetta-stone-that-promises-to-decipher-bird-evolution.html
Obesity has memory and retains it in cells,https://english.elpais.com/health/2024-11-18/obesity-has-memory-and-retains-it-in-cells.html
Workers fear the age of robots: Will a machine take my job?,https://english.elpais.com/economy-and-business/2024-11-17/workers-fear-the-age-of-robots-will-a-machine-take-my-job.html
Dutch 24-year-old who swindled crime bosses with cryptocurrencies is arrested in Marbella,https://english.elpais.com/international/2024-11-15/dutch-24-year-old-who-swindled-crime-bosses-with-cryptocurrencies-is-arrested-in-marbella.html
"Nestlé and Coca-Cola, a high-octane divorce  ",https://english.elpais.com/economy-and-business/2024-11-11/nestle-and-coca-cola-a-high-octane-divorce.html
"Biden leaves Trump a booming economy, with almost no unemployment and inflation under control",https://english.elpais.com/usa/elections/2024-11-08/biden-leaves-trump-a-booming-economy-with-almost-no-unemployment-and-inflation-under-control.html
"Samuel L. Jackson, the activist who became the highest-grossing actor in history",https://english.elpais.com/culture/2024-11-18/samuel-l-jackson-the-activist-who-became-the-highest-grossing-actor-in-history.html
"Saoirse Ronan, Greta Gerwig’s discreet muse who made a splash by silencing three movie stars (and Graham Norton)",https://english.elpais.com/culture/2024-11-19/saoirse-ronan-greta-gerwigs-discreet-muse-who-made-a-splash-by-silencing-three-movie-stars-and-graham-norton.html
Danny DeVito’s final revenge: Hollywood’s ‘funny short guy’ gets the last laugh at age 80,https://english.elpais.com/culture/2024-11-18/danny-devitos-final-revenge-hollywoods-funny-short-guy-gets-the-last-laugh-at-age-80.html
From a Jesus Christ sensei to Muslim converts: Inside the strange new wave of Christian cinema ,https://english.elpais.com/culture/2024-11-18/from-a-jesus-christ-sensei-to-muslim-converts-inside-the-strange-new-wave-of-ultra-catholic-cinema.html
Romanesque churches’ explicitly sexual carvings were ‘the nobility’s political propaganda’,https://english.elpais.com/culture/2024-11-18/romanesque-churches-explicitly-sexual-carvings-were-the-nobilitys-political-propaganda.html
‘I got tired of so many gifs’: How digital communication can impact age-gap relationships,https://english.elpais.com/lifestyle/2024-11-16/i-got-tired-of-so-many-gifs-how-digital-communication-can-impact-age-gap-relationships.html
"Individualism, cell phones and social fatigue: Why unexpected visitors are in danger of extinction ",https://english.elpais.com/society/2024-11-10/individualism-cell-phones-and-social-fatigue-why-unexpected-visitors-are-in-danger-of-extinction.html
From gym bros to Funko collectors: Why a generation of men are avoiding growing up,https://english.elpais.com/lifestyle/2024-11-09/from-gym-bros-to-funko-collectors-why-a-generation-of-men-are-avoiding-growing-up.html
Working standing up does not reduce cardiovascular risk or compensate for a sedentary lifestyle,https://english.elpais.com/lifestyle/2024-11-14/working-standing-up-does-not-reduce-cardiovascular-risk-or-compensate-for-a-sedentary-lifestyle.html
"‘Interview with the Vampire,’ the Tom Cruise hit that almost derailed",https://english.elpais.com/culture/2024-11-16/watered-down-homoeroticism-an-inappropriate-kiss-and-a-furious-novelist-interview-with-the-vampire-the-tom-cruise-hit-that-almost-derailed.html
The women of the reactionary wave: ‘What’s wrong with being submissive?’  ,https://english.elpais.com/culture/2024-11-16/the-women-of-the-reactionary-wave-whats-wrong-with-being-submissive.html
‘I strangely somewhere inside knew and kind of wanted to go to jail’: Lindsay Lohan’s Hollywood comeback,https://english.elpais.com/people/2024-11-17/i-strangely-somewhere-inside-knew-and-kind-of-wanted-to-go-to-jail-lindsay-lohans-hollywood-comeback.html
‘Gladiator II’: Sequels are almost never better. Confirmed,https://english.elpais.com/culture/2024-11-15/gladiator-ii-sequels-are-almost-never-better-confirmed.html
"When cocaine ruled the NBA: ‘Drugs were everywhere, it was like a fad’",https://english.elpais.com/sports/2024-11-06/when-cocaine-ruled-the-nba-drugs-were-everywhere-it-was-like-a-fad.html
The endless denigration of the natives of Tierra del Fuego: Displayed in zoos and museums in Europe,https://english.elpais.com/international/2024-11-17/the-endless-denigration-of-the-natives-of-tierra-del-fuego-displayed-in-zoos-and-museums-in-europe.html
Stolen children return to Guatemala to learn the truth  ,https://english.elpais.com/international/2024-11-16/stolen-children-return-to-guatemala-to-learn-the-truth.html
The dark history of Frank Sinatra’s mansion,https://english.elpais.com/culture/2024-11-17/the-dark-history-of-frank-sinatras-mansion-the-rat-packs-gambling-and-alleged-encounters-between-marilyn-monroe-and-john-f-kennedy.html
‘You can’t die over a sneaker’: Armed teenagers terrorize Naples,https://english.elpais.com/international/2024-11-12/you-cant-die-over-a-sneaker-armed-teenagers-terrorize-naples.html
Listen now LOS40 USA,https://los40.us/
One Direction Reunites at Liam Payne’s Funeral,https://los40.us/2024/one-direction-reunites-at-liam-paynes-funeral-26733.html
‘Qué Pasaría’: The Meaning Behind Rauw Alejandro’s Song Presented on The Tonight Show by Jimmy Fallon,https://los40.us/2024/que-pasaria-the-meaning-behind-rauw-alejandros-song-presented-on-the-tonight-show-by-jimmy-fallon-26727.html
EL PAÍS offers free Spanish lessons with Gymglish,https://english.elpais.com/economy-and-business/2021-11-15/el-pais-offers-free-spanish-lessons-with-gymglish.html
"Elon Musk, the president’s ‘First Buddy’",https://english.elpais.com/usa/elections/2024-11-18/elon-musk-the-presidents-first-buddy.html
Wave of racist messages sent after Trump’s victory raises alarm,https://english.elpais.com/usa/elections/2024-11-13/wave-of-racist-messages-sent-after-trumps-victory-raises-alarm.html
Ukraine deploys its best units to stage long-term resistance on Russian soil,https://english.elpais.com/international/2024-11-11/ukraine-deploys-its-best-units-to-stage-long-term-resistance-on-russian-soil.html
Israel cuts off humanitarian aid to Gaza,https://english.elpais.com/international/2024-11-05/israel-cuts-off-humanitarian-aid-to-gaza.html
José Rubén Zamora: ‘My two years in prison explain Guatemala better than my 30 years in the press’  ,https://english.elpais.com/international/2024-11-10/jose-ruben-zamora-my-two-years-in-prison-explain-guatemala-better-than-my-30-years-in-the-press.html
Venezuela kicks off its most uncertain presidential campaign,https://english.elpais.com/international/2024-11-08/the-downfall-of-marilyn-cote-the-fake-mexican-psychiatrist-who-claimed-to-cure-depression-in-seven-days.html
The return of carry trade in Argentina: A financial maneuver generating 50% profit in dollars  ,https://english.elpais.com/economy-and-business/2024-11-02/the-return-of-carry-trade-in-argentina-a-financial-maneuver-generating-50-profit-in-dollars.html
An economic paradox: When savings are both a good and a bad idea,https://english.elpais.com/economy-and-business/2024-10-30/the-dead-end-of-chips-manufacturing-semiconductors-consumes-as-much-energy-as-entire-countries.html
"The 27 Club is real, even if it’s not true that celebrities are more likely to die at that age",https://english.elpais.com/science-tech/2024-11-05/the-27-club-is-real-even-if-its-not-true-that-celebrities-are-more-likely-to-die-at-that-age.html
DNA rewrites the history of Pompeii: The woman with the bracelet was a man and unrelated to the child on her lap ,https://english.elpais.com/science-tech/2024-11-07/dna-rewrites-the-history-of-pompeii-the-woman-with-the-bracelet-was-a-man-and-unrelated-to-the-child-on-her-lap.html
"The legacy of Lucy, the ‘Australopithecus’ that changed our idea of human evolution 50 years ago",https://english.elpais.com/science-tech/2024-11-12/the-legacy-of-lucy-the-australopithecus-that-changed-our-idea-of-human-evolution-50-years-ago.html
The AI sexualization of the Vatican’s mascot and the limits of Rule 34: Everything on the internet can be ‘pornified’,https://english.elpais.com/technology/2024-11-13/the-ai-sexualization-of-the-vaticans-mascot-and-the-limits-of-rule-34-everything-on-the-internet-can-be-pornified.html
‘A devastating cocktail for the face’: Is Ozempic aging us prematurely?  ,https://english.elpais.com/lifestyle/2024-11-02/a-devastating-cocktail-for-the-face-is-ozempic-aging-us-prematurely.html
A ‘don’t text your ex’ shirt and divorce rings: Fashion leads a break-up paradigm shift,https://english.elpais.com/lifestyle/2024-10-25/a-dont-text-your-ex-shirt-and-divorce-rings-fashion-leads-a-break-up-paradigm-shift.html
"Racism, sexism and LGBTQphobia tarnish the rise of women’s basketball in the US",https://english.elpais.com/sports/2024-11-04/racism-sexism-and-lgbtqphobia-tarnish-the-rise-of-womens-basketball-in-the-us.html
"Climbing without a rope, between freedom and psychopathy",https://english.elpais.com/sports/2024-10-22/the-celtics-and-the-curse-of-the-champion.html
