headline,url
The year the world peered into the authoritarian abyss of Donald Trump ,https://english.elpais.com/usa/2026-01-19/the-year-the-world-peered-into-the-authoritarian-abyss-of-donald-trump.html
A year of ICE terror under Donald Trump,https://english.elpais.com/usa/2026-01-19/a-year-of-terror-at-the-hands-of-ice-trumps-anti-immigrant-enforcement-arm.html
Trump administration’s Nazi references spark outrage,https://english.elpais.com/usa/2026-01-19/they-dont-even-bother-using-subliminal-messages-trump-administrations-nazi-references-spark-outrage.html
One day at a time: How Mexico’s Sheinbaum dealt with a year of Trump,https://english.elpais.com/international/2026-01-19/one-day-at-a-time-how-mexicos-sheinbaum-dealt-with-a-year-of-trump.html
Fashion designer Valentino dies at 93,https://english.elpais.com/culture/2026-01-19/fashion-designer-valentino-dies-at-93.html
At least 40 dead in collision between two high-speed trains in Spain,https://english.elpais.com/spain/2026-01-19/at-least-39-dead-in-collision-between-two-high-speed-trains-in-spain.html
"‘El Mantecas,’ head of Beltrán Leyva cartel faction, arrested in Sinaloa",https://english.elpais.com/international/2026-01-19/el-mantecas-head-of-beltran-leyva-cartel-faction-arrested-in-sinaloa.html
Bruce Springsteen speaks out against ICE and dedicates a song to Renee Good,https://english.elpais.com/usa/2026-01-19/bruce-springsteen-speaks-out-against-ice-and-dedicates-a-song-to-renee-good.html
"Diosdado Cabello, the unpredictable go-between in Venezuela ",https://english.elpais.com/international/2026-01-19/diosdado-cabello-the-unpredictable-go-between-in-venezuela.html
The Gaza Board of Peace: 60 countries invited for a fee of $1 billion each ,https://english.elpais.com/international/2026-01-19/the-gaza-board-of-peace-60-countries-invited-for-a-fee-of-1-billion-each.html
Spirits are flagging in Kyiv as another year of war looms,https://english.elpais.com/international/2026-01-19/spirits-are-flagging-in-kyiv-as-another-year-of-war-looms.html
"A year of movement among world’s 20 richest, with Elon Musk (almost) untouchable at the top",https://english.elpais.com/economy-and-business/2026-01-17/a-year-of-movement-among-worlds-20-richest-with-elon-musk-almost-untouchable-at-the-top.html
"Miami, the one-time ‘Hollywood of telenovelas’ now trying to reinvent itself ",https://english.elpais.com/culture/2026-01-17/miami-the-one-time-hollywood-of-telenovelas-now-trying-to-reinvent-itself.html
"Flat Earth theory, talking raccoons and ghosts on strike: The fascinating world of the weird ",https://english.elpais.com/culture/2026-01-17/flat-earth-theory-talking-raccoons-and-ghosts-on-strike-the-fascinating-world-of-the-weird.html
The technology that reveals what happens in 0.00000000000000000000001 second  ,https://english.elpais.com/science-tech/2026-01-17/the-technology-that-reveals-what-happens-in-000000000000000000000001-second.html
NASA successfully completes first-ever medical evacuation of the International Space Station,https://english.elpais.com/science-tech/2026-01-15/nasa-successfully-completes-first-ever-medical-evacuation-of-the-international-space-station.html
A vaccine to prevent colon cancer shows promising results,https://english.elpais.com/health/2026-01-16/a-vaccine-to-prevent-colon-cancer-shows-promising-results.html
Physicists win prize for discovery of ‘magic angle’ that generates supermaterials,https://english.elpais.com/science-tech/2026-01-16/physicists-win-prize-for-discovery-of-magic-angle-that-generates-supermaterials.html
‘Culex molestus’: What the London Underground mosquito species says about us ,https://english.elpais.com/science-tech/2026-01-15/culex-molestus-what-the-london-underground-mosquito-species-says-about-us.html
The new China isn’t buying the American dream: Why Starbucks and Burger King are languishing,https://english.elpais.com/economy-and-business/2026-01-17/the-new-china-isnt-buying-the-american-dream-why-starbucks-and-burger-king-are-languishing.html
"Justin B. Smith, the man who has turned journalism into a profitable business",https://english.elpais.com/economy-and-business/2026-01-15/justin-b-smith-the-man-who-has-turned-journalism-into-a-profitable-business.html
"Mexico, in Trump’s sights over its oil exports to Cuba",https://english.elpais.com/international/2026-01-11/mexico-in-trumps-sights-over-its-oil-exports-to-cuba.html
"Meg O’Neill, the woman who made history in the petroleum industry ",https://english.elpais.com/economy-and-business/2026-01-03/meg-oneill-the-woman-who-made-history-in-the-petroleum-industry.html
‘Supergirl’: Chronicle of the disaster that held back female superhero films for decades,https://english.elpais.com/culture/2026-01-17/supergirl-chronicle-of-the-disaster-that-held-back-female-superhero-films-for-decades.html
"Alejandro Jodorowsky, the immortal artist: ‘I’ve been thinking about death since the day I was born’",https://english.elpais.com/culture/2026-01-16/alejandro-jodorowsky-the-immortal-artist-ive-been-thinking-about-death-since-the-day-i-was-born.html
‘Luthiers’ of the future: The school in Colombia that carves violins under the guidance of the Stradivari Institute,https://english.elpais.com/culture/2026-01-14/luthiers-of-the-future-the-school-in-colombia-that-crafts-violins-under-the-guidance-of-the-stradivari-institute.html
"The French Revolution that brewed amid gossip, pamphlets and popular ditties ",https://english.elpais.com/culture/2026-01-17/the-french-revolution-that-brewed-amid-gossip-pamphlets-and-popular-ditties.html
The Rolling Stones’ pirate ship runs aground: ‘We probably won’t get to see them perform live again’,https://english.elpais.com/culture/2026-01-17/the-rolling-stones-pirate-ship-runs-aground-we-probably-wont-get-to-see-them-perform-live-again.html
Inactive people can reduce risk of death by 30% with five minutes of exercise a day,https://english.elpais.com/health/2026-01-14/inactive-people-can-reduce-risk-of-death-by-30-with-five-minutes-of-exercise-a-day.html
The latest generational war over how we wear clothes: ‘The millennial tuck is creepy’,https://english.elpais.com/lifestyle/2026-01-14/the-latest-generational-war-over-how-we-wear-clothes-the-millennial-tuck-is-creepy.html
Memes mature to help us understand a world in flames,https://english.elpais.com/eps/2026-01-14/memes-mature-to-help-us-understand-a-world-in-flames.html
The ‘McAtlas’ guide: A global chain with local flavor,https://english.elpais.com/travel/2026-01-10/the-mcatlas-guide-a-global-chain-with-local-flavor.html
Kyle MacLachlan: ‘You have to let failure bring you to uncomfortable places and find out it’s never personal’,https://english.elpais.com/culture/2026-01-17/kyle-maclachlan-you-have-to-let-failure-bring-you-to-uncomfortable-places-and-find-out-its-never-personal.html
"Julio Iglesias ‘always requested young, Latina women’ says group that filed complaint against singer",https://english.elpais.com/society/2026-01-16/julio-iglesias-always-requested-young-latina-women-with-a-physique-to-his-liking-says-group-that-filed-complaint-against-singer.html
"George Clooney, from long-haired surfer to silver fox: 40 images of the last great Hollywood heartthrob ",https://english.elpais.com/people/2026-01-15/george-clooney-from-long-haired-surfer-to-silver-fox-40-images-of-the-last-great-hollywood-heartthrob.html
A voice recording used without permission: Understanding the lawsuit against Bad Bunny,https://english.elpais.com/culture/2026-01-13/a-voice-recording-used-without-permission-understanding-the-million-dollar-lawsuit-against-bad-bunny.html
"Super Mario, Sonic and Lara Croft: Video game icons celebrate milestone anniversaries ",https://english.elpais.com/culture/2026-01-17/super-mario-sonic-and-lara-croft-video-game-icons-celebrate-milestone-anniversaries.html
A visual guide to Venezuela’s oil and why Trump wants it ,https://english.elpais.com/international/2026-01-17/a-visual-guide-to-venezuelas-oil-and-why-trump-wants-it.html
"Gabriel Boric, a moment of reflection: ‘The left that only blames its adversary is doomed to fade away’",https://english.elpais.com/international/2026-01-13/gabriel-boric-a-moment-of-reflection-the-left-that-only-blames-its-adversary-is-doomed-to-fade-away.html
The long shadow of the one-child policy: China pays for its biggest social experiment with a demographic crisis,https://english.elpais.com/international/2026-01-11/the-long-shadow-of-the-one-child-policy-china-pays-for-its-biggest-social-experiment-with-a-demographic-crisis.html
Life in Cuba after Trump’s threats: ‘This is a ship adrift’,https://english.elpais.com/international/2026-01-17/life-in-cuba-after-trumps-threats-this-is-a-ship-adrift.html
Listen now LOS40 USA,https://los40.us/
"El significado trás ‘End of Beginning’ de Joe Keery, la canción que conmovió a Taylor Swift: letra en español",https://los40.us/2026/el-significado-tras-end-of-beginning-de-joe-keery-la-cancion-que-conmovio-a-taylor-swift-letra-en-espanol-43074.html
"Bruno Mars desvela la fecha de su próximo álbum, ‘The Romantic’: estas son las fechas de su gira",https://los40.us/2026/cuando-lanzara-bruno-mars-su-proximo-album-fecha-tour-43060.html
EL PAÍS offers free Spanish lessons with Gymglish,https://english.elpais.com/economy-and-business/2021-11-15/el-pais-offers-free-spanish-lessons-with-gymglish.html
Edit the title,https://english.elpais.com/usa/2025-12-21/christmas-loses-its-festive-spirit-ice-fears-cast-shadow-over-religious-celebrations.html
"
",https://english.elpais.com/usa/2025-12-24/cbs-in-crisis-after-pulling-a-report-on-trumps-deportations-to-el-salvador-which-later-leaked-online.html
"Spanish Foreign Minister José Manuel Albares: ‘If steps are taken in Venezuela, it is logical that EU sanctions will disappear’",https://english.elpais.com/international/2026-01-14/spanish-foreign-minister-jose-manuel-albares-if-steps-are-taken-in-venezuela-it-is-logical-that-eu-sanctions-will-disappear.html
The miracle of Ivory Coast’s Nero Mer,https://english.elpais.com/international/2025-12-11/the-miracle-of-ivory-coasts-nero-mer.html
Venezuela and the return of imperialism,https://english.elpais.com/opinion/2026-01-04/venezuela-and-the-return-of-imperialism.html
"Mexico’s Generation Z is growing up with precariousness, uncertainty and political distrust",https://english.elpais.com/international/2025-12-13/mexicos-generation-z-is-growing-up-with-precariousness-uncertainty-and-political-distrust-and-social-media-is-their-primary-source-of-information.html
"Trump Billionaires Club, the video game that recreates the president’s lifestyle and tries to revive his memecoin",https://english.elpais.com/economy-and-business/2025-12-11/trump-billionaires-club-the-video-game-that-recreates-the-presidents-lifestyle-and-tries-to-revive-his-memecoin.html
An economic paradox: When savings are both a good and a bad idea,https://english.elpais.com/economy-and-business/2025-12-15/netflix-vs-paramount-inside-the-blockbuster-battle-to-become-the-new-king-of-hollywood.html
The renovation that has kept the hotel from ‘Some Like It Hot’ as pristine as it was nearly 140 years ago,https://english.elpais.com/culture/2025-12-11/the-weird-house-how-frank-gehry-revolutionized-a-neighborhood-with-his-own-home.html
Rowan Atkinson tops Netflix at 70: ‘He’s as funny as ever’,https://english.elpais.com/culture/2025-12-30/rowan-atkinson-tops-netflix-at-70-hes-as-funny-as-ever.html
From Borges to Jennifer Aniston: Science begins to illuminate the mysteries of memory,https://english.elpais.com/health/2026-01-12/from-borges-to-jennifer-aniston-science-begins-to-illuminate-the-mysteries-of-memory.html
"Emily Goligoski, researcher: ‘I have a policy for the use of devices in class. How can I compete against dopamine while teaching some theory?’",https://english.elpais.com/technology/2025-12-14/emily-goligoski-researcher-i-have-a-policy-for-the-use-of-devices-in-class-how-can-i-compete-against-dopamine-while-teaching-some-theory.html
"Mexico’s Generation Z is growing up with precariousness, uncertainty and political distrust",https://english.elpais.com/international/2025-12-13/mexicos-generation-z-is-growing-up-with-precariousness-uncertainty-and-political-distrust-and-social-media-is-their-primary-source-of-information.html
"The scream club as therapy goes viral: ‘There is a lot of skepticism, but when people experience it they see how transformative it can be’",https://english.elpais.com/health/2025-12-07/the-scream-club-as-therapy-goes-viral-there-is-a-lot-of-skepticism-but-when-people-experience-it-they-see-how-transformative-it-can-be.html
The unlikely path of a disabled athlete to the top of Mexico’s parasurfing scene,https://english.elpais.com/sports/2025-12-10/the-unlikely-path-of-a-disabled-athlete-to-the-top-of-mexicos-parasurfing-scene.html
"Climbing without a rope, between freedom and psychopathy",https://english.elpais.com/sports/2025-10-24/how-cosa-nostra-hit-the-nba-x-ray-machines-hidden-cameras-and-fake-glasses.html
