headline,url
Trump warns military operation against Iran will last ‘as long as necessary’ ,https://english.elpais.com/international/2026-03-02/iranian-regime-says-it-will-not-negotiate-with-the-united-states.html
"CIA tracked Khamenei for months, waiting for the moment to launch the attack that killed him",https://english.elpais.com/international/2026-03-02/cia-tracked-khamenei-for-months-waiting-for-the-moment-to-launch-the-attack-that-killed-him.html
Iran’s attacks strain its relations with the Arab Gulf states,https://english.elpais.com/international/2026-03-02/irans-attacks-strain-its-relations-with-the-arab-gulf-states.html
The key to Iran’s military response: ‘Missile cities’ hidden inside the mountains,https://english.elpais.com/international/2026-03-02/the-key-to-irans-military-response-missile-cities-hidden-inside-the-mountains.html
Iran: Trump’s most dangerous gamble,https://english.elpais.com/usa/2026-03-02/iran-trumps-most-dangerous-bet.html
Spain refuses to provide military support for US attack on Iran,https://english.elpais.com/international/2026-03-02/spain-refuses-to-provide-military-support-for-us-attack-on-iran-and-distances-itself-from-france-germany-and-the-uk.html
"Live with Bobby Pulido, the Tejano music star running for the United States Congress",https://english.elpais.com/usa/2026-03-02/live-with-bobby-pulido-the-tejano-music-star-running-for-the-united-states-congress.html
The exiles keeping vigil over their dead: Florida Cubans left confounded after the attack on a US speedboat,https://english.elpais.com/usa/2026-03-02/the-exiles-keeping-vigil-over-their-dead-florida-cubans-left-confounded-after-the-attack-on-a-us-speedboat.html
Nayib Bukele’s recipe against gangs that failed in Honduras: ‘We’re safer because Mara Salvatrucha rules here’,https://english.elpais.com/international/2026-03-02/nayib-bukeles-recipe-against-gangs-that-failed-in-honduras-were-safer-because-mara-salvatrucha-rules-here.html
"Puerto Vallarta, in the aftermath of El Mencho’s death: ‘We got the message; they’re in charge here’",https://english.elpais.com/international/2026-03-02/puerto-vallarta-in-the-aftermath-of-el-menchos-death-we-got-the-message-theyre-in-charge-here.html
Texas primary elections: Where to vote and what’s on the ballot ,https://english.elpais.com/usa/2026-03-02/texas-primary-elections-where-to-vote-and-whats-on-the-ballot.html
Berta Cáceres and the resistance that was born under an oak tree  ,https://english.elpais.com/international/2026-03-02/berta-caceres-and-the-resistance-that-was-born-under-an-oak-tree.html
Shakira shatters Zócalo attendance record: ‘The love and friendship I have with Mexico is incomparable’ ,https://english.elpais.com/culture/2026-03-02/shakira-shatters-zocalo-attendance-record-the-love-and-friendship-i-have-with-mexico-is-incomparable.html
The new kings of Hollywood: How the Ellison family built a media empire,https://english.elpais.com/economy-and-business/2026-03-02/the-new-kings-of-hollywood-how-the-ellison-family-created-a-media-empire.html
Norwegian influencer buys failed property development in Spain to build ‘self-sufficient’ eco-community,https://english.elpais.com/spain/2026-03-02/norwegian-influencer-buys-failed-property-development-in-spain-to-build-self-sufficient-eco-community.html
"Nir Barzilai, gerontologist: ‘Just because you look young doesn’t mean you’re healthy’",https://english.elpais.com/health/2026-03-02/nir-barzilai-gerontologist-just-because-you-look-young-doesnt-mean-youre-healthy.html
"Dakota and Elle Fanning, the sisters unhurriedly shaping their own destiny in Hollywood ",https://english.elpais.com/culture/2026-03-01/dakota-and-elle-fanning-the-sisters-unhurriedly-shaping-their-own-destiny-in-hollywood.html
"In the cloud forest of Cali, birdsong becomes medicine",https://english.elpais.com/international/2026-02-28/in-the-cloud-forest-of-cali-birdsong-becomes-medicine.html
Ants trapped in amber reveal what diminutive life was like millions of years ago ,https://english.elpais.com/science-tech/2026-02-27/ants-trapped-in-amber-reveal-what-diminutive-life-was-like-millions-of-years-ago.html
Neanderthal men chose Homo sapiens women: Genetics reveals the sex life of our ancestors,https://english.elpais.com/science-tech/2026-02-27/neanderthal-men-chose-homo-sapiens-women-genetics-reveals-the-sex-life-of-our-ancestors.html
"A living drug manages to eliminate tumors in mice with pancreatic, ovarian and kidney cancer",https://english.elpais.com/health/2026-02-26/a-living-drug-manages-to-eliminate-tumors-in-mice-with-pancreatic-ovarian-and-kidney-cancer.html
"Gender, racism and xenophobia: The biases of artificial intelligence in Latin America",https://english.elpais.com/international/women-leaders-of-latin-america/2026-02-26/gender-racism-and-xenophobia-the-biases-of-artificial-intelligence-in-latin-america.html
"Greg Peters, Netflix co-CEO: ‘People misunderstand how AI will influence content creation’ ",https://english.elpais.com/economy-and-business/2026-02-28/greg-peters-netflix-co-ceo-people-misunderstand-how-ai-will-influence-content-creation.html
Paramount wins the battle for Warner Bros after Netflix declines to match the bid,https://english.elpais.com/economy-and-business/2026-02-27/paramount-wins-the-battle-for-warner-bros-after-netflix-declines-to-match-the-bid.html
"Warner Bros bipolarity: Improved results in streaming and film, but floundering in television",https://english.elpais.com/economy-and-business/2026-02-27/warner-bros-bipolarity-improved-results-in-streaming-and-film-but-floundering-in-television.html
"Mohamed Mezghani, of the International Association of Public Transport: ‘A traffic jam of electric cars is still a traffic jam’",https://english.elpais.com/society/2026-03-01/mohamed-mezghani-from-the-international-association-of-public-transport-a-traffic-jam-of-electric-cars-is-still-a-traffic-jam.html
"Wagner Moura, Oscar nominee: ‘We’re in a very ugly time, even I am afraid of running into ICE’ ",https://english.elpais.com/culture/2026-02-28/wagner-moura-oscar-nominee-were-in-a-very-ugly-time-even-i-am-afraid-of-running-into-ice.html
"In the Mexican state of Oaxaca, a music school keeps children away from violence   ",https://english.elpais.com/international/2026-02-28/in-the-mexican-state-of-oaxaca-a-music-school-keeps-children-away-from-violence.html
"László Krasznahorkai, Nobel Prize laureate: ‘My Hungary is that of language, not of hussars’",https://english.elpais.com/culture/2026-02-27/laszlo-krasznahorkai-nobel-prize-laureate-in-literature-my-hungary-is-that-of-language-not-of-hussars.html
"Baz Luhrmann returns to Elvis Presley, but this time in the King’s own words",https://english.elpais.com/culture/2026-02-25/baz-luhrmann-returns-to-elvis-presley-but-this-time-in-the-kings-own-words.html
"LAM, the museum that displays a portrait made with sausages and a sculpture of moldy grapes ",https://english.elpais.com/culture/2026-02-28/lam-the-museum-that-displays-a-portrait-made-with-sausages-and-a-sculpture-of-moldy-grapes.html
"Rob Jetten and Nicholas Keenan, the love story of the prime minister and the hockey player that has captivated a country",https://english.elpais.com/lifestyle/2026-02-25/rob-jetten-and-nicholas-keenan-the-love-story-of-the-prime-minister-and-the-hockey-player-that-has-captivated-a-country.html
‘We must be doing something right as a society’: Why the photos of Pedro Pascal walking arm‑in‑arm with a man matter  ,https://english.elpais.com/lifestyle/2026-02-24/we-must-be-doing-something-right-as-a-society-why-the-photos-of-pedro-pascal-walking-arminarm-with-a-man-matter.html
The paradox of early childhood memories: Why travel with a baby if they won’t remember it,https://english.elpais.com/lifestyle/2026-02-24/the-paradox-of-early-childhood-memories-why-travel-with-a-baby-if-they-wont-remember-it.html
"Brooks Ginnan, the model who embraced their ectodermal dysplasia: ‘I equated beauty to nearly everything I was not’",https://english.elpais.com/people/2026-02-27/brooks-ginnan-the-model-and-actor-who-embraced-their-ectodermal-dysplasia-i-equated-beauty-to-nearly-everything-i-was-not.html
North West’s finger piercing: An extravagance experts strongly advise against  ,https://english.elpais.com/people/2026-02-25/north-wests-finger-piercing-an-extravagance-experts-strongly-advise-against.html
David Bowie and Iman’s daughter shares her painful story: An adolescence marked by drugs and psychiatric treatment ,https://english.elpais.com/people/2026-02-25/david-bowie-and-imans-daughter-shares-her-painful-story-an-adolescence-marked-by-drugs-and-psychiatric-treatment.html
Cuba on the verge of paralysis: ‘I feel like this is the end of the story’,https://english.elpais.com/international/2026-02-28/cuba-on-the-verge-of-paralysis-i-feel-like-this-is-the-end-of-the-story.html
"Amanda Sloat, former Biden adviser: ‘The distrust between Europe and the United States will last a generation’",https://english.elpais.com/usa/2026-02-26/amanda-sloat-former-biden-adviser-the-distrust-between-europe-and-the-united-states-will-last-a-generation.html
"Félix Ulloa, vice president of El Salvador: ‘People want Bukele’s state of emergency; they feel protected’ ",https://english.elpais.com/international/2026-03-01/felix-ulloa-vice-president-of-el-salvador-people-want-bukeles-state-of-emergency-they-feel-protected.html
Spain: Straining at the seams,https://english.elpais.com/spain/2026-03-01/spain-straining-at-the-seams.html
Listen now LOS40 USA,https://los40.us/
Bruno Mars se rinde a la música latina en su nuevo álbum: Letra completa en español de 'Cha Cha Cha',https://los40.us/2026/02/27/bruno-mars-se-rinde-a-la-musica-latina-en-su-nuevo-album-letra-completa-en-espanol-de-cha-cha-cha/
"Todo sobre el LUX TOUR de Rosalía en 2026: ciudades, fechas y cómo conseguir entradas",https://los40.us/2026/02/23/todo-sobre-el-lux-tour-de-rosalia-en-2026-ciudades-fechas-y-como-conseguir-entradas/
EL PAÍS offers free Spanish lessons with Gymglish,https://english.elpais.com/economy-and-business/2021-11-15/el-pais-offers-free-spanish-lessons-with-gymglish.html
The White House is considering requiring banks to verify the citizenship of their customers,https://english.elpais.com/usa/2026-02-25/the-white-house-is-considering-requiring-banks-to-verify-the-citizenship-of-their-customers.html
Trump defends his exclusionary vision and attacks Democrats in the longest State of the Union address in history,https://english.elpais.com/usa/2026-02-25/trump-defends-his-exclusionary-vision-and-attacks-democrats-in-the-longest-state-of-the-union-address-in-history.html
The trafficker in Spain who decorated her drug money with love hearts and affirmations,https://english.elpais.com/spain/2026-02-24/the-trafficker-in-spain-who-decorated-her-drug-money-with-love-hearts-and-affirmations.html
Ukraine enters fifth year of war amid frontline attrition and pressure from Trump,https://english.elpais.com/international/2026-02-24/ukraine-enters-fifth-year-of-war-amid-attrition-and-pressure-from-trump.html
Marielle Franco case: Brazão brothers convicted of ordering murder of Rio councilwoman,https://english.elpais.com/international/2026-02-25/marielle-franco-case-brazao-brothers-convicted-of-ordering-murder-of-rio-councilwoman.html
Claudia Sheinbaum dispels doubts about Guadalajara as a World Cup host city: ‘There is no risk’,https://english.elpais.com/sports/2026-02-25/claudia-sheinbaum-dispels-doubts-about-guadalajara-as-a-world-cup-host-city-there-is-no-risk.html
Milei pushes through a labor reform that Argentina resisted under previous right‑wing governments  ,https://english.elpais.com/international/2026-02-23/milei-pushes-through-a-labor-reform-that-argentina-resisted-under-previous-rightwing-governments.html
An economic paradox: When savings are both a good and a bad idea,https://english.elpais.com/economy-and-business/2026-02-18/cuban-governments-debt-to-spanish-companies-rises-to-at-least-320-million.html
This is not ‘Wuthering Heights’,https://english.elpais.com/culture/2026-02-19/this-is-not-wuthering-heights.html
"Rachel Reid, the unassuming author of ‘Heated Rivalry’ whose universe has taken on a life of its own",https://english.elpais.com/people/2026-02-17/rachel-reid-the-unassuming-author-of-heated-rivalry-whose-universe-has-taken-on-a-life-of-its-own.html
The largest genetic map of cancer in cats opens the door to treatments shared with humans,https://english.elpais.com/science-tech/2026-02-20/the-largest-genetic-map-of-cancer-in-cats-opens-the-door-to-treatments-shared-with-humans.html
"Ana Fernández-Arcos, neurologist: ‘There are people who give so much importance to dreams that they can change their lives’ ",https://english.elpais.com/health/2026-02-19/ana-fernandez-arcos-neurologist-there-are-people-who-give-so-much-importance-to-dreams-that-they-can-change-their-lives.html
"Mexico’s Generation Z is growing up with precariousness, uncertainty and political distrust",https://english.elpais.com/lifestyle/2026-02-22/welcome-to-rbald-providing-an-online-safe-space-for-receding-hairlines-for-over-15-years.html
From January euphoria to February despair: Why most of our New Year’s resolutions fail,https://english.elpais.com/lifestyle/2026-02-21/from-january-euphoria-to-february-despair-why-most-of-our-new-years-resolutions-fail.html
"Judit Polgár, the chess master taught to beat men  ",https://english.elpais.com/culture/2026-02-13/judit-polgar-the-chess-master-taught-to-beat-men.html
"Antonio Najarro, a flamenco choreographer at the Winter Olympic Games",https://english.elpais.com/sports/2026-02-09/antonio-najarro-a-flamenco-choreographer-at-the-winter-olympic-games.html
