headline,url
Supreme Court reluctant to grant full immunity to Donald Trump,https://english.elpais.com/usa/elections/2024-04-25/trump-case-supreme-court-reluctant-to-grant-full-immunity-to-former-president.html
Columbia visit by House Speaker Mike Johnson raises tension with students mobilizing for Gaza,https://english.elpais.com/usa/2024-04-25/columbia-visit-by-house-speaker-mike-johnson-raises-tension-with-students-mobilizing-for-gaza.html
Freedom Flotilla taking aid to Gaza trains for boarding by Israeli special forces,https://english.elpais.com/international/2024-04-25/freedom-flotilla-taking-aid-to-gaza-trains-for-boarding-by-israeli-special-forces.html
New York appeals court overturns Harvey Weinstein’s 2020 rape conviction from landmark #MeToo trial,https://english.elpais.com/usa/2024-04-25/new-york-appeals-court-overturns-harvey-weinsteins-2020-rape-conviction-from-landmark-metoo-trial.html
Earth’s protective sky is at least 3.7 billion years old,https://english.elpais.com/science-tech/2024-04-25/earths-protective-sky-is-at-least-37-billion-years-old.html
The Bible: The diverse market for the most read book in the world (now sold by Donald Trump),https://english.elpais.com/usa/2024-04-25/the-bible-the-diverse-market-for-the-most-read-book-in-the-world-now-sold-by-donald-trump.html
Portugal marks 50 years since overthrow of the dictatorship amid rise of far-right,https://english.elpais.com/international/2024-04-25/portugal-marks-50-years-since-overthrow-of-the-dictatorship-amid-rise-of-far-right.html
Spanish PM Pedro Sánchez considers resigning due to ‘the unprecedented attacks’ against his wife ,https://english.elpais.com/spain/2024-04-24/spanish-prime-minister-pedro-sanchez-considers-resigning-due-to-the-unprecedented-attacks-against-his-wife-by-the-right-and-the-far-right.html
"Inside the Rwandan center that will house UK deportees: ‘Come as a guest, leave as a friend’ ",https://english.elpais.com/international/2024-04-24/inside-the-rwandan-center-that-will-house-uk-deportees-come-as-a-guest-leave-as-a-friend.html
Fentanyl: A senior Mexican official recognizes that the country ‘is the champion’ in the drug production,https://english.elpais.com/international/2024-04-24/fentanyl-a-senior-mexican-official-recognizes-that-the-country-is-the-champion-in-the-drug-production.html
Excessive use of words like ‘commendable’ and ‘meticulous’ suggests ChatGPT has been used in thousands of scientific studies,https://english.elpais.com/science-tech/2024-04-25/excessive-use-of-words-like-commendable-and-meticulous-suggest-chatgpt-has-been-used-in-thousands-of-scientific-studies.html
A genetic patch corrects a rare syndrome in human brain organoid grafted into a rat,https://english.elpais.com/science-tech/2024-04-24/a-genetic-patch-corrects-a-rare-syndrome-in-human-brain-organoid-grafted-into-a-rat.html
A rare mammal with a trunk-like snout and webbed feet: The Iberian desman faces extinction,https://english.elpais.com/science-tech/2024-04-24/a-rare-mammal-with-a-trunk-and-webbed-feet-the-iberian-desman-faces-extinction.html
"Takeo Kanade, engineer: ‘Artificial vision will bring teleportation’",https://english.elpais.com/technology/2024-04-24/takeo-kanade-engineer-artificial-vision-will-bring-teleportation-but-without-decomposing-your-body-and-shipping-it-another-place.html
The cycling revolution in Paris: Bicycle use now exceeds car use,https://english.elpais.com/lifestyle/2024-04-24/the-cycling-revolution-in-paris-continues-bicycle-use-now-exceeds-car-use.html
The Lenny Kravitz case: What is a celebrity doing at the gym in leather pants and sunglasses?,https://english.elpais.com/people/2024-04-25/the-lenny-kravitz-case-what-is-a-celebrity-doing-at-the-gym-in-leather-pants-and-sunglasses.html
What happens when you die on the same day as John Lennon? Artists whose death was overshadowed,https://english.elpais.com/lifestyle/2024-04-24/what-happens-when-you-die-on-the-same-day-as-john-lennon-artists-whose-death-was-overshadowed-by-another.html
"Game, sex, match: The most passionate romances of the tennis court",https://english.elpais.com/culture/2024-04-25/game-sex-match-the-most-passionate-romances-of-the-tennis-court.html
"NFL Draft 2024: when is it, where to watch it from the United States and how it works",https://english.elpais.com/sports/2024-04-25/nfl-draft-2024-when-is-it-where-to-watch-it-from-the-united-states-and-how-it-works.html
The day Rita became a star: a Tarahumara woman who spent 12 years in a Kansas psychiatric hospital,https://english.elpais.com/culture/2024-04-24/the-day-rita-became-a-star-a-tarahumara-woman-who-spent-12-years-in-a-kansas-psychiatric-hospital.html
"The finest political hour of Sócrates, one of the most unique footballers Brazil ever produced",https://english.elpais.com/international/2024-04-25/the-finest-political-hour-of-socrates-one-of-the-most-unique-footballers-brazil-ever-produced.html
"Sarah Blagden, oncologist: ‘We should eventually have a vaccine that you get at age 40 that protects you from cancer’",https://english.elpais.com/health/2024-04-23/sarah-blagden-oncologist-we-should-eventually-have-a-vaccine-that-you-get-at-age-40-that-protects-you-from-cancer.html
"Taylor Lorenz, tech journalist: ‘The first influencers were women because media did not speak to their interests’",https://english.elpais.com/lifestyle/2024-04-22/taylor-lorenz-tech-journalist-the-first-influencers-were-women-because-media-did-not-speak-to-their-interests.html
Can we know how big a supernova will be before it happens?,https://english.elpais.com/science-tech/2024-04-22/can-we-know-how-big-a-supernova-will-be-before-it-happens.html
"60 is the new 50, according to science and 60-year-olds",https://english.elpais.com/health/2024-04-24/60-is-the-new-50-according-to-science-and-60-year-olds.html
From San José to Silicon Valley: Costa Rica is emerging as a hotbed for US chips,https://english.elpais.com/international/2024-04-22/from-san-jose-to-silicon-valley-costa-rica-is-emerging-as-a-hotbed-for-us-chips.html
US begins construction of high-speed train between Las Vegas and Southern California,https://english.elpais.com/economy-and-business/2024-04-23/the-us-begins-construction-of-high-speed-train-between-las-vegas-and-southern-california.html
Crime and fentanyl hit California’s king of burgers,https://english.elpais.com/economy-and-business/2024-04-21/crime-and-fentanyl-hit-californias-king-of-burgers.html
"Daron Acemoglu, the economist who says technological innovation does not equal prosperity",https://english.elpais.com/economy-and-business/2024-04-20/daron-acemoglu-the-economist-who-says-technological-innovation-does-not-equal-prosperity.html
How to deal with parental burnout,https://english.elpais.com/lifestyle/2024-04-22/how-to-deal-with-parental-burnout.html
From Mariana Enriquez’s chaos to the perfect workspace: What the disorder of our work desk says about us,https://english.elpais.com/lifestyle/2024-04-21/from-mariana-enriquezs-chaos-to-the-perfect-workspace-what-the-disorder-of-our-work-desk-says-about-us.html
Overcoming coitocentrism: How penetrative sex is losing ground ,https://english.elpais.com/lifestyle/2024-04-21/overcoming-coitocentrism-how-penetrative-sex-is-losing-ground.html
Fewer screens and more domino: Why playing cards and board games are staging a comeback in bars,https://english.elpais.com/society/2024-04-21/fewer-screens-and-more-domino-why-playing-cards-and-board-games-are-staging-a-comeback-in-bars.html
Spanish-language music shakes off complexes and makes its mark on the global stage,https://english.elpais.com/culture/2024-04-23/spanish-language-music-shakes-off-complexes-and-makes-its-mark-on-the-global-stage.html
"Johan Norberg: ‘Some time ago, they told me that I was far-right, and now, from the right, they tell me that I am a woke capitalist’ ",https://english.elpais.com/culture/2024-04-21/johan-norberg-some-time-ago-they-told-me-that-i-was-far-right-and-now-from-the-right-they-tell-me-that-i-am-a-woke-capitalist.html
The “jazz detective” who finds lost music treasures,https://english.elpais.com/culture/2024-04-20/the-jazz-detective-who-finds-lost-music-treasures.html
"Oki Sato, the minimalist designer inspired by manga cat Doraemon  ",https://english.elpais.com/culture/2024-04-20/oki-sato-the-minimalist-designer-inspired-by-manga-cat-doraemon.html
Why British detective shows reign supreme,https://english.elpais.com/culture/2024-04-23/why-british-detective-shows-reign-supreme.html
Luis Miguel celebrates 54th birthday in L.A. with Paloma Cuevas and daughter Michelle Salas,https://english.elpais.com/people/2024-04-24/luis-miguel-celebrates-54th-birthday-in-la-with-paloma-cuevas-and-daughter-michelle-salas.html
Céline Dion speaks about her rare neurological disease: ‘It’s morally tough to live day by day’,https://english.elpais.com/culture/2024-04-23/celine-dion-speaks-about-her-rare-neurological-disease-its-morally-tough-to-live-day-by-day.html
Freddie Highmore says goodbye to ‘The Good Doctor’: ‘It has given me stability in years of great uncertainty’,https://english.elpais.com/culture/2024-04-23/freddie-highmore-says-goodbye-to-the-good-doctor-it-has-given-me-stability-in-years-of-great-uncertainty.html
"Anne Heche’s estate cannot pay its debts: The actress had $110,000 and is being sued for $4 million",https://english.elpais.com/people/2024-04-24/anne-heches-estate-cannot-pay-its-debts-the-actress-had-110000-and-is-being-sued-for-4-million.html
Live now in Los40,https://los40.us/ 
"Peso Pluma & DJ Snake Release ‘TEKA:’ Meaning, Translation & Lyrics in English",https://los40.us/2024/peso-pluma-dj-snake-release-teka-meaning-translation-lyrics-in-english-19458.html
"Nicki Nicole Announces First-Ever USA Tour: Dates, Tickets…",https://los40.us/2024/nicki-nicole-announces-first-ever-usa-tour-dates-tickets-19444.html
NBA Playoffs 2024: Game schedule and where to watch in the US,https://english.elpais.com/sports/2024-04-20/nba-playoffs-2024-game-schedule-and-where-to-watch-in-the-us.html
Even President Biden is shocked: Caitlin Clark’s salary will be 0.7% of her male equivalent,https://english.elpais.com/sports/2024-04-17/even-president-biden-is-shocked-caitlin-clarks-salary-will-be-07-of-her-male-equivalent.html
LeBron James and the Lakers sneak into NBA playoffs with win over New Orleans,https://english.elpais.com/sports/2024-04-17/lebron-james-and-the-lakers-sneak-into-nba-playoffs-with-win-over-new-orleans.html
"Drunkenness, arrests, and chaos: The tournament that shows the wild side of golf",https://english.elpais.com/sports/2024-04-09/drunkenness-arrests-and-chaos-the-tournament-that-shows-the-wild-side-of-golf.html
"The future of Ein el-Hilweh, the massive Palestinian refugee camp in Lebanon whose fate is linked to Gaza  ",https://english.elpais.com/international/2024-04-23/peace-and-future-in-ein-el-hilweh-the-massive-palestinian-refugee-camp-in-lebanon-whose-fate-is-linked-to-gaza.html
Iran quickens path towards the atomic bomb,https://english.elpais.com/international/2024-04-21/iran-quickens-path-towards-the-atomic-bomb.html
"Xylazine, the animal sedative adulterating heroin and fentanyl in Mexicali and Tijuana",https://english.elpais.com/international/2024-04-23/xylazine-the-animal-sedative-adulterating-heroin-and-fentanyl-in-mexicali-and-tijuana.html
Sergeant Petrichenko’s posthumous victory: Ukraine bans gambling in the army,https://english.elpais.com/international/2024-04-23/sergeant-petrichenkos-posthumous-victory-ukraine-bans-gambling-in-the-army.html
EL PAÍS offers free Spanish lessons with Gymglish,https://english.elpais.com/economy-and-business/2021-11-15/el-pais-offers-free-spanish-lessons-with-gymglish.html
Ukraine and Israel aid back on track as House pushes toward weekend votes ,https://english.elpais.com/usa/2024-04-19/ukraine-and-israel-aid-back-on-track-as-house-pushes-toward-weekend-votes.html
US provides minimal assurances that Assange will not be sentenced to death if extradited,https://english.elpais.com/international/2024-04-17/us-provides-minimal-assurances-that-assange-will-not-be-sentenced-to-death-if-extradited.html
Blinken to warn China against helping Russia develop its military industry,https://english.elpais.com/international/2024-04-24/blinken-to-warn-china-against-helping-russia-develop-its-military-industry.html
Judicial mix-up allows Mocro Maffia capo to go to ground in Spain after posting bail,https://english.elpais.com/spain/2024-04-23/judicial-mix-up-allows-mocro-maffia-capo-to-go-to-ground-in-spain-after-posting-bail.html
Severe energy crisis paralyzes Ecuador for two days,https://english.elpais.com/international/2024-04-18/severe-energy-crisis-paralyzes-ecuador-for-two-days.html
Boat drifts to Brazil with nine dead migrants from Mauritania and Mali,https://english.elpais.com/international/2024-04-17/boat-drifts-to-brazil-with-nine-dead-migrants-from-mauritania-and-mali.html
The return of the Dutch miller,https://english.elpais.com/international/2024-04-14/the-return-of-the-dutch-miller.html
An economic paradox: When savings are both a good and a bad idea,https://english.elpais.com/technology/2024-04-12/artificial-intelligence-sparks-game-of-thrones-in-the-chip-industry.html
‘Civil War’: The hit movie that’s terrified the United States and sent a message to the rest of the world,https://english.elpais.com/culture/2024-04-19/a-celebration-of-the-immigrant-the-foreigner-the-queer-and-the-indigenous-historically-excluded-take-over-at-the-venice-biennial.html
Salman Rushdie’s memoir recounts the attack that almost killed him: ‘I just stood there like a piñata and let him smash me’,https://english.elpais.com/culture/2024-04-17/salman-rushdies-memoir-recounts-the-attack-that-almost-killed-him-i-just-stood-there-like-a-pinata-and-let-him-smash-me.html
The day robots were born,https://english.elpais.com/science-tech/2024-04-18/the-day-robots-were-born.html
Jesus Christ on toast? Brain scan explains how facial pareidolia happens,https://english.elpais.com/science-tech/2024-04-16/jesus-christ-on-toast-brain-scan-explains-how-facial-pareidolia-happens.html
How to date like a feminist: Experts explain,https://english.elpais.com/lifestyle/2024-04-20/how-to-date-like-a-feminist-experts-explain.html
From the Eras tour to Coachella: The Louboutin boots that Lana del Rey and Taylor Swift can’t do without  ,https://english.elpais.com/lifestyle/2024-04-16/from-the-eras-tour-to-coachella-the-louboutin-boots-that-lana-del-rey-and-taylor-swift-cant-do-without.html
"Dani Alves seeks reversal of rape conviction, restoration of his public image and a return to soccer ",https://english.elpais.com/sports/2024-04-08/dani-alves-seeks-reversal-of-rape-conviction-restoration-of-his-public-image-and-a-return-to-soccer.html
A look at the NBA’s record-breaking high-scoring season,https://english.elpais.com/sports/2024-04-01/a-look-at-the-nbas-record-breaking-high-scoring-season.html
