headline,url
"A snapshot of the LeBarón massacre in Mexico: Semi-automatic guns purchased in the US and 1,893 bullets",https://english.elpais.com/international/2025-11-09/a-snapshot-of-the-lebaron-massacre-in-mexico-semi-automatic-guns-purchased-in-the-us-and-1893-bullets.html
"Credit Suisse, on the trail of the ‘Nazi ratlines’ in Argentina  ",https://english.elpais.com/economy-and-business/2025-11-09/credit-suisse-on-the-trail-of-the-nazi-ratlines-in-argentina.html
‘The visa remover’: Christopher Landau’s scrutiny of Mexican social media accounts,https://english.elpais.com/usa/2025-11-09/the-visa-remover-christopher-landaus-scrutiny-of-mexican-social-media-accounts.html
Destruction of millennia-old Gaza City robs inhabitants of the landscape of memory,https://english.elpais.com/international/2025-11-09/destruction-of-millennia-old-gaza-city-robs-inhabitants-of-the-landscape-of-memory.html
"Tonatiuh, LGBTQ+ actor and child of Latino immigrants: ‘We need resilience to maintain our dignity, because they want to humiliate us’",https://english.elpais.com/culture/2025-11-09/tonatiuh-lgbtq-actor-and-child-of-latino-immigrants-we-need-resilience-to-maintain-our-dignity-because-they-want-to-humiliate-us.html
Rosalía: ‘I’ve been preparing for this all my life’,https://english.elpais.com/eps/2025-11-09/rosalia-ive-been-preparing-for-this-all-my-life.html
"Lota de Macedo, the Brazilian visionary determined to build a ‘Central Park on the sea’ in Rio de Janeiro",https://english.elpais.com/international/2025-11-09/lota-de-macedo-the-brazilian-visionary-determined-to-build-a-central-park-on-the-sea-in-rio-de-janeiro.html
When the cookies are so good you have the recipes carved into your tombstone,https://english.elpais.com/society/2025-11-09/when-the-cookies-are-so-good-you-have-the-recipes-carved-into-your-tombstone.html
The ‘Queen Mary’s’ strange second life: From maritime jewel to paranormal attraction,https://english.elpais.com/culture/2025-11-09/the-queen-marys-strange-second-life-from-maritime-jewel-to-paranormal-attraction.html
"Promises made, promises kept? Between illusion and reality, Trump forges ahead with his authoritarian project ",https://english.elpais.com/usa/2025-11-08/promises-made-promises-kept-between-illusion-and-reality-trump-forges-ahead-with-his-authoritarian-project.html
"Trump’s ‘historic’ deportation campaign spreads fear on the streets, but the president wants more",https://english.elpais.com/usa/2025-11-08/trumps-historic-deportation-campaign-spreads-fear-on-the-streets-but-the-president-wants-more.html
Why the US economy appears to be inoculated against Trump’s turbulences,https://english.elpais.com/economy-and-business/2025-11-08/why-the-us-economy-appears-to-be-inoculated-against-trumps-turbulences.html
Margaret Atwood: ‘Older women are only allowed to be two things: wise old women or wicked old witches’,https://english.elpais.com/culture/2025-11-08/margaret-atwood-older-women-are-only-allowed-to-be-two-things-wise-old-women-or-wicked-old-witches.html
"Hitmen terrorize drivers, shopkeepers, and artists in Peru",https://english.elpais.com/international/2025-11-08/hitmen-terrorize-drivers-shopkeepers-and-artists-in-peru.html
"Hans Clevers, biomedical scientist: ‘If I had colon cancer, I could grow my own tumor, test it with drugs, and see which one eliminates it’",https://english.elpais.com/science-tech/2025-11-07/hans-clevers-biomedical-scientist-if-i-had-colon-cancer-i-could-grow-my-own-tumor-test-it-with-drugs-and-see-which-one-eliminates-it.html
"Dr. Ellen Ochoa: ‘With hard work, determination and support, the sky’s not the limit’ ",https://english.elpais.com/science-tech/2025-11-08/dr-ellen-ochoa-with-hard-work-determination-and-support-the-skys-not-the-limit.html
First map of the developing brain provides insight into origin of mental disorders ,https://english.elpais.com/science-tech/2025-11-07/first-map-of-the-developing-brain-provides-insight-into-origin-of-mental-disorders.html
The Roman Empire’s ‘road map’ is twice as extensive as previously thought,https://english.elpais.com/science-tech/2025-11-06/the-roman-empires-road-map-is-twice-as-extensive-as-previously-thought.html
"Alberto Casas, physicist: ‘Free will is an illusion created by our brain. Everything that is going to happen is already written’ ",https://english.elpais.com/science-tech/2025-11-05/alberto-casas-physicist-free-will-is-an-illusion-created-by-our-brain-everything-that-is-going-to-happen-is-already-written.html
Race for icebreakers heats up amid Arctic power struggle,https://english.elpais.com/international/2025-11-01/race-for-icebreakers-heats-up-amid-arctic-power-struggle.html
Portland revolutionizes the world of airports,https://english.elpais.com/economy-and-business/2025-11-02/portland-revolutionizes-the-world-of-airports.html
"Shayne Coplan, Generation Z’s first major billionaire",https://english.elpais.com/economy-and-business/2025-11-01/shayne-coplan-generation-zs-first-major-billionaire.html
"BYD, the Chinese car manufacturer that Musk mocked (and now fears) ",https://english.elpais.com/economy-and-business/2025-11-01/byd-the-chinese-car-manufacturer-that-musk-mocked-and-now-fears.html
"‘Frankenstein,’ Guillermo del Toro’s 50-year dream: ‘The biography of humanity is one of broken families’",https://english.elpais.com/culture/2025-11-06/frankenstein-guillermo-del-toros-50-year-dream-the-biography-of-humanity-is-one-of-broken-families.html
Alec Baldwin and ‘Rust’: What to do with a film after a tragedy on set,https://english.elpais.com/culture/2025-11-07/alec-baldwin-premieres-rust-what-to-do-with-a-film-when-the-star-kills-the-director-of-photography.html
"Los Jornaleros del Norte denounce harassment: ‘They’ve followed us, sent us hate mail’",https://english.elpais.com/culture/2025-10-29/los-jornaleros-del-norte-denounce-harassment-theyve-followed-us-sent-us-hate-mail.html
"Byung-Chul Han, philosopher: ‘A lot of people read me, but I’m not a millionaire’ ",https://english.elpais.com/culture/2025-10-29/byung-chul-han-philosopher-a-lot-of-people-read-me-but-im-not-a-millionaire.html
"Wifredo Lam, the artist who bridged the Caribbean and Europe, finally gets major retrospective at MoMA",https://english.elpais.com/culture/2025-11-07/wifredo-lam-the-artist-who-bridged-the-caribbean-and-europe-finally-gets-major-retrospective-at-moma.html
"Jeff Bridges, the reluctant actor who has earned seven Oscar nominations: ‘It’s kind of like pretend and playing’ ",https://english.elpais.com/culture/2025-10-30/jeff-bridges-the-reluctant-actor-who-has-earned-seven-oscar-nominations-its-kind-of-like-pretend-and-playing.html
"Gay man and heterosexual woman, happily married: Is this becoming normalized in 2025?",https://english.elpais.com/society/2025-11-07/gay-man-and-heterosexual-woman-happily-married-is-this-becoming-normalized-in-2025.html
Miami consolidates its position as the US capital of the Brazilian butt lift,https://english.elpais.com/health/2025-11-02/miami-consolidates-its-position-as-the-us-capital-of-the-brazilian-butt-lift.html
From Rosalía to Pamela Anderson: How Substack revived blogging,https://english.elpais.com/technology/2025-11-02/from-rosalia-to-pamela-anderson-how-substack-revived-blogging.html
"Love and ageism in later life: ‘They say sexual pleasure goes away, that’s a lie’ ",https://english.elpais.com/society/2025-10-25/love-and-ageism-in-later-life-they-say-sexual-pleasure-goes-away-thats-a-lie.html
Paris Hilton: ‘I’ve learned that loving yourself isn’t arrogance’,https://english.elpais.com/people/2025-11-08/paris-hilton-ive-learned-that-loving-yourself-isnt-arrogance.html
"Kendrick Lamar, Lady Gaga, Bad Bunny and Sabrina Carpenter lead the nominations for the 2026 Grammy Awards",https://english.elpais.com/culture/2025-11-07/kendrick-lamar-lady-gaga-bad-bunny-and-sabrina-carpenter-lead-the-nominations-for-the-2026-grammy-awards.html
Kim Kardashian shares the stage (but not the spotlight) with Glenn Close and Naomi Watts in ‘All’s Fair’,https://english.elpais.com/culture/2025-11-04/kim-kardashian-shares-the-stage-but-not-the-spotlight-with-glenn-close-and-naomi-watts-in-alls-fair.html
Mexico gives FIFA a blank check for 2026 World Cup matches ,https://english.elpais.com/economy-and-business/2025-11-06/mexico-gives-fifa-a-blank-check.html
"Donald Trump, Year One: A bittersweet anniversary",https://english.elpais.com/usa/2025-11-06/donald-trump-year-one-a-bittersweet-anniversary.html
"Soccer, emeralds and cocaine: The ‘new’ Colombian drug lords with ties to Spain",https://english.elpais.com/international/2025-11-02/soccer-emeralds-and-cocaine-the-new-colombian-drug-lords-with-ties-to-spain.html
"Audrey Tang, hacker and Taiwanese digital minister: ‘AI is a parasite that fosters polarization’",https://english.elpais.com/technology/2025-11-02/audrey-tang-hacker-and-taiwanese-digital-minister-ai-is-a-parasite-that-fosters-polarization.html
A Hungarian spy scandal in Brussels implicates Viktor Orbán’s EU commissioner,https://english.elpais.com/international/2025-11-04/a-hungarian-spy-scandal-in-brussels-implicates-viktor-orbans-eu-commissioner.html
Listen now LOS40 USA,https://los40.us/
¿Cuáles son los artistas latinos con más nominaciones en LOS40 Music Awards Santander 2025?,https://los40.us/2025/cuales-son-los-artistas-latinos-con-mas-nominaciones-en-los40-music-awards-santander-2025-39953.html
"Nominados a LOS40 Music Awards Santander 2025: Feid, Aitana, Dani Fernández y Lola Índigo lideran la lista",https://los40.us/2025/nominados-a-los40-music-awards-santander-2025-feid-aitana-dani-fernandez-lola-indigo-lideran-la-lista-39866.html
EL PAÍS offers free Spanish lessons with Gymglish,https://english.elpais.com/economy-and-business/2021-11-15/el-pais-offers-free-spanish-lessons-with-gymglish.html
The US government shutdown breaks all-time record with no sign of agreement between Democrats and Republicans,https://english.elpais.com/usa/2025-11-05/the-us-government-shutdown-breaks-all-time-record-with-no-sign-of-agreement-between-democrats-and-republicans.html
"
",https://english.elpais.com/usa/2025-11-03/im-angry-with-my-president-trump-voters-in-florida-confront-the-fallout-of-his-policies-a-year-before-the-midterms.html
Nigeria denies Trump’s allegations of attacks on Christians: Violence affects all faiths,https://english.elpais.com/usa/2025-11-04/nigeria-denies-trumps-allegations-of-attacks-on-christians-violence-affects-all-faiths.html
Witness to North Korea executions: ‘He was only 22 and shot for watching and distributing 70 songs and three South Korean TV series’,https://english.elpais.com/international/2025-09-28/witness-to-north-korea-executions-he-was-only-22-and-shot-for-watching-and-distributing-70-songs-and-three-south-korean-tv-series.html
Colombian presidential hopeful Abelardo de la Espriella rallies thousands in Bogotá: ‘The Tiger has awakened’ ,https://english.elpais.com/international/2025-11-04/colombian-presidential-hopeful-abelardo-de-la-espriella-rallies-thousands-in-bogota-the-tiger-has-awakened.html
Portland revolutionizes the world of airports,https://english.elpais.com/economy-and-business/2025-11-02/portland-revolutionizes-the-world-of-airports.html
Federal Reserve cuts interest rates by 0.25 percentage points amid fears of an economic slowdown,https://english.elpais.com/economy-and-business/2025-10-29/federal-reserve-cuts-interest-rates-by-025-percentage-points-amid-fears-of-an-economic-slowdown.html
An economic paradox: When savings are both a good and a bad idea,https://english.elpais.com/economy-and-business/2025-10-28/colombias-fashion-battle-garment-makers-prevail-over-yarn-industry-in-bid-to-survive-shein-and-temu.html
The renovation that has kept the hotel from ‘Some Like It Hot’ as pristine as it was nearly 140 years ago,https://english.elpais.com/culture/2025-10-26/550-million-and-six-years-of-painstaking-work-the-renovation-that-has-kept-the-hotel-from-some-like-it-hot-as-pristine-as-it-was-nearly-140-years-ago.html
"‘The Hand That Rocks the Cradle’ still carries scares in 2025, with a twisted nanny and an auteur director",https://english.elpais.com/culture/2025-10-27/the-hand-that-rocks-the-cradle-still-carries-scares-in-2025-with-a-twisted-nanny-and-an-auteur-director.html
"Ángel Milagro, the Spanish engineer taking Japan to the Moon",https://english.elpais.com/science-tech/2025-10-29/angel-milagro-the-spanish-engineer-taking-japan-to-the-moon.html
Guided missiles targeting tumor cells open a new route to combat cancer,https://english.elpais.com/health/2025-10-27/guided-missiles-targeting-tumor-cells-open-a-new-route-to-combat-cancer.html
‘I need +10K a month to live well’: How the ‘cryptobro’ mystique is taking over culture,https://english.elpais.com/lifestyle/2025-10-24/i-need-10k-a-month-to-live-well-how-the-cryptobro-mystique-is-taking-over-culture.html
A generation in crisis: Why young people are so unhappy,https://english.elpais.com/health/2025-10-12/a-generation-in-crisis-why-young-people-are-so-unhappy.html
Tragic death of chess player Naroditsky sparks conspiracy theories and reproach,https://english.elpais.com/sports/2025-10-27/tragic-death-of-chess-player-naroditsky-sparks-conspiracy-theories-and-reproach.html
"Climbing without a rope, between freedom and psychopathy",https://english.elpais.com/sports/2025-10-24/how-cosa-nostra-hit-the-nba-x-ray-machines-hidden-cameras-and-fake-glasses.html
