headline,url
What happened inside the conclave? How Prevost took the lead over Italian favorite,https://english.elpais.com/international/2025-05-09/what-happened-inside-the-conclave-at-lunchtime-the-italian-favorite-lost-ground-and-prevost-took-the-lead.html
Conservatives accused Prevost of covering up abuse in Peru and the United States before conclave ,https://english.elpais.com/international/2025-05-09/conservatives-accused-prevost-of-covering-up-abuse-in-peru-and-the-united-states-before-conclave.html
"Leo XIV: The first pope from the United States, a figure in the spirit of Francis",https://english.elpais.com/international/2025-05-09/leo-xiv-the-first-pope-from-the-united-states-a-figure-in-the-spirit-of-francis.html
Trump and Pope Leo XIV: Two contrasting figures with an unclear relationship ahead ,https://english.elpais.com/international/2025-05-09/trump-and-pope-leo-xiv-two-contrasting-figures-with-an-unclear-relationship-ahead.html
Leo XIV: From Peru with love,https://english.elpais.com/international/2025-05-09/leo-xiv-from-peru-with-love.html
Pope Leo XIV: The agenda that the cardinals have set for the new pontiff,https://english.elpais.com/international/2025-05-08/pope-leo-xiv-the-agenda-that-the-cardinals-have-set-for-the-new-pontiff.html
"Who is the new Pope Leo XIV? Robert Francis Prevost, the first US pope",https://english.elpais.com/international/2025-05-08/who-is-the-new-pope-leo-xiv-robert-francis-prevost.html
"The election of Robert Prevost as Pope Leo XIV, in images",https://english.elpais.com/international/2025-05-08/the-election-of-robert-prevost-as-pope-leo-xiv-in-images.html
"María Corina Machado: ‘They think they’re unbeatable because they have the weapons, the money, and the control’",https://english.elpais.com/international/2025-05-09/maria-corina-machado-they-think-theyre-unbeatable-because-they-have-the-weapons-the-money-and-the-control.html
Mexico seeks answers after Los Chapitos lieutenant ‘El Ponchis’ escapes from prison ,https://english.elpais.com/international/2025-05-09/mexico-seeks-answers-after-los-chapitos-lieutenant-el-ponchis-escapes-from-prison.html
Will Trump deport migrants to Libya? What you should know,https://english.elpais.com/usa/2025-05-09/will-trump-deport-migrants-to-libya-what-you-should-know.html
Dissolving USAID could lead to an additional 14 million deaths by 2030 ,https://english.elpais.com/international/2025-05-08/dissolving-usaid-could-lead-to-an-additional-14-million-deaths-by-2030.html
80th anniversary of the end of World War II: How does a country fall into the abyss of hatred? ,https://english.elpais.com/international/2025-05-08/80th-anniversary-of-the-end-of-world-war-ii-how-does-a-country-fall-into-the-abyss-of-hatred.html
"The rise and fall of Jon Voight, the 1970s countercultural icon who became Trump’s biggest supporter in Hollywood",https://english.elpais.com/culture/2025-05-09/the-rise-and-fall-of-jon-voight-the-1970s-countercultural-icon-who-became-trumps-biggest-supporter-in-hollywood.html
A humanized mouse antibody erases cancer in 84 people with a genetic mutation,https://english.elpais.com/science-tech/2025-05-09/a-humanized-mouse-antibody-erases-cancer-in-84-people-with-a-genetic-mutation.html
Jennifer Aniston’s stalker appears in court half-naked as judge orders mental evaluation,https://english.elpais.com/people/2025-05-09/jennifer-anistons-stalker-appears-in-court-half-naked-as-judge-orders-mental-evaluation.html
"When a robot becomes conscious, how will we know? ",https://english.elpais.com/technology/2025-05-09/when-a-robot-becomes-conscious-how-will-we-know.html
"Ralph Fiennes: ‘When Ulysses draws his bow, he puts himself back together’ ",https://english.elpais.com/culture/2025-05-07/ralph-fiennes-when-ulysses-draws-his-bow-he-puts-himself-back-together.html
A Spanish therapy saves the lives of ‘the unluckiest family in the world’,https://english.elpais.com/science-tech/2025-05-07/a-spanish-therapy-saves-the-lives-of-the-unluckiest-family-in-the-world.html
Haenyeo DNA reveals how the human body can adapt to extreme diving,https://english.elpais.com/science-tech/2025-05-06/haenyeo-dna-reveals-how-the-human-body-can-adapt-to-extreme-diving.html
"Lisa Mosconi, neuroscientist: ‘Menopause is making women feel less valuable than before’",https://english.elpais.com/health/2025-05-04/lisa-mosconi-neuroscientist-menopause-is-making-women-feel-less-valuable-than-before.html
Are we unique in the universe?,https://english.elpais.com/science-tech/2025-05-04/are-we-unique-in-the-universe.html
Trump’s tariffs deal a blow to the bottom line of US companies,https://english.elpais.com/economy-and-business/2025-05-06/trumps-tariffs-deal-a-blow-to-the-bottom-line-of-us-companies.html
Fed set to ignore pressure from Trump with new pause in rate cuts,https://english.elpais.com/economy-and-business/2025-05-06/fed-set-to-ignore-pressure-from-trump-with-new-pause-in-rate-cuts.html
Romania rediscovers its hidden treasure: Minerals,https://english.elpais.com/international/2025-05-05/romania-rediscovers-its-hidden-treasure-minerals.html
Critical minerals: The future lies underground and the fight for control is relentless,https://english.elpais.com/economy-and-business/2025-05-04/critical-minerals-the-future-lies-underground-and-the-fight-for-control-is-relentless.html
The Met Fashion Gala surrenders to the power of African-American dandies,https://english.elpais.com/lifestyle/2025-05-06/the-met-fashion-gala-surrenders-to-the-power-of-african-american-dandies.html
"1215, 1789, 1945, 1989: The dates that forged freedom in Europe",https://english.elpais.com/international/2025-05-05/1215-1789-1945-1989-the-dates-that-forged-freedom-in-europe.html
"Clint Smith, writer: ‘It is impossible to understand the US economy without slavery’",https://english.elpais.com/culture/2025-05-03/clint-smith-writer-it-is-impossible-to-understand-the-us-economy-without-slavery.html
Being distinguished: Why the rich like certain things and the poor others,https://english.elpais.com/culture/2025-05-05/being-distinguished-why-the-rich-like-certain-things-and-the-poor-others.html
‘This is an ecstasy machine’: The internet’s favorite art critic walks through the Prado Museum,https://english.elpais.com/culture/2025-05-03/this-is-an-ecstasy-machine-the-internets-favorite-art-critic-walks-through-the-prado-museum.html
"Rena Quint, the girl who survived the Nazi concentration camps",https://english.elpais.com/culture/2025-05-03/rena-quint-the-girl-who-survived-the-nazi-concentration-camps-alone-wherever-you-went-you-saw-and-smelled-death.html
When snoring is as loud as an ambulance siren: Expert tips for controlling it,https://english.elpais.com/health/2025-05-04/when-snoring-is-as-loud-as-an-ambulance-siren-expert-tips-for-controlling-it.html
"Hollywood’s big lie about disasters: In crises the natural reaction is generosity, not panic",https://english.elpais.com/society/2025-05-06/hollywoods-big-lie-about-disasters-in-crises-like-spains-blackout-the-natural-reaction-is-generosity-not-panic.html
How emos survived their sadness: The ashes of an extinct urban tribe on the verge of resurrection,https://english.elpais.com/culture/2025-05-03/how-emos-survived-their-sadness-the-ashes-of-an-extinct-urban-tribe-on-the-verge-of-resurrection.html
What does it mean to live well? Global project describes keys to human flourishing in over 40 indicators ,https://english.elpais.com/health/2025-05-01/what-does-it-mean-to-live-well-global-project-describes-keys-to-human-flourishing-in-over-40-indicators.html
At home with Jennifer Lopez: ‘Everybody goes through hard times in their life. And it’s what you do in those moments that defines you’,https://english.elpais.com/culture/2025-05-02/at-home-with-jennifer-lopez-everybody-goes-through-hard-times-in-their-life-and-its-what-you-do-in-those-moments-that-defines-you.html
"David Beckham at 50: A life of football, fame, and success",https://english.elpais.com/people/2025-05-02/david-beckham-at-50-a-life-of-football-fame-and-success.html
Liv Tyler’s return: The actress who prefers ironing sheets in the countryside to being crushed by Hollywood,https://english.elpais.com/culture/2025-04-27/liv-tylers-return-the-actress-who-prefers-ironing-sheets-in-the-countryside-to-being-crushed-by-hollywood.html
"Sean Combs’ trial: Keys to a lengthy process involving five criminal counts, hundreds of victims and decades of potential prison time",https://english.elpais.com/people/2025-05-05/sean-combs-trial-keys-to-a-lengthy-process-involving-five-criminal-counts-hundreds-of-victims-and-decades-of-potential-prison-time.html
Henrique Capriles: ‘Abstention in Venezuela only makes things easier for Maduro’,https://english.elpais.com/international/2025-05-05/henrique-capriles-abstention-in-venezuela-only-makes-things-easier-for-maduro.html
The illegal adoption business in Chile is not only about the dictatorship ,https://english.elpais.com/international/2025-05-04/the-illegal-adoption-business-in-chile-is-not-only-about-the-dictatorship.html
"La Pista, the largest migrant settlement in the Americas, hit hard by Trump’s cuts: ‘We feel powerless’",https://english.elpais.com/international/2025-05-04/la-pista-the-largest-migrant-settlement-in-the-americas-hit-hard-by-trumps-cuts-we-feel-powerless.html
"Dominican Republic, one month after the Jet Set collapse: ‘It changed our lives forever’ ",https://english.elpais.com/international/2025-05-08/dominican-republic-one-month-after-the-jet-set-collapse-it-changed-our-lives-forever.html
Listen now LOS40 USA,https://los40.us/
Where to Watch Karol G’s Documentary ‘Tomorrow Was Beautiful’ for Free?,https://los40.us/2025/where-to-watch-karol-gs-documentary-tomorrow-was-beautiful-for-free-33574.html
What Happened to Netón Vega? The Health Reasons Why He Canceled U.S. Concerts,https://los40.us/2025/what-happened-to-neton-vega-the-health-reasons-why-he-canceled-u-s-concerts-33539.html
EL PAÍS offers free Spanish lessons with Gymglish,https://english.elpais.com/economy-and-business/2021-11-15/el-pais-offers-free-spanish-lessons-with-gymglish.html
"Pride, defiance and jubilation among Trump supporters at rally to mark his first 100 days in office ",https://english.elpais.com/usa/2025-04-30/pride-defiance-and-jubilation-among-trump-supporters-at-rally-to-mark-his-first-100-days-in-office.html
The US targets La Familia Michoacana in its crusade against fentanyl,https://english.elpais.com/usa/2025-04-16/the-us-targets-la-familia-michoacana-in-its-crusade-against-fentanyl.html
Chancellor Merz’s international challenge: Make Germany ‘independent’ from the US or maintain the link despite Trump,https://english.elpais.com/international/2025-05-06/chancellor-merzs-international-challenge-make-germany-independent-from-the-us-or-maintain-the-link-despite-trump.html
Israel deals yet another blow to Gaza’s decimated healthcare system,https://english.elpais.com/international/2025-04-15/israel-deals-yet-another-blow-to-gazas-decimated-healthcare-system.html
The Trump effect and the mistakes of Correismo hand Daniel Noboa victory in Ecuador,https://english.elpais.com/international/2025-04-15/the-trump-effect-and-the-mistakes-of-correismo-hand-daniel-noboa-victory-in-ecuador.html
Venezuela kicks off its most uncertain presidential campaign,https://english.elpais.com/international/2025-04-14/don-neto-and-the-sinaloa-old-guard-who-reinvented-drug-trafficking-in-guadalajara.html
Living like a nobleman: The highly profitable trend of restoring historic buildings,https://english.elpais.com/economy-and-business/2025-04-26/living-like-a-nobleman-the-highly-profitable-trend-of-restoring-historic-buildings.html
An economic paradox: When savings are both a good and a bad idea,https://english.elpais.com/economy-and-business/2025-04-10/a-financial-crisis-in-the-age-of-misinformation-more-market-volatility-and-greater-liquidity-risks.html
Jason Isaacs: The villain who managed to dodge fame until ‘The White Lotus’,https://english.elpais.com/people/2025-04-12/jason-isaacs-the-villain-who-managed-to-dodge-fame-until-the-white-lotus.html
Jon Hamm: ‘I don’t think very much about Don Draper’,https://english.elpais.com/culture/2025-04-11/jon-hamm-i-dont-think-very-much-about-don-draper.html
Using brain-dead people for medical experiments: The new debate at the frontier of bioethics,https://english.elpais.com/science-tech/2025-05-02/using-brain-dead-people-for-medical-experiments-the-new-debate-at-the-frontier-of-bioethics.html
Mapping a tiny piece of mouse brain opens up new path to understanding human intelligence,https://english.elpais.com/science-tech/2025-04-09/mapping-a-tiny-piece-of-mouse-brain-opens-up-new-path-to-understanding-human-intelligence.html
Welcome to the ‘antisocial century’: Are we lonelier now than ever?,https://english.elpais.com/lifestyle/2025-05-03/welcome-to-the-antisocial-century-are-we-lonelier-now-than-ever.html
"Different ideal, same pressure: Gen Z’s fixation on ‘perfect’ skin echoes millennials’ obsession on being thin",https://english.elpais.com/lifestyle/2025-03-15/different-ideal-same-pressure-gen-zs-fixation-on-perfect-skin-echoes-millennials-obsession-on-being-thin.html
Canadians put their elbows up: Hockey becomes a symbol of resistance against Trump,https://english.elpais.com/international/2025-04-07/canadians-put-their-elbows-up-hockey-becomes-a-symbol-of-resistance-against-trump.html
"Climbing without a rope, between freedom and psychopathy",https://english.elpais.com/sports/2025-03-11/could-maradonas-death-have-been-avoided-trial-of-soccer-stars-carers-begins-in-buenos-aires.html
