headline,url
CIA activity against Venezuelan leaders revives specter of US interventionism in Latin America,https://english.elpais.com/international/2025-10-20/cia-activity-against-venezuelan-leaders-revives-specter-of-us-interventionism-in-latin-america.html
Rodrigo Paz wins the presidency as Bolivia enters new political era,https://english.elpais.com/international/2025-10-20/rodrigo-paz-wins-the-presidency-as-bolivia-enters-new-political-era.html
Colombia recalls its ambassador to the United States for consultations,https://english.elpais.com/international/2025-10-20/colombia-recalls-its-ambassador-to-the-united-states-for-consultations.html
"Larry Changa, leader of the Tren de Aragua seeking to stop his extradition",https://english.elpais.com/international/2025-10-20/larry-changa-leader-of-the-tren-de-aragua-is-trying-to-negotiate-with-the-colombian-president-to-stop-his-extradition.html
"The keys to the Louvre heist: Seven minutes, four thieves and an electric ladder to access the Crown Jewels",https://english.elpais.com/international/2025-10-20/the-keys-to-the-louvre-heist-seven-minutes-four-thieves-and-an-electric-ladder-to-access-the-crown-jewels.html
History’s greatest art thefts: From the Mona Lisa to a priceless Vermeer,https://english.elpais.com/culture/2025-10-20/historys-greatest-art-thefts-from-the-mona-lisa-to-a-priceless-vermeer.html
The biologist who survived a shark bite: ‘We must end the myth of killer sharks’,https://english.elpais.com/science-tech/2025-10-20/the-biologist-who-survived-a-shark-bite-we-must-end-the-myth-of-killer-sharks.html
Kyiv fears Trump will unilaterally negotiate a division of Ukraine’s territory with Putin,https://english.elpais.com/international/2025-10-20/kyiv-fears-trump-will-unilaterally-negotiate-a-division-of-ukraines-territory-with-putin.html
María Corina Machado: ‘Venezuela’s freedom is near. It has been a long and painful journey’,https://english.elpais.com/international/2025-10-20/maria-corina-machado-venezuelas-freedom-is-near-it-has-been-a-long-and-painful-journey.html
"Ana María Polo: ‘Right now, it’s hard to be Latino in the United States and not feel discriminated against’",https://english.elpais.com/usa/2025-10-19/ana-maria-polo-right-now-its-hard-to-be-latino-in-the-united-states-and-not-feel-discriminated-against.html
"Los Angeles without palm trees? An aesthetic, economic and climate debate grips California",https://english.elpais.com/lifestyle/2025-10-19/los-angeles-without-palm-trees-an-aesthetic-economic-and-climate-debate-grips-california.html
All the president’s businesses: How Trump has grown richer from the White House,https://english.elpais.com/usa/2025-10-19/all-the-presidents-businesses-how-trump-has-grown-richer-from-the-white-house.html
Algorithms and misogyny: How Latin American teenagers are exposed to toxic content,https://english.elpais.com/international/women-leaders-of-latin-america/2025-10-20/algorithms-and-misogyny-how-latin-american-teenagers-are-exposed-to-toxic-content.html
Did Mango founder Isak Andic fall to his death or was he pushed by his son?  ,https://english.elpais.com/spain/2025-10-20/did-mango-founder-isak-andic-fall-to-his-death-or-was-he-pushed-by-his-son.html
"Elio Berenett, the model who challenges convention",https://english.elpais.com/culture/2025-10-19/elio-berenett-the-model-who-challenges-convention-people-didnt-know-how-to-treat-me-i-told-them-i-dont-care-im-up-for-anything.html
"Katseye, the first global K-pop group born from a reality show and meticulously crafted to succeed",https://english.elpais.com/culture/2025-10-19/katseye-the-first-global-k-pop-group-born-from-a-reality-show-and-meticulously-crafted-to-succeed.html
Another crisis is driving Cubans to despair: More than three million suffer from water shortages,https://english.elpais.com/international/2025-10-18/another-crisis-is-driving-cubans-to-despair-more-than-three-million-suffer-from-water-shortages-on-the-island.html
"Cooperative meerkats, guide ants, and dining-room monitor hens: Animals can teach, too",https://english.elpais.com/science-tech/2025-10-18/cooperative-meerkats-guide-ants-and-dining-room-monitor-hens-animals-can-teach-too.html
US aid cuts severely undermine Senegal’s fight against HIV,https://english.elpais.com/health/2025-10-17/us-aid-cuts-severely-undermine-senegals-fight-against-hiv.html
"Dengue, Oropouche fever, chikungunya: an epidemiological crisis has Cuba on edge",https://english.elpais.com/international/2025-10-16/dengue-oropouche-fever-chikungunya-an-epidemiological-crisis-has-cuba-on-edge.html
An experimental therapy saves the lives of more than 60 children with a deadly disease,https://english.elpais.com/science-tech/2025-10-16/an-experimental-therapy-saves-the-lives-of-more-than-60-children-with-a-deadly-disease.html
Gold investment funds glimmer like never before ,https://english.elpais.com/economy-and-business/2025-10-19/gold-investment-funds-glimmer-like-never-before.html
Natural gas has the potential to be a bridge to renewable energy in Mexico ,https://english.elpais.com/economy-and-business/2025-10-18/natural-gas-has-the-potential-to-be-a-bridge-to-renewable-energy-in-mexico.html
The keys to BBVA’s defeat in its takeover bid for Sabadell ,https://english.elpais.com/economy-and-business/2025-10-17/the-keys-to-bbvas-defeat-in-its-takeover-bid-for-sabadell.html
"Jason Hickel: ‘As long as capital controls production, we will have perverse results’",https://english.elpais.com/climate/2025-10-18/jason-hickel-as-long-as-capital-controls-production-we-will-have-perverse-results.html
"Spain increases arms purchases from the US, reaching its highest expenditure ever",https://english.elpais.com/economy-and-business/2025-10-16/spain-increases-arms-purchases-from-the-us-reaching-its-highest-expenditure-ever.html
"Lisa Herzog, philosopher: ‘We have to fight to not be available outside of work hours’",https://english.elpais.com/culture/2025-10-19/lisa-herzog-philosopher-we-have-to-fight-to-not-be-available-outside-of-work-hours.html
John le Carré’s tradecraft: A writer who was once a spy,https://english.elpais.com/culture/2025-10-18/john-le-carres-tradecraft-a-writer-who-was-once-a-spy.html
"Martin Scorsese, as saintly as he is sinful",https://english.elpais.com/culture/2025-10-17/martin-scorsese-as-saintly-as-he-is-sinful.html
"Gao Zhen, the Chinese artist who has been detained for more than 400 days after criticizing Mao",https://english.elpais.com/international/2025-10-17/gao-zhen-the-chinese-artist-who-has-been-detained-for-more-than-400-days-after-criticizing-mao.html
"Lux Pascal, actress: ‘I’m not the only trans person in Pedro Pascal’s life’",https://english.elpais.com/culture/2025-10-18/lux-pascal-actress-im-not-the-only-trans-person-in-pedro-pascals-life.html
A generation in crisis: Why young people are so unhappy,https://english.elpais.com/health/2025-10-12/a-generation-in-crisis-why-young-people-are-so-unhappy.html
Ultraconservative housewives on OnlyFans: The paradox of the ‘MAGA’ women who strip naked ,https://english.elpais.com/society/2025-10-10/ultraconservative-housewives-on-onlyfans-the-paradox-of-the-maga-women-who-strip-naked-on-social-media.html
"Colorful, expensive, and easy to understand: What’s red chip art and why is it so successful?",https://english.elpais.com/culture/2025-10-09/colorful-expensive-and-easy-to-understand-what-red-chip-art-is-and-why-its-so-successful.html
Ozempic does not cure self-esteem,https://english.elpais.com/health/2025-10-16/ozempic-does-not-cure-self-esteem.html
Taylor Swift announces docuseries about ‘The Eras Tour’ and extended concert film ,https://english.elpais.com/people/2025-10-13/taylor-swift-announces-docuseries-about-the-eras-tour-and-extended-concert-film.html
Stillz: ‘I’ve sacrificed my life for my work and I want to be valued’ ,https://english.elpais.com/culture/2025-10-11/stillz-ive-sacrificed-my-life-for-my-work-and-i-want-to-be-valued.html
From Hollywood families to power couples: When nepo babies let their surnames do the matchmaking,https://english.elpais.com/people/2025-10-11/from-hollywood-families-to-power-couples-when-nepo-babies-let-their-surnames-do-the-matchmaking.html
"‘Task,’ violence and depression in working-class Philadelphia",https://english.elpais.com/culture/2025-10-15/task-violence-and-depression-in-working-class-philadelphia.html
"Honey Thaljieh, co-founder of the Palestinian women’s national team: ‘Soccer gave me community, a sense of belonging, dignity’",https://english.elpais.com/sports/2025-10-18/honey-thaljieh-co-founder-of-the-palestinian-womens-national-team-soccer-gave-me-community-a-sense-of-belonging-dignity.html
Drones are changing the face of war and attracting multi-million dollar investments,https://english.elpais.com/economy-and-business/2025-10-19/drones-are-changing-the-face-of-war-and-attracting-multi-million-dollar-investments.html
‘I tried to commit suicide to avoid being stoned’: How to build an accusation against the Taliban regime for its persecution of women ,https://english.elpais.com/international/2025-10-13/i-tried-to-commit-suicide-to-avoid-being-stoned-how-to-build-an-accusation-against-the-taliban-regime-for-its-persecution-of-women.html
The pulse of Peru’s youth threatens entrenched power,https://english.elpais.com/international/2025-10-14/the-pulse-of-perus-youth-threatens-entrenched-power.html
"Liliana Galindo, psychiatrist: ‘There is a peak in psychosis among women around menopause, which isn’t talked about much due to the stigma’",https://english.elpais.com/science-tech/2025-10-14/liliana-galindo-psychiatrist-there-is-a-peak-in-psychosis-among-women-around-menopause-which-isnt-talked-about-much-due-to-the-stigma.html
Listen now LOS40 USA,https://los40.us/
¿Cuáles son los artistas latinos con más nominaciones en LOS40 Music Awards Santander 2025?,https://los40.us/2025/cuales-son-los-artistas-latinos-con-mas-nominaciones-en-los40-music-awards-santander-2025-39953.html
"Nominados a LOS40 Music Awards Santander 2025: Feid, Aitana, Dani Fernández y Lola Índigo lideran la lista",https://los40.us/2025/nominados-a-los40-music-awards-santander-2025-feid-aitana-dani-fernandez-lola-indigo-lideran-la-lista-39866.html
EL PAÍS offers free Spanish lessons with Gymglish,https://english.elpais.com/economy-and-business/2021-11-15/el-pais-offers-free-spanish-lessons-with-gymglish.html
Wounded and handcuffed in hospital beds: The double punishment for the migrants shot at ICE office in Dallas,https://english.elpais.com/usa/2025-09-30/wounded-and-handcuffed-in-hospital-beds-the-double-punishment-for-the-migrants-shot-at-ice-office-in-dallas.html
"
",https://english.elpais.com/usa/2025-09-22/more-deportations-but-far-from-the-largest-in-history-nine-months-of-trumps-immigration-crusade-in-charts.html
Trapped by the ‘incel’ algorithm in Mexico: ‘I thought I would always live miserably’,https://english.elpais.com/international/2025-10-12/trapped-by-the-incel-algorithm-in-mexico-i-thought-i-would-always-live-miserably.html
Witness to North Korea executions: ‘He was only 22 and shot for watching and distributing 70 songs and three South Korean TV series’,https://english.elpais.com/international/2025-09-28/witness-to-north-korea-executions-he-was-only-22-and-shot-for-watching-and-distributing-70-songs-and-three-south-korean-tv-series.html
Escape of 20 Barrio 18 gang members from a maximum-security prison sparks crisis in Guatemala,https://english.elpais.com/international/2025-10-14/escape-of-20-barrio-18-gang-members-from-a-maximum-security-prison-sparks-crisis-in-guatemala.html
Venezuela kicks off its most uncertain presidential campaign,https://english.elpais.com/international/2025-10-15/journey-to-the-epicenter-of-mexicos-floods-poza-rica-calls-for-aid-and-fast.html
Trump’s immigration policy dethrones Mexico’s Modelo Especial as the most popular beer in the United States,https://english.elpais.com/economy-and-business/2025-09-25/trumps-immigration-policy-dethrones-mexicos-modelo-especial-as-the-most-popular-beer-in-the-united-states.html
An economic paradox: When savings are both a good and a bad idea,https://english.elpais.com/economy-and-business/2025-09-23/mexicos-agri-food-exports-decline-due-to-a-perfect-storm-of-the-screwworm-tomato-tariffs-and-tension-over-usmca-trade-deal.html
Christopher Columbus beyond centuries of myth: The explorer wasn’t a revolutionary thinker or a pauper in his final days,https://english.elpais.com/culture/2025-10-12/christopher-columbus-beyond-centuries-of-myth-the-explorer-wasnt-a-revolutionary-thinker-or-a-pauper-in-his-final-days.html
The Russian Tea Room in New York: A cinematic story for a cinematic setting,https://english.elpais.com/eps/2025-09-28/the-russian-tea-room-in-new-york-a-cinematic-story-for-a-cinematic-setting.html
What wild honey bees in the forest can teach us,https://english.elpais.com/science-tech/2025-10-04/what-wild-honey-bees-in-the-forest-can-teach-us.html
"Svante Pääbo, father of paleogenetics: ‘The reason for the Neanderthals’ extinction lies in how numerous we’ve become’",https://english.elpais.com/science-tech/2025-10-06/svante-paabo-father-of-paleogenetics-the-reason-for-the-neanderthals-extinction-lies-in-how-numerous-weve-become.html
Longevity: The great new status symbol,https://english.elpais.com/health/2025-09-26/longevity-the-great-new-status-symbol.html
A night at Maison Colbert: How the Paris residence of Simone de Beauvoir became a luxury hotel ,https://english.elpais.com/travel/2025-09-21/a-night-at-maison-colbert-how-the-paris-residence-of-simone-de-beauvoir-became-a-luxury-hotel.html
"Manolín, the world’s oldest active chess player at 104 ",https://english.elpais.com/sports/2025-10-12/manolin-the-worlds-oldest-active-chess-player-at-104.html
"Climbing without a rope, between freedom and psychopathy",https://english.elpais.com/sports/2025-09-08/carlos-alcaraz-is-now-closer-to-where-he-wants-to-be-hes-a-chameleon-he-can-do-anything.html
