headline,url
Trump doesn’t want pieces of his border wall to be sold as scrap metal,https://english.elpais.com/usa/2024-12-18/trump-doesnt-want-pieces-of-his-border-wall-to-be-sold-as-scrap-metal.html
The teenage girl behind the Wisconsin school shooting: A case with few precedents,https://english.elpais.com/usa/2024-12-18/the-teenage-girl-behind-the-wisconsin-school-shooting-a-case-with-few-precedents.html
East Coast alarmed by wave of mysterious drone sightings,https://english.elpais.com/usa/2024-12-18/east-coast-alarmed-by-wave-of-mysterious-drone-sightings.html
"Osiel Cárdenas, the first drug cartel capitalist",https://english.elpais.com/international/2024-12-18/osiel-cardenas-the-first-drug-cartel-capitalist.html
Cats pay more attention to us than we realize: They outperform babies in word association game,https://english.elpais.com/science-tech/2024-12-18/cats-pay-more-attention-to-us-than-we-realize-they-outperform-babies-in-word-association-game.html
Study reveals the limited research on ADHD treatments for adults,https://english.elpais.com/health/2024-12-18/study-reveals-the-limited-research-on-adhd-treatments-for-adults.html
Movie roles in exchange for nude pics: 27 women accuse filmmaker Eduard Cortés of sexual misconduct,https://english.elpais.com/spain/2024-12-18/movie-roles-in-exchange-for-nude-pics-27-women-accuse-filmmaker-eduard-cortes-of-sexual-misconduct.html
Wave of Russian attacks in Zaporizhzhia raises fears of a larger offensive,https://english.elpais.com/international/2024-12-18/wave-of-russian-attacks-in-zaporizhzhia-raises-fears-of-a-larger-offensive.html
"Raqqa, former Islamic State stronghold, faces regime change in Syria under shadow of Turkey",https://english.elpais.com/international/2024-12-18/raqqa-former-islamic-state-stronghold-faces-regime-change-in-syria-under-shadow-of-turkey.html
ING chief economist: ‘The stock market will be the compass of the next Donald Trump administration’,https://english.elpais.com/economy-and-business/2024-12-18/ing-chief-economist-the-stock-market-will-be-the-compass-of-the-next-donald-trump-administration.html
This is how the family separation policy that shocked the world operated in the first Trump administration,https://english.elpais.com/usa/2024-12-17/this-is-how-the-family-separation-policy-that-shocked-the-world-operated-in-the-first-trump-administration.html
"Caught by Google Maps: Photo of man putting suspicious bundle in his trunk, key to solving a murder",https://english.elpais.com/international/2024-12-18/caught-by-google-maps-photo-of-man-putting-suspicious-bundle-in-his-trunk-key-to-solving-a-murder.html
The new laws that will take effect in Texas in 2025,https://english.elpais.com/usa/2024-12-17/the-new-laws-that-will-take-effect-in-texas-in-2025.html
"2024: A bleak year for hunger and poverty, with an unexpected ray of hope",https://english.elpais.com/international/2024-12-18/2024-a-bleak-year-for-hunger-and-poverty-with-an-unexpected-ray-of-hope.html
How a Village People classic ended up in the hands of the far right,https://english.elpais.com/culture/2024-12-17/my-wife-will-sue-anyone-who-falsely-refers-to-ymca-as-a-gay-anthem-how-a-village-people-classic-ended-up-in-the-hands-of-the-far-right.html
Fifty years of ‘Playgirl’: Soft porn for strong women (and gay men),https://english.elpais.com/culture/2024-12-16/fifty-years-of-playgirl-soft-porn-for-strong-women-and-gay-men.html
Disney princesses also get sick: The health risks of living ‘happily ever after’,https://english.elpais.com/health/2024-12-17/disney-princesses-also-get-sick-the-health-risks-of-living-happily-ever-after.html
The Egyptian fish that shows us why having a fever is very useful,https://english.elpais.com/science-tech/2024-12-17/the-egyptian-fish-that-shows-us-why-having-a-fever-is-very-useful.html
A disaster foretold: Three years of aging Russian tankers navigating the globe,https://english.elpais.com/economy-and-business/2024-12-17/a-disaster-foretold-three-years-of-aging-russian-tankers-navigating-the-globe.html
New research suggests the Moon may have formed very shortly after the Earth,https://english.elpais.com/science-tech/2024-12-18/new-research-suggests-the-moon-may-have-formed-very-shortly-after-the-earth.html
"Nicholas McGranahan, researcher: ‘If we don’t consider the theory of evolution when it comes to cancer, we’re bound to fail’",https://english.elpais.com/science-tech/2024-12-15/nicholas-mcgranahan-researcher-if-we-dont-consider-the-theory-of-evolution-when-it-comes-to-cancer-were-bound-to-fail.html
"Toren Finkel, gerontologist: ‘We may have hit a biological wall in the fight to prolong life, but walls come down’",https://english.elpais.com/science-tech/2024-12-14/toren-finkel-gerontologist-we-may-have-hit-a-biological-wall-in-the-fight-to-prolong-life-but-walls-come-down.html
"Five years after the start of the pandemic, no one knows how many people are living with long Covid",https://english.elpais.com/health/2024-12-13/five-years-after-start-of-pandemic-no-one-knows-how-many-people-are-living-with-long-covid-they-see-you-as-a-bum-who-doesnt-want-to-work.html
From gasoline to plastic: The oil companies’ business strategy that blocks environmental treaties,https://english.elpais.com/international/2024-12-14/from-gasoline-to-plastic-the-oil-companies-business-strategy-that-blocks-environmental-treaties.html
Mexican business leaders brace for Trump’s tariffs: ‘We must take his threats very seriously’,https://english.elpais.com/economy-and-business/2024-12-16/mexican-business-leaders-brace-for-trumps-tariffs-we-must-take-his-threats-very-seriously.html
The ‘anti-woke’ guru helping Elon Musk to make the US efficient again,https://english.elpais.com/opinion/2024-12-14/the-anti-woke-guru-helping-elon-musk-to-make-the-us-efficient-again.html
El Salvador’s crypto dream falters under IMF pressure,https://english.elpais.com/economy-and-business/2024-12-13/el-salvadors-crypto-dream-falters-under-imf-pressure.html
"Brianna Nofil, historian: ‘There’s going to be massive amounts of money made at every step of the deportation process’",https://english.elpais.com/usa/2024-12-14/brianna-nofil-historian-theres-going-to-be-massive-amounts-of-money-made-at-every-step-of-the-deportation-process.html
"Beauty, redress and reflection in the first European museum dedicated to female artists  ",https://english.elpais.com/culture/2024-12-15/beauty-redress-and-reflection-in-the-first-european-museum-dedicated-to-female-artists.html
Terrified before dying? The ‘Aztec death whistle’ awakens aversion and symbolism in the brain,https://english.elpais.com/culture/2024-12-16/terrified-before-dying-the-aztec-death-whistle-awakens-aversion-and-symbolism-in-the-brain.html
Mayan universities push to expand Indigenous knowledge beyond oral tradition,https://english.elpais.com/education/2024-12-15/mayan-universities-push-to-expand-indigenous-knowledge-beyond-oral-tradition.html
40 years of cyberpunk: A dystopian future that seems all too real today,https://english.elpais.com/culture/2024-12-13/40-years-of-cyberpunk-a-dystopian-future-that-seems-all-too-real-today.html
Hollywood is no country for Clint Eastwood,https://english.elpais.com/culture/2024-12-13/hollywood-is-no-country-for-clint-eastwood.html
At the movies with Spain’s first naked screening: ‘Everything helps to normalize nudity’,https://english.elpais.com/society/2024-12-16/at-the-movies-with-spains-first-naked-screening-everything-helps-to-normalize-nudity.html
Travel ideas: A holiday home to relax like a hobbit,https://english.elpais.com/travel/2024-12-15/travel-ideas-a-holiday-home-to-relax-like-a-hobbit.html
Meet the Madrileños who move into Toyko-style capsules when they can’t pay their rent  ,https://english.elpais.com/spain/2024-12-14/meet-the-madrilenos-who-move-into-toyko-style-capsules-when-they-cant-pay-their-rent.html
Addicted to the drama: How to co-exist with a person who exaggerates their travails,https://english.elpais.com/health/2024-12-13/addicted-to-the-drama-how-to-co-exist-with-a-person-who-exaggerates-their-travails.html
From clown to ethical role model: How Tom Hanks got the whole world to love him  ,https://english.elpais.com/culture/2024-12-14/from-clown-to-ethical-role-model-how-tom-hanks-got-the-whole-world-to-love-him.html
"Jude Law: ‘For me, Star Wars is a children’s fantasy. But you can put adult themes into any children’s fantasy’  ",https://english.elpais.com/culture/2024-12-15/jude-law-for-me-star-wars-is-a-childrens-fantasy-but-you-can-put-adult-themes-into-any-childrens-fantasy.html
"Footballers to compete in 50°C heat at 2026 World Cup, study warns",https://english.elpais.com/climate/2024-11-28/footballers-to-compete-in-50c-heat-at-2026-world-cup-study-warns.html
"Judith Butler, philosopher: ‘If you sacrifice a minority like trans people, you are operating within a fascist logic’",https://english.elpais.com/culture/2024-12-15/judith-butler-philosopher-if-you-sacrifice-a-minority-like-trans-people-you-are-operating-within-a-fascist-logic.html
"Naples, the most difficult secret to tell",https://english.elpais.com/culture/2024-12-14/naples-the-most-difficult-secret-to-tell.html
The drug war bleeding Sinaloa,https://english.elpais.com/international/2024-12-14/the-drug-war-bleeding-sinaloa.html
AI is a real chimera: It can make the world radically better,https://english.elpais.com/technology/2024-12-12/ai-is-a-real-pipe-dream-it-can-make-the-world-radically-better.html
Listen now LOS40 USA,https://los40.us/
Mariah Carey’s Christmas Gift to Rihanna at Brooklyn Concert: ‘She’s Signing My Tits’ ,https://los40.us/2024/mariah-careys-christmas-gift-to-rihanna-at-brooklyn-concert-shes-signing-my-tits-27786.html
Rauw Alejandro Addresses His Relationship with Diddy: ‘I Never Went to Those Parties’,https://los40.us/2024/rauw-alejandro-addresses-his-relationship-with-diddy-i-never-went-to-those-parties-27795.html
EL PAÍS offers free Spanish lessons with Gymglish,https://english.elpais.com/economy-and-business/2021-11-15/el-pais-offers-free-spanish-lessons-with-gymglish.html
"Trump says he’ll deport criminal migrants first, but who is he referring to?",https://english.elpais.com/usa/2024-12-16/trump-says-hell-deport-criminal-migrants-first-but-who-is-he-referring-to.html
The border Biden leaves behind: Stable thanks to Mexico and doors closed to asylum seekers,https://english.elpais.com/usa/2024-12-15/the-border-biden-leaves-behind-stable-thanks-to-mexico-and-doors-closed-to-asylum-seekers.html
"Najib Mikati, prime minister of Lebanon: ‘Trump is a pragmatic man. I hope he will impose a solution for Palestine’",https://english.elpais.com/international/2024-12-13/najib-mikati-prime-minister-of-lebanon-trump-is-a-pragmatic-man-i-hope-he-will-impose-a-solution-for-palestine.html
Seeking low-cost technological solutions for the war in Ukraine,https://english.elpais.com/international/2024-12-12/seeking-low-cost-technological-solutions-for-the-war-in-ukraine.html
"Long after revealing the true outcome of Venezuela’s presidential election, an exile dreams of returning   ",https://english.elpais.com/international/2024-12-15/long-after-revealing-the-true-outcome-of-venezuelas-presidential-election-an-exile-dreams-of-returning.html
Venezuela kicks off its most uncertain presidential campaign,https://english.elpais.com/international/2024-12-13/in-attempt-to-ease-pressure-maduro-announces-release-of-over-100-protesters-detained-after-contested-election.html
How much the minimum wage will rise in New York starting in 2025 ,https://english.elpais.com/economy-and-business/2024-12-11/how-much-the-minimum-wage-will-rise-in-new-york-starting-in-2025.html
An economic paradox: When savings are both a good and a bad idea,https://english.elpais.com/economy-and-business/2024-12-09/five-signs-of-market-excesses-what-dangers-lurk-beneath-the-record-highs.html
The John Ford film saved from the axe and rediscovered 100 years later in Chile,https://english.elpais.com/culture/2024-12-12/the-john-ford-film-saved-from-the-axe-and-rediscovered-100-years-later-in-chile.html
Jorge Ramos and the tireless fight for credibility ,https://english.elpais.com/culture/2024-12-10/jorge-ramos-and-the-tireless-fight-for-credibility.html
"The longest journey of a humpback whale: Male travels over 8,000 miles to mate",https://english.elpais.com/science-tech/2024-12-11/the-longest-journey-of-a-humpback-whale-male-travels-over-8000-miles-to-mate.html
"Jared Isaacman, Elon Musk’s man at the head of NASA: Is the Martian revolution coming?",https://english.elpais.com/science-tech/2024-12-10/jared-isaacman-elon-musks-man-at-the-head-of-nasa-is-the-martian-revolution-coming.html
"Vintage ‘jamón,’ the foodie luxury fetching up to €80,000",https://english.elpais.com/lifestyle/2024-12-10/vintage-jamon-the-new-foodie-luxury-fetching-up-to-80000.html
"‘Instagram therapy’ offers self-diagnoses, vocabulary and justifications, but it does not solve anything   ",https://english.elpais.com/lifestyle/2024-12-08/instagram-therapy-offers-self-diagnoses-vocabulary-and-justifications-but-it-does-not-solve-anything.html
"When cocaine ruled the NBA: ‘Drugs were everywhere, it was like a fad’",https://english.elpais.com/sports/2024-11-06/when-cocaine-ruled-the-nba-drugs-were-everywhere-it-was-like-a-fad.html
"Climbing without a rope, between freedom and psychopathy",https://english.elpais.com/sports/2024-11-04/racism-sexism-and-lgbtqphobia-tarnish-the-rise-of-womens-basketball-in-the-us.html
