headline,url
Harris and Trump teams adjust their strategies as campaign hits homestretch,https://english.elpais.com/usa/elections/2024-09-12/harris-and-trump-teams-adjust-their-strategies-as-campaign-enters-the-homestretch.html
Trump takes Harris’ bait,https://english.elpais.com/usa/elections/2024-09-12/trump-takes-harris-bait.html
Billionaire Jared Isaacman makes history with first ever private spacewalk: ‘From here Earth sure looks like a perfect world’,https://english.elpais.com/science-tech/2024-09-12/billionaire-jared-isaacman-makes-history-with-first-ever-private-spacewalk-from-here-earth-sure-looks-like-a-perfect-world.html
"Alberto Fujimori, the farewell of another Latin American strongman",https://english.elpais.com/international/2024-09-12/alberto-fujimori-the-farewell-of-another-latin-american-strongman.html
Extreme weather and epidemics: How 75 people were hospitalized after eating contaminated lettuce,https://english.elpais.com/health/2024-09-12/extreme-weather-and-epidemics-how-75-people-were-hospitalized-after-eating-contaminated-lettuce.html
"Taylor Swift crowned at MTV’s VMAs gala, where women took power on stage",https://english.elpais.com/culture/2024-09-12/taylor-swift-crowned-at-mtvs-vmas-gala-where-women-took-power-on-stage.html
Famous Winston Churchill portrait stolen from a Canada hotel is found in Italy after two-year hunt,https://english.elpais.com/international/2024-09-12/famous-winston-churchill-portrait-stolen-from-a-canada-hotel-is-found-in-italy-after-two-year-hunt.html
Mexico’s judicial reform: The win for López Obrador that’s mortally wounded the opposition ,https://english.elpais.com/international/2024-09-12/mexicos-judicial-reform-the-win-for-lopez-obrador-thats-mortally-wounded-the-opposition.html
Nicaragua tightens control of social media to censor dissent,https://english.elpais.com/international/2024-09-12/nicaragua-tightens-control-of-social-media-to-censor-dissent.html
US and Chinese soldiers take part in joint military exercises in Brazil,https://english.elpais.com/international/2024-09-12/us-and-chinese-soldiers-take-part-in-joint-military-exercises-in-brazil.html
"US inflation eased to 2.5% in August, its lowest point since early 2021",https://english.elpais.com/economy-and-business/2024-09-11/us-inflation-eased-to-25-in-august-its-lowest-point-since-early-2021.html
The journey of thousands of young Ukrainian deserters,https://english.elpais.com/international/2024-09-10/the-journey-of-thousands-of-young-ukrainian-deserters-tight-border-controls-and-perilous-mountains.html
How a pioneering movement of Basque families managed a ‘digital delay’ for their teenage kids,https://english.elpais.com/technology/2024-09-11/how-a-pioneering-movement-of-basque-families-managed-a-digital-delay-for-their-teenage-kids.html
"In Mexico, Sinaloa suspends Independence Day celebrations due to cartel violence",https://english.elpais.com/international/2024-09-12/in-mexico-sinaloa-suspends-independence-day-celebrations-due-to-cartel-violence.html
‘Come From Away’: The hit Broadway musical about the other 9/11 story ,https://english.elpais.com/culture/2024-09-12/come-from-away-the-hit-broadway-musical-about-the-other-911-story.html
Steve Kerr: ‘No company in the world would hire someone with Trump’s resume’,https://english.elpais.com/sports/2024-09-11/steve-kerr-no-company-in-the-world-would-hire-someone-with-trumps-resume.html
DNA suggests that the Rapa Nui arrived in the Americas two centuries before Columbus,https://english.elpais.com/science-tech/2024-09-11/dna-suggests-that-the-rapa-nui-arrived-in-the-americas-two-centuries-before-columbus.html
Why spoons are Cate Blanchett’s new fashion accessory  ,https://english.elpais.com/people/2024-09-11/why-spoons-are-cate-blanchetts-new-fashion-accessory.html
"Orly Razgour, bat expert: ‘I have never been bitten by a vampire bat, so far’",https://english.elpais.com/science-tech/2024-09-11/orly-razgour-bat-expert-i-have-never-been-bitten-by-a-vampire-bat-so-far.html
9/11: A timeline of the events of the September 11 attacks,https://english.elpais.com/usa/2024-09-11/911-a-timeline-of-the-events-of-the-september-11-attacks.html
New generation of radioactive drugs strike cancer with molecular precision,https://english.elpais.com/science-tech/2024-09-11/new-generation-of-radioactive-drugs-strike-cancer-with-molecular-precision.html
Study identifies brain regions that are almost twice as large in people living with depression ,https://english.elpais.com/science-tech/2024-09-08/study-identifies-brain-regions-that-are-almost-twice-as-large-in-people-living-with-depression.html
"Noelia Ferruz, the chemist creating AI with ‘supernatural’ powers",https://english.elpais.com/science-tech/2024-09-06/noelia-ferruz-the-chemist-creating-ai-with-supernatural-powers.html
Pathogenic microbes can travel thousands of miles through the atmosphere,https://english.elpais.com/science-tech/2024-09-10/pathogenic-microbes-can-travel-thousands-of-miles-through-the-atmosphere.html
America’s housing crisis is at the heart of the economic pessimism affecting this election,https://english.elpais.com/economy-and-business/2024-09-09/americas-housing-crisis-is-at-the-heart-of-the-economic-pessimism-affecting-this-election.html
"There are plenty of banknotes in Argentina, yet Argentines are not rich",https://english.elpais.com/economy-and-business/2024-09-09/there-are-plenty-of-banknotes-in-argentina-yet-argentines-are-not-rich.html
"In Africa, China seeks an outlet for its clean technologies",https://english.elpais.com/economy-and-business/2024-09-09/in-africa-china-seeks-an-outlet-for-its-clean-technologies.html
Authorities warn about surge in Bitcoin ATM scams,https://english.elpais.com/economy-and-business/2024-09-06/authorities-warn-about-surge-in-bitcoin-atm-scams.html
"Nick Cave: ‘I don’t know where I would be if my son hadn’t died. Grief turns you into a person. Before, I was incomplete’ ",https://english.elpais.com/culture/2024-09-08/nick-cave-i-dont-know-where-i-would-be-if-my-son-hadnt-died-grief-turns-you-into-a-person-before-i-was-incomplete.html
Hall & Oates spat seeps into music,https://english.elpais.com/culture/2024-09-10/hall-oates-spat-seeps-into-music.html
"JHAYCO: ‘Not everything has to be thuggery, not everything has to be street’    ",https://english.elpais.com/culture/2024-09-08/jhayco-not-everything-has-to-be-thuggery-not-everything-has-to-be-street.html
Mexican singer Jaramar Soto’s intense passion for rescuing the voices of women in baroque music,https://english.elpais.com/culture/2024-09-08/mexican-singer-jaramar-sotos-intense-passion-for-rescuing-the-voices-of-women-in-baroque-music.html
‘Synchronicity’: The experimental album that went gold and broke up The Police  ,https://english.elpais.com/culture/2024-09-07/synchronicity-the-experimental-album-that-went-gold-and-broke-up-the-police.html
The science of Stoicism: Does it really improve mental health?,https://english.elpais.com/health/2024-09-10/the-science-of-stoicism-does-it-really-improve-mental-health.html
"Haute cuisine enters the jungle: ‘The Spanish and French have the technique, we have the pantry’",https://english.elpais.com/culture/2024-09-08/haute-cuisine-enters-the-jungle-the-spanish-and-french-have-the-technique-we-have-the-pantry.html
How to prevent cosmetic addiction in minors: limit the use of technology and build up their self-esteem   ,https://english.elpais.com/lifestyle/2024-09-08/how-to-prevent-cosmetic-addiction-in-minors-limit-the-use-of-technology-and-build-up-their-self-esteem.html
"Three years chatting, and for what? The people who use hookup apps, but avoid face-to-face",https://english.elpais.com/lifestyle/2024-09-07/three-years-chatting-and-for-what-the-people-who-use-hookup-apps-but-avoid-face-to-face.html
Sean Combs ordered to pay $100 million after failing to appear in court in sexual assault case,https://english.elpais.com/people/2024-09-10/sean-combs-ordered-to-pay-100-million-after-failing-to-appear-in-court-in-sexual-assault-case.html
"All the Venice looks of Isabelle Huppert, the 71-year-old star who dares to wear everything",https://english.elpais.com/culture/2024-09-09/all-the-venice-looks-of-isabelle-huppert-the-71-year-old-star-who-dares-to-wear-everything.html
Zoë Kravitz and Channing Tatum: The unlikely romance between the enigmatic rich girl and the working-class hero,https://english.elpais.com/people/2024-09-10/zoe-kravitz-and-channing-tatum-the-unlikely-romance-between-the-enigmatic-rich-girl-and-the-working-class-hero.html
Farewell to the ‘Halle Berry effect’: Actress who made Oscars history stages comeback after two decades in the wilderness,https://english.elpais.com/culture/2024-09-09/winona-ryder-forever-the-return-of-the-weird-girl-that-weinstein-hated.html
"Kílian Jornet and the challenge of 82 four-thousand-meter peaks: ‘He feels physically perfect but, at times, psychologically tired’  ",https://english.elpais.com/sports/2024-09-02/kilian-jornet-and-the-challenge-of-82-four-thousand-meter-peaks-he-feels-physically-perfect-but-at-times-psychologically-tired.html
"Ben Ainslie, skipper of INEOS Britannia: ‘I’ve lost too many friends to the sea. I have a very healthy respect for it’",https://english.elpais.com/sports/2024-08-22/ben-ainslie-skipper-of-ineos-britannia-ive-lost-too-many-friends-to-the-sea-i-have-a-very-healthy-respect-for-it.html
"Seven elite women athletes who had to justify, explain or defend the way they look  ",https://english.elpais.com/sports/olympic-games/2024-08-15/seven-elite-women-athletes-who-had-to-justify-explain-or-defend-the-way-they-look.html
"Francis Kurkdjian, Dior’s nose, faces the biggest challenge of his career: The relaunch of Sauvage perfume ",https://english.elpais.com/lifestyle/2024-09-08/francis-kurkdjian-diors-nose-faces-the-biggest-challenge-of-his-career-the-relaunch-of-sauvage-perfume.html
Financial nihilism: The end of faith in the real value of money,https://english.elpais.com/economy-and-business/2024-09-08/financial-nihilism-the-end-of-faith-in-the-real-value-of-money.html
Dominique Pélicot: The ‘great guy’ who was a monster,https://english.elpais.com/international/2024-09-10/dominique-pelicot-the-great-guy-who-was-a-monster.html
The plight of Colombians fighting for Ukraine detained in Russia after disappearing in Caracas: ‘They are not mercenaries’,https://english.elpais.com/international/2024-09-09/the-plight-of-colombians-fighting-for-ukraine-detained-in-russia-after-disappearing-in-caracas-they-are-not-mercenaries.html
Listen now LOS40 USA,https://los40.us/
Karol G Gets Taylor Swift Dancing at the 2024 VMAs: VIDEO,https://los40.us/2024/karol-g-gets-taylor-swift-dancing-at-the-2024-vmas-video-24498.html
MTV VMAs: Iconic Latin Performances,https://los40.us/2024/mtv-vmas-iconic-latin-performances-24445.html
EL PAÍS offers free Spanish lessons with Gymglish,https://english.elpais.com/economy-and-business/2021-11-15/el-pais-offers-free-spanish-lessons-with-gymglish.html
"The Harris-Trump debate as told by social media: Memes, videos and viral posts",https://english.elpais.com/usa/elections/2024-09-11/the-harris-trump-debate-as-told-by-social-media-memes-videos-and-viral-posts.html
"Who won the presidential debate: Prediction markets, analysts and early polls declare Kamala Harris the winner",https://english.elpais.com/usa/elections/2024-09-11/who-won-the-presidential-debate-prediction-markets-analysts-and-early-polls-declare-kamala-harris-the-winner.html
"The ‘torture’ of Alexey Soldatov, the father of the Russian Internet, terminally ill and imprisoned without a bed",https://english.elpais.com/international/2024-09-09/the-torture-of-alexey-soldatov-the-father-of-the-russian-internet-terminally-ill-and-imprisoned-without-a-bed.html
"A summer away from the bombing of Ukraine, thanks to the Spanish province of Jaén",https://english.elpais.com/international/2024-09-09/gisele-p-the-woman-who-is-shifting-the-direction-of-shame.html
Bernardo Arévalo: ‘We have reaffirmed that Guatemala can have a government that doesn’t bend the knee to corruption’,https://english.elpais.com/international/2024-09-10/bernardo-arevalo-we-have-reaffirmed-that-guatemala-can-have-a-government-that-doesnt-bend-the-knee-to-corruption.html
Venezuela kicks off its most uncertain presidential campaign,https://english.elpais.com/culture/2024-09-07/its-chiles-titanic-and-yet-no-one-remembers-it-the-forgotten-story-of-the-19th-century-church-fire-that-killed-2000-women.html
Will mortgage rates go down in September? Here’s what you need to know,https://english.elpais.com/economy-and-business/2024-09-05/will-mortgage-rates-go-down-in-september-heres-what-you-need-to-know.html
An economic paradox: When savings are both a good and a bad idea,https://english.elpais.com/economy-and-business/2024-09-06/cooling-us-job-market-will-set-the-pace-of-rate-cuts-as-recession-fears-loom.html
"Mauro Ketlun, the sculptor who shaped Leo Messi with recycled trash",https://english.elpais.com/culture/2024-09-07/mauro-ketlun-the-sculptor-who-shaped-leo-messi-with-recycled-trash.html
The Mexican artist who is boosting Post Malone’s latest album   ,https://english.elpais.com/culture/2024-09-07/the-mexican-artist-who-is-boosting-post-malones-latest-album.html
Dozens of ‘high-risk’ viruses discovered on fur farms in China,https://english.elpais.com/science-tech/2024-09-04/dozens-of-high-risk-viruses-discovered-on-fur-farms-in-china.html
Science analyzes 150 years of literature: How fiction has reinforced the stereotype of the passive woman,https://english.elpais.com/culture/2024-09-03/science-analyzes-150-years-of-literature-how-fiction-has-reinforced-the-stereotype-of-the-passive-woman.html
‘This is not your normal masturbation’: Artificial intelligence comes to male sex toys  ,https://english.elpais.com/lifestyle/2024-09-01/this-is-not-your-normal-masturbation-artificial-intelligence-comes-to-male-sex-toys.html
"Hope, the secret weapon of philosopher Byung-Chul Han",https://english.elpais.com/lifestyle/2024-08-28/hope-the-secret-weapon-of-philosopher-byung-chul-han.html
Javier Milei’s government scores own goal with Diego Maradona snub,https://english.elpais.com/international/2024-08-14/javier-mileis-government-scores-own-goal-with-diego-maradona-snub.html
"Climbing without a rope, between freedom and psychopathy",https://english.elpais.com/sports/olympic-games/2024-08-13/olympic-medal-table-by-population-and-wealth-which-countries-fared-the-best-at-the-paris-games.html
