headline,url
Trump will face the first ever criminal trial of a former US president starting on April 15 ,https://english.elpais.com/usa/2024-03-25/trump-will-face-the-first-ever-criminal-trial-of-a-former-us-president-starting-on-april-15.html
A New York court reduces the amount of Trump’s bond to $175 million and gives him ten more days to pay it,https://english.elpais.com/usa/2024-03-25/a-new-york-court-reduces-the-amount-of-trumps-bond-to-175-million-and-gives-him-ten-more-days-to-pay-it.html
"SB4, the Texas anti-immigrant law causing even more chaos",https://english.elpais.com/usa/2024-03-25/sb4-the-texas-anti-immigrant-law-creating-even-more-chaos-on-the-us-mexico-border.html
"Food, electricity and freedom: citizen protest is reactivated in Cuba",https://english.elpais.com/international/2024-03-26/food-electricity-and-freedom-citizen-protest-is-reactivated-in-cuba.html
UN Security Council approves first Gaza ceasefire resolution after six months of war,https://english.elpais.com/international/2024-03-25/un-security-council-approves-first-gaza-ceasefire-resolution-after-six-months-of-war.html
The band that was to play during the Moscow attack: ‘There are no words that can revive people’,https://english.elpais.com/international/2024-03-25/the-band-that-was-going-to-play-on-the-day-of-the-moscow-attack-there-are-no-words-that-can-revive-or-console-people.html
"Prince William, the grieving royal who has learned to suffer in silence",https://english.elpais.com/people/2024-03-25/prince-william-the-grieving-royal-who-has-learned-to-suffer-in-silence.html
"US and UK announce sanctions over China-linked hacks on officials, lawmakers and election watchdog",https://english.elpais.com/international/2024-03-25/us-and-uk-announce-sanctions-over-china-linked-hacks-on-officials-lawmakers-and-election-watchdog.html
Death threats and security concerns hinder creation of council that will choose Haiti’s next leader,https://english.elpais.com/international/2024-03-26/death-threats-and-security-concerns-hinder-creation-of-council-that-will-choose-haitis-next-leader.html
Serbians are petitioning against a planned luxury project backed by Trump son-in-law’s firm,https://english.elpais.com/international/2024-03-25/serbians-are-petitioning-against-a-planned-luxury-project-backed-by-trump-son-in-laws-firm.html
How does war affect nature? Syria has lost 20% of its forests in 10 years,https://english.elpais.com/climate/2024-03-25/how-does-war-affect-nature-syria-has-lost-20-of-its-forests-in-10-years.html
The United States takes aim at Big Tech,https://english.elpais.com/economy-and-business/2024-03-25/the-united-states-takes-aim-at-big-tech.html
Florida’s DeSantis signs one of the country’s most restrictive social media bans for minors,https://english.elpais.com/usa/2024-03-25/floridas-desantis-signs-one-of-the-countrys-most-restrictive-social-media-bans-for-minors.html
Feds search Sean ‘Diddy’ Combs’ properties as part of sex trafficking probe,https://english.elpais.com/people/2024-03-26/feds-search-sean-diddy-combs-properties-as-part-of-sex-trafficking-probe.html
"Shohei Ohtani says he never bet on sports, interpreter Ippei Mizuhara stole money, told lies",https://english.elpais.com/sports/2024-03-26/shohei-ohtani-says-he-never-bet-on-sports-interpreter-ippei-mizuhara-stole-money-told-lies.html
‘Obviously the mistake was made’: Big East remains unbeaten in NCAA Tournament after only three bids,https://english.elpais.com/sports/2024-03-25/obviously-the-mistake-was-made-big-east-remains-unbeaten-in-ncaa-tournament-after-only-three-bids.html
Nine babies from Gaza without a name or a family,https://english.elpais.com/international/2024-03-25/nine-babies-from-gaza-without-a-name-or-a-family.html
The Gamboa case: The triple murder shining a light on police violence in Brazil,https://english.elpais.com/international/2024-03-25/the-gamboa-case-the-triple-murder-shining-a-light-on-police-violence-in-brazil.html
Dani Alves pays bail for release from jail in Spain while waiting appeal of rape conviction ,https://english.elpais.com/international/2024-03-25/dani-alves-pays-bail-for-release-from-jail-in-spain-while-waiting-appeal-of-rape-conviction.html
The female urge not to take that pill,https://english.elpais.com/health/2024-03-25/the-female-urge-not-to-take-that-pill.html
Strolling as a way to disconnect from the stress of everyday life,https://english.elpais.com/health/2024-03-26/strolling-as-a-way-to-disconnect-from-the-stress-of-everyday-life.html
"An NBA ring, an auction and a vast fortune: The Bryants’ war drags on four years after Kobe’s death",https://english.elpais.com/people/2024-03-24/an-nba-ring-an-auction-and-a-vast-fortune-the-bryants-war-drags-on-four-years-after-kobes-death.html
Uptick in cancer among younger generations perplexes scientists,https://english.elpais.com/health/2024-03-25/uptick-in-cancer-cases-among-younger-generations-perplexes-scientists.html
The magnetic shield that protects Earth and makes life possible,https://english.elpais.com/science-tech/2024-03-23/the-magnetic-shield-that-protects-earth-and-makes-life-possible.html
Why scientists are making transparent wood,https://english.elpais.com/science-tech/2024-03-24/why-scientists-are-making-transparent-wood.html
Exosomes: A breakthrough in skin regeneration  ,https://english.elpais.com/health/2024-03-23/exosomes-a-breakthrough-in-skin-regeneration.html
"Everyone wants to ride the wave of ETFs, the trending product on Wall Street",https://english.elpais.com/economy-and-business/2024-03-25/everyone-wants-to-ride-the-wave-of-etfs-the-trending-product-on-wall-street.html
Streaming platforms navigate user disloyalty ,https://english.elpais.com/culture/2024-03-25/streaming-platforms-navigate-user-disloyalty.html
The thriving US economy of discontent,https://english.elpais.com/economy-and-business/2024-03-24/the-thriving-us-economy-of-discontent.html
Jerome Powell prepares to lower interest rates during an election year,https://english.elpais.com/economy-and-business/2024-03-24/jerome-powell-prepares-to-lower-interest-rates-during-an-election-year.html
"Emily Nagoski, sexologist: ‘Yes, please, talk to each other about your sex lives’",https://english.elpais.com/lifestyle/2024-03-23/emily-nagoski-sexologist-yes-please-talk-to-each-other-about-your-sex-lives.html
"Emojis are not a universal language: Gender, age and culture influence their interpretation  ",https://english.elpais.com/technology/2024-03-23/emojis-are-not-a-universal-language-gender-age-and-culture-influence-their-interpretation.html
How to find your purpose in life,https://english.elpais.com/lifestyle/2024-03-21/how-to-find-your-purpose-in-life.html
"Regardless of the platform or algorithm, it’s humans that make social media toxic",https://english.elpais.com/technology/2024-03-20/regardless-of-the-platform-or-algorithm-its-humans-that-make-social-media-toxic.html
"‘Mileva Einstein, theory of sadness’: when the physicist wanted to turn his wife, and brilliant mathematician, into his maid",https://english.elpais.com/culture/2024-03-23/mileva-einstein-theory-of-sadness-when-the-physicist-wanted-to-turn-his-wife-and-brilliant-mathematician-into-his-maid.html
‘Suburbia’ exhibition captures the allure and delirium of the American dream ,https://english.elpais.com/culture/2024-03-25/suburbia-exhibition-captures-the-allure-and-delirium-of-the-american-dream.html
Did God create Aretha Franklin?  ,https://english.elpais.com/culture/2024-03-25/did-god-create-aretha-franklin.html
The great museum that houses the newly discovered treasures of Chichén Itzá  ,https://english.elpais.com/culture/2024-03-25/the-great-museum-that-houses-the-newly-discovered-treasures-of-chichen-itza.html
The endless legacy of Johann Sebastian Bach,https://english.elpais.com/culture/2024-03-24/the-endless-legacy-of-johann-sebastian-bach.html
"Sergio López-Rivera, the Spanish makeup artist who left Shonda Rhimes to follow Viola Davis around the world",https://english.elpais.com/culture/2024-03-25/sergio-lopez-rivera-the-spanish-makeup-artist-who-left-shonda-rhimes-to-follow-viola-davis-around-the-world.html
"Richard Chamberlain, the king of television who lived in hiding: ‘I would have been happier out of the closet, being free’",https://english.elpais.com/culture/2024-03-23/richard-chamberlain-the-king-of-television-who-lived-in-hiding-i-would-have-been-happier-out-of-the-closet-being-free.html
From ‘Money Heist’ to ‘Fargo’: Stephen King’s TV show recommendations,https://english.elpais.com/culture/2024-03-23/from-money-heist-to-fargo-stephen-kings-tv-show-recommendations.html
‘Las Mujeres Ya No Lloran’: Shakira’s latest album is a monument to current pop culture,https://english.elpais.com/culture/2024-03-22/las-mujeres-ya-no-lloran-shakiras-latest-album-is-a-monument-to-current-pop-culture.html
Live now in Los40,https://los40.us/ 
Shakira Explains to LOS40 the Impact of ‘Women No Longer Cry’: «No One Has The Right to Tell Us How to Heal»,https://los40.us/2024/shakira-explains-to-los40-the-impact-of-women-no-longer-cry-no-one-has-the-right-to-tell-us-how-to-heal-18532.html
The Secret Rauw Alejandro Has Just Revealed After Connection With Rosalía,https://los40.us/2024/the-secret-rauw-alejandro-has-just-revealed-after-connection-with-rosalia-18548.html
Spain’s Civil Guard probes Spanish Super Cup move to Saudi Arabia,https://english.elpais.com/sports/2024-03-21/spains-civil-guard-probes-spanish-super-cup-move-to-saudi-arabia.html
Nike’s new England men’s soccer shirt is causing a stir with its recolored flag ,https://english.elpais.com/economy-and-business/2024-03-22/nikes-new-england-mens-soccer-shirt-is-causing-a-stir-with-its-recolored-flag.html
The Caitlin Clark effect is revolutionizing college basketball in the United States  ,https://english.elpais.com/sports/2024-03-20/the-caitlin-clark-effect-is-revolutionizing-college-basketball-in-the-united-states.html
Ohtani’s interpreter is fired by Dodgers after allegations of ‘massive theft’ from Japanese star ,https://english.elpais.com/sports/2024-03-21/ohtanis-interpreter-is-fired-by-dodgers-after-allegations-of-massive-theft-from-japanese-star.html
"Kathryn Schulz, writer: ‘The world is very large, that’s why it’s so incredible to find the ideal person’",https://english.elpais.com/culture/2024-03-24/kathryn-schulz-writer-the-world-is-very-large-thats-why-its-so-incredible-to-find-the-ideal-person.html
"The Crumbleys, a family behind bars: The massacre that made history and landed the killer’s parents in jail",https://english.elpais.com/usa/2024-03-24/the-crumbleys-a-family-behind-bars-the-massacre-that-made-history-and-landed-the-killers-parents-in-jail.html
"Eric Mazur, academic dean at Harvard: ‘Failure is essential and grades stigmatize it’",https://english.elpais.com/education/2024-03-23/eric-mazur-academic-dean-at-harvard-failure-is-essential-and-grades-stigmatize-it.html
"Robert Sapolsky, neuroscientist: ‘Meritocracy is system justification’",https://english.elpais.com/science-tech/2024-03-22/robert-sapolsky-neuroscientist-meritocracy-is-system-justification.html
EL PAÍS offers free Spanish lessons with Gymglish,https://english.elpais.com/economy-and-business/2021-11-15/el-pais-offers-free-spanish-lessons-with-gymglish.html
Trump potentially nets around $3 billion with merger approval for his social media company,https://english.elpais.com/economy-and-business/2024-03-22/donald-trump-could-get-stock-worth-34-billion-on-paper-with-the-merger-of-his-truth-social-site.html
Oath Keepers’ son emerges from traumatic childhood to tell his own story in a long shot election bid,https://english.elpais.com/usa/elections/2024-03-24/oath-keepers-son-emerges-from-traumatic-childhood-to-tell-his-own-story-in-a-long-shot-election-bid.html
Powerful Spanish regional leader under pressure as court investigates her partner’s tax affairs ,https://english.elpais.com/international/2024-03-22/powerful-spanish-regional-leader-under-pressure-as-court-investigates-her-partners-tax-affairs.html
Prince Harry’s lawyer implicates Rupert Murdoch in cover-up of unlawful snooping by his tabloids ,https://english.elpais.com/people/2024-03-20/prince-harrys-lawyer-implicates-rupert-murdoch-in-cover-up-of-unlawful-snooping-by-his-tabloids.html
"Corina Yoris, the 80-year-old academic who will face Nicolás Maduro at the polls",https://english.elpais.com/international/2024-03-23/corina-yoris-the-renowned-80-year-old-academic-who-will-face-nicolas-maduro-at-the-polls.html
Six records and a 144.1ºF heat index: The beaches of Rio de Janeiro are burning,https://english.elpais.com/climate/2024-03-21/six-records-and-a-1441f-heat-index-the-beaches-of-rio-de-janeiro-are-burning.html
An economic paradox: When savings are both a good and a bad idea,https://english.elpais.com/international/2024-03-16/the-middle-class-turns-out-the-lights-in-france.html
An economic paradox: When savings are both a good and a bad idea,https://english.elpais.com/economy-and-business/2024-03-16/china-steps-on-the-gas-in-the-mexican-auto-market-the-long-term-goal-is-the-us.html
The time the world changed: Paris at the beginning of the 20th century,https://english.elpais.com/culture/2024-03-22/the-time-the-world-changed-paris-at-the-beginning-of-the-20th-century.html
"Julieta Venegas: ‘Men must also drive change, not just women. Start by questioning what we consider normal in our mindset’",https://english.elpais.com/culture/2024-03-19/julieta-venegas-men-must-also-drive-change-not-just-women-start-by-questioning-what-we-consider-normal-in-our-mindset.html
On the trail of cancer to understand how and when it originated ,https://english.elpais.com/health/2024-03-19/on-the-trail-of-cancer-to-understand-how-and-when-it-originated.html
"Neurologist Josep Dalmau: ‘We are discovering amazing things, the brain never stops surprising us’",https://english.elpais.com/science-tech/2024-03-18/neurologist-josep-dalmau-we-are-discovering-amazing-things-the-brain-never-stops-surprising-us.html
How doing physical exercise can help improve memory,https://english.elpais.com/health/2024-03-10/how-doing-physical-exercise-can-help-improve-memory.html
The curious theory about cars with loofahs on the roof  ,https://english.elpais.com/lifestyle/2024-03-10/the-curious-theory-about-cars-with-loofahs-on-the-roof.html
2026 World Cup: What you need to know about the stadiums in the US ,https://english.elpais.com/sports/2024-03-15/2026-world-cup-what-you-need-to-know-about-the-stadiums-in-the-us.html
Reaching the South Pole on foot: tougher than competing in eight Tours de France in a row,https://english.elpais.com/sports/2024-03-05/reaching-the-south-pole-on-foot-tougher-than-competing-in-eight-tours-de-france-in-a-row.html
