headline,url
US Senate unveils bill to strengthen border security and send aid to Ukraine and Israel,https://english.elpais.com/usa/2024-02-05/us-senate-unveils-bill-to-strengthen-border-security-and-send-aid-to-ukraine-and-israel.html
Blinken seeks Gaza truce deal at the most ‘dangerous’ moment in the Middle East crisis,https://english.elpais.com/international/2024-02-05/blinken-seeks-gaza-truce-deal-at-the-most-dangerous-moment-in-the-middle-east-crisis.html
Netanyahu digs his heels in over a possible ceasefire in Gaza,https://english.elpais.com/international/2024-02-05/benjamin-netanyahu-digs-his-heels-in-over-a-possible-ceasefire-in-gaza.html
An opaque land deal puts Jerusalem’s Armenians on the warpath,https://english.elpais.com/international/2024-02-05/fights-settlers-and-a-luxury-hotel-an-opaque-land-deal-puts-jerusalems-armenians-on-the-warpath.html
Nayib Bukele after victory: ‘This is the first time in history that El Salvador has a democracy’,https://english.elpais.com/international/2024-02-05/bukele-brushes-aside-criticism-after-claiming-85-of-the-vote-this-is-the-first-time-in-history-that-el-salvador-has-democracy.html
Bukele re-elected: the victory of violence,https://english.elpais.com/international/2024-02-05/bukele-re-elected-the-victory-of-violence.html
King Charles III is diagnosed with cancer,https://english.elpais.com/international/2024-02-05/king-charles-iii-is-diagnosed-with-cancer.html
The ‘Chunyun’: The largest annual migration on the planet becomes an economic barometer for China       ,https://english.elpais.com/international/2024-02-05/the-chunyun-the-largest-annual-migration-on-the-planet-becomes-an-economic-barometer-for-china.html
Orbán’s party boycotts a session of Hungary’s parliament to further stall Sweden’s bid to join NATO ,https://english.elpais.com/international/2024-02-05/orbans-party-boycotts-a-session-of-hungarys-parliament-to-further-stall-swedens-bid-to-join-nato.html
From drug trafficking to tobacco: Cigarettes become a new branch of business for Mexican cartels,https://english.elpais.com/international/2024-02-05/from-drug-trafficking-to-tobacco-cigarettes-become-a-new-branch-of-business-for-mexican-cartels.html
Rio de Janeiro has declared a dengue health emergency days before Carnival is due to start ,https://english.elpais.com/health/2024-02-05/rio-de-janeiro-has-declared-a-dengue-health-emergency-days-before-carnival-is-due-to-start.html
Political storm over the Federal Reserve,https://english.elpais.com/economy-and-business/2024-02-05/political-storm-over-the-federal-reserve.html
The effect of police violence on Black Americans’ health is documented in two new studies ,https://english.elpais.com/usa/2024-02-05/the-effect-of-police-violence-on-black-americans-health-is-documented-in-two-new-studies.html
"With seven matches for the 2026 World Cup, Boston expecting huge economic boost ",https://english.elpais.com/usa/2024-02-05/with-seven-matches-for-the-2026-world-cup-boston-expecting-huge-economic-boost.html
"US to roll out visa restrictions on people who misuse spyware to target journalists, activists ",https://english.elpais.com/usa/2024-02-05/us-to-roll-out-visa-restrictions-on-people-who-misuse-spyware-to-target-journalists-activists.html
Disney wants trade secrets kept confidential in lawsuit with DeSantis appointees ,https://english.elpais.com/usa/2024-02-05/disney-wants-trade-secrets-kept-confidential-in-lawsuit-with-desantis-appointees.html
"The tragedy of Viña del Mar: Chile’s ‘garden city’ reduced to smoke, ashes and despair",https://english.elpais.com/international/2024-02-05/the-tragedy-of-vina-del-mar-chiles-garden-city-reduced-to-smoke-ashes-and-despair.html
"The quiet life of Elton John, the singer who resists becoming a legend",https://english.elpais.com/people/2024-02-05/the-quiet-life-of-elton-john-the-singer-who-resists-becoming-a-legend.html
"Paulina Tuchschneider, Israeli army deserter and novelist: ‘They called me hysterical for talking about the anxiety of being a soldier’",https://english.elpais.com/culture/2024-02-05/paulina-tuchschneider-israeli-army-deserter-and-novelist-they-called-me-hysterical-for-talking-about-the-anxiety-of-being-a-soldier.html
The barrier broken by the woman who reported soccer player Dani Alves for rape: ‘Who is going to believe me?’   ,https://english.elpais.com/spain/2024-02-05/the-barrier-broken-by-the-woman-who-reported-soccer-player-dani-alves-for-rape-who-is-going-to-believe-me.html
Get that skyscraper out of my face!,https://english.elpais.com/culture/2024-02-05/get-that-skyscraper-out-of-my-face.html
2024 Grammy Awards: Taylor Swift makes history by winning her fourth album of the year,https://english.elpais.com/culture/2024-02-05/2024-grammy-awards-taylor-swift-makes-history-by-winning-her-fourth-album-of-the-year.html
"Taylor Swift announces new album, ‘The Tortured Poets Department’",https://english.elpais.com/culture/2024-02-05/taylor-swift-announces-new-album-the-tortured-poets-department.html
The Taylor Swift red herring,https://english.elpais.com/opinion/2024-02-05/the-taylor-swift-red-herring.html
A million-dollar project against familial cancer aims to take thousands of people out of the ‘genetic purgatory’  ,https://english.elpais.com/health/2024-02-05/a-million-dollar-project-against-familial-cancer-aims-to-take-thousands-of-people-out-of-the-genetic-purgatory.html
The science of happiness comes under examination,https://english.elpais.com/science-tech/2024-02-05/the-science-of-happiness-comes-under-examination.html
What to do if depression isn’t responding to treatment?  ,https://english.elpais.com/health/2024-02-05/what-to-do-if-depression-isnt-responding-to-treatment.html
Hug therapy: Volunteers stimulate the development of premature babies in Argentina  ,https://english.elpais.com/health/2024-02-05/hug-therapy-volunteers-stimulate-the-development-of-premature-babies-in-argentina.html
"Planes, storage, and suppliers nearby: How businesses are dealing with the Red Sea crisis",https://english.elpais.com/economy-and-business/2024-02-05/planes-storage-and-suppliers-nearby-how-businesses-are-dealing-with-the-red-sea-crisis.html
Americans have become saddled with credit card debt. Renters and poor people are falling behind ,https://english.elpais.com/economy-and-business/2024-02-05/americans-have-become-saddled-with-credit-card-debt-renters-and-poor-people-are-falling-behind.html
"Snap, the owner of Snapchat, is laying off about 10% of its global workforce",https://english.elpais.com/technology/2024-02-05/snap-the-owner-of-snapchat-is-laying-off-about-10-of-its-global-workforce.html
Boeing flags potential delays after supplier finds another problem with some 737 fuselages ,https://english.elpais.com/economy-and-business/2024-02-05/boeing-flags-potential-delays-after-supplier-finds-another-problem-with-some-737-fuselages.html
What an old friendship that has ended says about us,https://english.elpais.com/society/2024-02-05/what-an-old-friendship-that-has-ended-says-about-us.html
Debunking the myth of couples therapy: What if it is the first step towards separation? ,https://english.elpais.com/health/2024-02-05/debunking-the-myth-of-couples-therapy-what-if-it-is-the-first-step-towards-separation.html
"Harry James, the influencer who advocates for bald pride",https://english.elpais.com/society/2024-02-03/harry-james-the-influencer-who-advocates-for-bald-pride.html
"Overwhelmed by flirting? How to tidy up your online relationships, Marie Kondo-style  ",https://english.elpais.com/society/2024-02-03/overwhelmed-by-flirting-how-to-tidy-up-your-online-relationships-marie-kondo-style.html
"The excess of Elizabeth Taylor and Richard Burton: trips with 156 suitcases, 21-room hotel reservations and restaurant menus for their dogs ",https://english.elpais.com/people/2024-02-05/the-excess-of-elizabeth-taylor-and-richard-burton-trips-with-156-suitcases-21-room-hotel-reservations-and-restaurant-menus-for-their-dogs.html
"Lily Gladstone, Oscar nominee for ‘Killers of the Flower Moon’: ‘The world has to start getting worried about the return of Trump’",https://english.elpais.com/culture/2024-02-05/lily-gladstone-oscar-nominee-for-killers-of-the-flower-moon-the-world-has-to-start-getting-worried-about-the-return-of-trump.html
"The 3,000-year-old Treasure of Villena contains two pieces made with iron from ‘beyond planet Earth’",https://english.elpais.com/culture/2024-02-05/the-3000-year-old-treasure-of-villena-contains-two-pieces-made-with-iron-from-beyond-planet-earth.html
Gen Z falls in love with the ring with which French poet Jean Cocteau declared his passion to his lover  ,https://english.elpais.com/culture/2024-02-05/gen-z-falls-in-love-with-the-ring-with-which-french-poet-jean-cocteau-declared-his-passion-to-his-lover.html
"The ‘cars’ of Roman antiquity: single, two-person and even primitive motorhomes ",https://english.elpais.com/lifestyle/2024-02-04/the-cars-of-roman-antiquity-single-two-person-and-even-primitive-motorhomes.html
Ayo Edebiri wins a hat trick of awards while remaining surprisingly normal,https://english.elpais.com/people/2024-02-05/ayo-edebiri-wins-a-hat-trick-of-awards-while-remaining-surprisingly-normal.html
The horror paradox: Why scary movies can be good for your mental health  ,https://english.elpais.com/culture/2024-02-03/the-horror-paradox-why-scary-movies-can-be-good-for-your-mental-health.html
"‘Flash Gordon,’ the ‘kitsch’ fantasy from the planet Mongo that paved the way for ‘Star Wars’  ",https://english.elpais.com/culture/2024-02-03/flash-gordon-the-kitsch-fantasy-from-the-planet-mongo-that-paved-the-way-for-star-wars.html
Oscars 2024: Where to stream the nominated movies,https://english.elpais.com/culture/2024-01-26/oscars-2024-where-to-stream-the-nominated-movies.html
Live now in Los40,https://los40.us/ 
"«F*ck the Grammys!»: J Balvin, Ariana Grande & Those Who Declared War Against Them",https://los40.us/2024/fck-the-grammys-j-balvin-ariana-grande-those-who-declared-war-against-them-16602.html
"What Is the ‘Revenge Porn’ That Taylor Swift Is Experiencing, and Why Does It Affect Women?",https://los40.us/2024/what-is-the-revenge-porn-that-taylor-swift-is-experiencing-and-why-does-it-affect-women-16626.html
NBA set to play on an LED glass court for some All-Star weekend events ,https://english.elpais.com/sports/2024-02-05/nba-set-to-play-on-an-led-glass-court-for-some-all-star-weekend-events.html
Ohtanimania descends on Dodger Stadium,https://english.elpais.com/sports/2024-02-04/ohtanimania-descends-on-dodger-stadium.html
Auction of Michael Jordan’s championship sneakers sets record,https://english.elpais.com/sports/2024-02-04/auction-of-michael-jordans-championship-sneakers-sets-record.html
Super Bowl 2024: Where to watch and everything else you need to know,https://english.elpais.com/sports/2024-01-31/super-bowl-2024-where-to-watch-and-everything-else-you-need-to-know.html
To what extent can Taylor Swift influence the 2024 presidential elections?   ,https://english.elpais.com/usa/2024-02-04/to-what-extent-can-taylor-swift-influence-the-2024-presidential-elections.html
A town derailed: The toxic Ohio train crash that split East Palestine in two  ,https://english.elpais.com/usa/2024-02-04/a-town-derailed-the-toxic-ohio-train-crash-that-split-east-palestine-in-two.html
Mexico: the world’s crime market par excellence,https://english.elpais.com/international/2024-02-02/mexico-the-worlds-crime-market-par-excellence.html
Hidden gems of the Royal Palace of Madrid,https://english.elpais.com/culture/2024-02-01/hidden-gems-of-the-royal-palace-of-madrid.html
EL PAÍS offers free Spanish lessons with Gymglish,https://english.elpais.com/economy-and-business/2021-11-15/el-pais-offers-free-spanish-lessons-with-gymglish.html
Biden wins South Carolina’s Democratic primary as he gears up for his reelection bid,https://english.elpais.com/usa/2024-02-04/biden-wins-south-carolinas-democratic-primary-as-he-gears-up-for-his-reelection-bid.html
Can Trump be on the ballot? It’s the Supreme Court’s biggest election test since Bush v. Gore,https://english.elpais.com/usa/2024-02-03/can-trump-be-on-the-ballot-its-the-supreme-courts-biggest-election-test-since-bush-v-gore.html
Thousands surround the German Parliament against the far right: “We are the firewall”,https://english.elpais.com/international/2024-02-03/thousands-surround-the-german-parliament-against-the-far-right-we-are-the-firewall.html
"Israeli protestors attempt to block aid into Gaza: ‘The enemy is to be killed, not fed’",https://english.elpais.com/international/2024-02-02/israeli-protestors-attempt-to-block-aid-into-gaza-the-enemy-is-to-be-killed-not-fed.html
Javier Milei overcomes first obstacle in Congress to his mega-reform bill,https://english.elpais.com/international/2024-02-03/javier-milei-overcomes-first-obstacle-in-congress-to-his-mega-reform-bill.html
Total war between Bolivia’s former allies: road blocks led by Evo Morales stifle the government of Luis Arce,https://english.elpais.com/international/2024-02-02/total-war-between-bolivias-former-allies-road-blocks-led-by-evo-morales-stifle-the-government-of-luis-arce.html
"US employers added surprisingly robust 353,000 jobs in January in further sign of economic strength ",https://english.elpais.com/economy-and-business/2024-02-02/us-employers-added-surprisingly-robust-353000-jobs-in-january-in-further-sign-of-economic-strength.html
"Major automakers may be using Chinese aluminum produced with Uyghur forced labor, rights group says ",https://english.elpais.com/economy-and-business/2024-02-01/major-automakers-may-be-using-chinese-aluminum-produced-with-uyghur-forced-labor-rights-group-says.html
Silencing Frank Sinatra: the biggest cringe moment in the history of the Grammys,https://english.elpais.com/culture/2024-02-02/silencing-frank-sinatra-the-biggest-cringe-moment-in-the-history-of-the-grammys.html
What does sadness sound like? The ‘key’ is in 18th century opera ,https://english.elpais.com/society/2024-02-04/what-does-sadness-sound-like-the-key-is-in-18th-century-opera.html
"In the Galápagos Islands, penguins are contaminated with microplastics   ",https://english.elpais.com/science-tech/2024-02-05/in-the-galapagos-islands-penguins-are-contaminated-with-microplastics.html
The ants that defeated the lions,https://english.elpais.com/science-tech/2024-02-03/the-ants-that-defeated-the-lions.html
How trauma can reveal personal strength,https://english.elpais.com/health/2024-02-05/how-trauma-can-reveal-personal-strength.html
Refresh your look without buying anything: This is the 75 Hard Style Challenge  ,https://english.elpais.com/lifestyle/2024-02-02/refresh-your-look-without-buying-anything-this-is-the-75-hard-style-challenge.html
John McEnroe: ‘Nadal and Saudi Arabia? There is a phrase: money talks’,https://english.elpais.com/sports/2024-01-26/john-mcenroe-nadal-and-saudi-arabia-there-is-a-phrase-money-talks.html
"‘Society of the Snow,’ the spirit of Numa Turcatti and the soccer team named after him",https://english.elpais.com/sports/2024-01-22/society-of-the-snow-the-spirit-of-numa-turcatti-and-the-soccer-team-named-after-him.html
