headline,url
Stormy Daniels case: How 12 jurors were ‘cast’ in the ‘People vs Trump’ ,https://english.elpais.com/usa/2024-04-21/stormy-daniels-case-how-12-jurors-were-cast-in-the-people-vs-trump.html
Iran quickens path towards the atomic bomb,https://english.elpais.com/international/2024-04-21/iran-quickens-path-towards-the-atomic-bomb.html
Gaza once again the main theater of war after risk of regional escalation cools,https://english.elpais.com/international/2024-04-21/gaza-once-again-the-main-theater-of-war-after-risk-of-regional-escalation-cools.html
"Gaza hospitals coin WCNSF acronym: Wounded child, no surviving family",https://english.elpais.com/international/2024-04-20/gaza-hospitals-coin-wcnsf-acronym-wounded-child-no-surviving-family.html
Crime and fentanyl hit California’s king of burgers,https://english.elpais.com/economy-and-business/2024-04-21/crime-and-fentanyl-hit-californias-king-of-burgers.html
Levi’s tightens its belt to add flare to its jeans,https://english.elpais.com/economy-and-business/2024-04-21/levis-tightens-its-belt-to-add-flare-to-its-jeans.html
Kirsten Dunst and Jesse Plemons: The story of Hollywood’s most discreet power couple,https://english.elpais.com/people/2024-04-21/kirsten-dunst-and-jesse-plemons-the-story-of-hollywoods-most-discreet-power-couple.html
Ecuadorians head to polls to toughen fight against gangs behind wave of violence,https://english.elpais.com/international/2024-04-21/ecuadorians-head-to-polls-to-toughen-fight-against-gangs-behind-wave-of-violence.html
Yemeni women become mobile phone technicians to curb sextortion,https://english.elpais.com/society/2024-04-20/yemeni-women-become-mobile-phone-technicians-to-curb-sextortion.html
Will Milei be able to avert disaster? Financiers and economists collide in their forecasts for Argentina   ,https://english.elpais.com/economy-and-business/2024-04-20/will-milei-be-able-to-avert-disaster-financiers-and-economists-collide-in-their-forecasts-for-argentina.html
"About 1,300 people from Myanmar flee into Thailand after clashes broke out in a key border town",https://english.elpais.com/international/2024-04-20/about-1300-people-from-myanmar-flee-into-thailand-after-clashes-broke-out-in-a-key-border-town.html
Video | 25 years of presidential speeches against school shootings in the United States,https://english.elpais.com/usa/2024-04-21/video-25-years-of-presidential-speeches-against-school-shootings-in-the-united-states.html?autoplay=1
Crush of lawsuits over voting in multiple states creates a shadow war for the 2024 election,https://english.elpais.com/usa/2024-04-21/crush-of-lawsuits-over-voting-in-multiple-states-creates-a-shadow-war-for-the-2024-election.html
Hawaii lawmakers take aim at vacation rentals after Lahaina wildfire amplifies Maui housing crisis,https://english.elpais.com/usa/2024-04-21/hawaii-lawmakers-take-aim-at-vacation-rentals-after-lahaina-wildfire-amplifies-maui-housing-crisis.html
Record numbers in the US are homeless. Can cities fine them for sleeping in parks and on sidewalks?,https://english.elpais.com/usa/2024-04-20/record-numbers-in-the-us-are-homeless-can-cities-fine-them-for-sleeping-in-parks-and-on-sidewalks.html
Will there be a ‘superbloom’ this year in California? Here’s what to know,https://english.elpais.com/climate/2024-04-21/will-there-be-a-superbloom-this-year-in-california-heres-what-to-know.html
The pros and cons of saying ‘thank you’ and ‘good morning’ to AI  ,https://english.elpais.com/technology/2024-04-21/the-pros-and-cons-of-saying-thank-you-and-good-morning-to-ai.html
"Food neophobia, or when children do not want to try new foods",https://english.elpais.com/health/2024-04-20/food-neophobia-or-when-children-do-not-want-to-try-new-foods.html
From designing dog beds to leading ‘the Lamborghini of fashion’: The excessive world of Philipp Plein  ,https://english.elpais.com/culture/2024-04-21/from-designing-dog-beds-to-leading-the-lamborghini-of-fashion-the-excessive-world-of-philipp-plein.html
Fewer screens and more domino: Why playing cards and board games are staging a comeback in bars,https://english.elpais.com/society/2024-04-21/fewer-screens-and-more-domino-why-playing-cards-and-board-games-are-staging-a-comeback-in-bars.html
From Mariana Enriquez’s chaos to the perfect workspace: What the disorder of our work desk says about us,https://english.elpais.com/lifestyle/2024-04-21/from-mariana-enriquezs-chaos-to-the-perfect-workspace-what-the-disorder-of-our-work-desk-says-about-us.html
"Johan Norberg: ‘Some time ago, they told me that I was far-right, and now, from the right, they tell me that I am a woke capitalist’ ",https://english.elpais.com/culture/2024-04-21/johan-norberg-some-time-ago-they-told-me-that-i-was-far-right-and-now-from-the-right-they-tell-me-that-i-am-a-woke-capitalist.html
How drugs affect addicts’ brains so that they can even forget to eat and drink  ,https://english.elpais.com/health/2024-04-19/how-drugs-affect-addicts-brains-so-that-they-can-even-forget-to-eat-and-drink.html
"Charan Ranganath, memory expert: ‘There are leaders who weaponize nostalgia to gain power and manipulate people’",https://english.elpais.com/science-tech/2024-04-19/charan-ranganath-memory-expert-there-are-leaders-who-weaponize-nostalgia-to-gain-power-and-manipulate-people.html
"Why Facebook has been filled with Jesus Christs made with eggs, spaghetti or cauliflowers",https://english.elpais.com/technology/2024-04-19/why-facebook-has-been-filled-with-jesus-christs-made-with-eggs-spaghetti-or-cauliflowers.html
The day robots were born,https://english.elpais.com/science-tech/2024-04-18/the-day-robots-were-born.html
"Daron Acemoglu, the economist who says technological innovation does not equal prosperity",https://english.elpais.com/economy-and-business/2024-04-20/daron-acemoglu-the-economist-who-says-technological-innovation-does-not-equal-prosperity.html
Venezuela’s economic crisis fueled by looting of its state-owned oil company ,https://english.elpais.com/international/2024-04-17/venezuelas-economic-crisis-fueled-by-looting-of-its-state-owned-oil-company.html
The payment of more interest on deposits hurts bottom line of large banks,https://english.elpais.com/economy-and-business/2024-04-17/the-payment-of-more-interest-on-deposits-hurts-the-bottom-line-of-large-us-banks.html
The luxury sector is gearing up for a new earnings season: Here’s what to expect ,https://english.elpais.com/economy-and-business/2024-04-17/the-luxury-sector-is-gearing-up-for-a-new-earnings-season-heres-what-to-expect.html
Cinema therapy: can movies help us process grief or get over a breakup?,https://english.elpais.com/health/2024-04-20/cinema-therapy-can-movies-help-us-process-grief-or-get-over-a-breakup.html
Overcoming coitocentrism: How penetrative sex is losing ground ,https://english.elpais.com/lifestyle/2024-04-21/overcoming-coitocentrism-how-penetrative-sex-is-losing-ground.html
Between laziness and germophobia: How often should you wash your hands?,https://english.elpais.com/health/2024-04-20/between-laziness-and-germophobia-how-often-should-you-wash-your-hands.html
How to date like a feminist: Experts explain,https://english.elpais.com/lifestyle/2024-04-20/how-to-date-like-a-feminist-experts-explain.html
The “jazz detective” who finds lost music treasures,https://english.elpais.com/culture/2024-04-20/the-jazz-detective-who-finds-lost-music-treasures.html
"A celebration ‘of the immigrant, the foreigner, the queer and the Indigenous’: Historically excluded take over at the Venice Biennale",https://english.elpais.com/culture/2024-04-19/a-celebration-of-the-immigrant-the-foreigner-the-queer-and-the-indigenous-historically-excluded-take-over-at-the-venice-biennial.html
"Traveler, slaver, and the scourge of walruses, the ‘Black Viking’ sails towards the light",https://english.elpais.com/culture/2024-04-18/traveler-slaver-and-the-scourge-of-walruses-the-black-viking-sails-towards-the-light.html
"Oki Sato, the minimalist designer inspired by manga cat Doraemon  ",https://english.elpais.com/culture/2024-04-20/oki-sato-the-minimalist-designer-inspired-by-manga-cat-doraemon.html
"The child stars’ house of terror: ‘If everyone knew, who could we turn to?’",https://english.elpais.com/culture/2024-04-19/the-child-stars-house-of-terror-if-everyone-knew-who-could-we-turn-to.html
‘Fallout’: A radioactive blast to the TV wasteland,https://english.elpais.com/culture/2024-04-19/fallout-a-radioactive-blast-to-the-tv-wasteland.html
"Taylor Swift releases her 11th album, ‘The Tortured Poets Department’",https://english.elpais.com/people/2024-04-19/taylor-swift-releases-her-11th-album-the-tortured-poets-department-leaked-two-days-earlier-in-the-middle-of-her-tour-amid-enormous-expectation-and-secrecy.html
The night the crew of ‘Titanic’ was drugged with angel dust in their soup,https://english.elpais.com/culture/2024-04-19/the-night-the-crew-of-titanic-was-drugged-with-angel-dust-in-their-soup.html
"Shaghayegh Norouzi, Iranian actress and activist: ‘My filming partners told me to learn to manage abuse. How do you do that?’  ",https://english.elpais.com/society/2024-04-19/shaghayegh-norouzi-iranian-actress-and-activist-my-filming-partners-told-me-to-learn-to-manage-abuse-how-do-you-do-that.html
Live now in Los40,https://los40.us/ 
"Peso Pluma & DJ Snake Release ‘TEKA:’ Meaning, Translation & Lyrics in English",https://los40.us/2024/peso-pluma-dj-snake-release-teka-meaning-translation-lyrics-in-english-19458.html
"Nicki Nicole Announces First-Ever USA Tour: Dates, Tickets…",https://los40.us/2024/nicki-nicole-announces-first-ever-usa-tour-dates-tickets-19444.html
NBA Playoffs 2024: Game schedule and where to watch in the US,https://english.elpais.com/sports/2024-04-20/nba-playoffs-2024-game-schedule-and-where-to-watch-in-the-us.html
Even President Biden is shocked: Caitlin Clark’s salary will be 0.7% of her male equivalent,https://english.elpais.com/sports/2024-04-17/even-president-biden-is-shocked-caitlin-clarks-salary-will-be-07-of-her-male-equivalent.html
LeBron James and the Lakers sneak into NBA playoffs with win over New Orleans,https://english.elpais.com/sports/2024-04-17/lebron-james-and-the-lakers-sneak-into-nba-playoffs-with-win-over-new-orleans.html
"Drunkenness, arrests, and chaos: The tournament that shows the wild side of golf",https://english.elpais.com/sports/2024-04-09/drunkenness-arrests-and-chaos-the-tournament-that-shows-the-wild-side-of-golf.html
Young Miko: ‘My greatest accomplishment in life is having told my dad that he’s done working’ ,https://english.elpais.com/culture/2024-04-20/young-miko-my-greatest-accomplishment-in-life-is-having-told-my-dad-that-hes-done-working.html
Bloodshed in Taxco: The Holy Thursday that shocked Mexico  ,https://english.elpais.com/international/2024-04-18/bloodshed-in-taxco-the-holy-thursday-that-shocked-mexico.html
Five megathrust earthquakes destroyed the city-state of Teotihuacán,https://english.elpais.com/international/2024-04-17/five-megathrust-earthquakes-destroyed-the-city-state-of-teotihuacan.html
The dictionary to orient yourself in a new world order  ,https://english.elpais.com/international/2024-04-16/the-dictionary-to-orient-yourself-in-a-new-world-order.html
EL PAÍS offers free Spanish lessons with Gymglish,https://english.elpais.com/economy-and-business/2021-11-15/el-pais-offers-free-spanish-lessons-with-gymglish.html
Ukraine and Israel aid back on track as House pushes toward weekend votes ,https://english.elpais.com/usa/2024-04-19/ukraine-and-israel-aid-back-on-track-as-house-pushes-toward-weekend-votes.html
US provides minimal assurances that Assange will not be sentenced to death if extradited,https://english.elpais.com/international/2024-04-17/us-provides-minimal-assurances-that-assange-will-not-be-sentenced-to-death-if-extradited.html
Debate ignites in the Netherlands over rise in euthanasia for mental disorders,https://english.elpais.com/international/2024-04-19/debate-ignites-in-the-netherlands-over-rise-in-euthanasia-for-mental-disorders.html
Narendra Modi hopes to renew his mandate in India in the largest elections on the planet,https://english.elpais.com/international/2024-04-18/narendra-modi-hopes-to-renew-his-mandate-in-india-in-the-largest-elections-on-the-planet.html
Severe energy crisis paralyzes Ecuador for two days,https://english.elpais.com/international/2024-04-18/severe-energy-crisis-paralyzes-ecuador-for-two-days.html
Boat drifts to Brazil with nine dead migrants from Mauritania and Mali,https://english.elpais.com/international/2024-04-17/boat-drifts-to-brazil-with-nine-dead-migrants-from-mauritania-and-mali.html
The return of the Dutch miller,https://english.elpais.com/international/2024-04-14/the-return-of-the-dutch-miller.html
An economic paradox: When savings are both a good and a bad idea,https://english.elpais.com/technology/2024-04-12/artificial-intelligence-sparks-game-of-thrones-in-the-chip-industry.html
‘Civil War’: The hit movie that’s terrified the United States and sent a message to the rest of the world,https://english.elpais.com/culture/2024-04-18/civil-war-the-hit-movie-thats-terrified-the-united-states-and-sent-a-message-to-the-rest-of-the-world.html
Salman Rushdie’s memoir recounts the attack that almost killed him: ‘I just stood there like a piñata and let him smash me’,https://english.elpais.com/culture/2024-04-17/salman-rushdies-memoir-recounts-the-attack-that-almost-killed-him-i-just-stood-there-like-a-pinata-and-let-him-smash-me.html
Jesus Christ on toast? Brain scan explains how facial pareidolia happens,https://english.elpais.com/science-tech/2024-04-16/jesus-christ-on-toast-brain-scan-explains-how-facial-pareidolia-happens.html
"Diarrhea, bald spots, watery eyes... Does my dog have allergies?",https://english.elpais.com/science-tech/2024-04-16/diarrhea-bald-spots-watery-eyes-does-my-dog-have-allergies.html
Learning what colors suit you: How a business has been revived thanks to social media,https://english.elpais.com/economy-and-business/2024-04-17/learning-what-colors-suit-you-how-a-business-has-been-revived-thanks-to-social-media.html
From the Eras tour to Coachella: The Louboutin boots that Lana del Rey and Taylor Swift can’t do without  ,https://english.elpais.com/lifestyle/2024-04-16/from-the-eras-tour-to-coachella-the-louboutin-boots-that-lana-del-rey-and-taylor-swift-cant-do-without.html
"Dani Alves seeks reversal of rape conviction, restoration of his public image and a return to soccer ",https://english.elpais.com/sports/2024-04-08/dani-alves-seeks-reversal-of-rape-conviction-restoration-of-his-public-image-and-a-return-to-soccer.html
A look at the NBA’s record-breaking high-scoring season,https://english.elpais.com/sports/2024-04-01/a-look-at-the-nbas-record-breaking-high-scoring-season.html
