headline,url
"Syrians search for relatives in the ‘human slaughterhouse,’ the prison that is a symbol of Assad’s repression",https://english.elpais.com/international/2024-12-10/thousands-of-syrians-search-for-relatives-in-the-human-slaughterhouse-the-prison-that-is-a-symbol-of-assads-repression-he-could-be-dying-underground.html
Luigi Mangione: the brilliant young computer scientist held for killing UnitedHealthcare CEO,https://english.elpais.com/usa/2024-12-10/luigi-mangione-the-brilliant-young-computer-scientist-arrested-for-killing-unitedhealthcare-ceo.html
Nobel laureates urge US Senate not to confirm Robert Kennedy as Secretary of Health,https://english.elpais.com/usa/elections/2024-12-10/more-than-75-nobel-laureates-urge-us-senate-not-to-confirm-robert-kennedy-as-secretary-of-health.html
"Franklin Fire in Malibu rages out of control, prompting large evacuation",https://english.elpais.com/usa/2024-12-10/franklin-fire-in-malibu-rages-out-of-control-prompting-evacuation-of-thousands.html
December holidays 2024: Vacations and other important dates,https://english.elpais.com/usa/2024-12-10/december-holidays-2024-vacations-and-other-important-dates.html
"Jared Isaacman, Elon Musk’s man at the head of NASA: Is the Martian revolution coming?",https://english.elpais.com/science-tech/2024-12-10/jared-isaacman-elon-musks-man-at-the-head-of-nasa-is-the-martian-revolution-coming.html
"Terror, massacre and voodoo in the latest episode of gang violence in Haiti",https://english.elpais.com/international/2024-12-10/terror-massacre-and-voodoo-in-the-latest-episode-of-gang-violence-in-haiti.html
Lula da Silva undergoes surgery for an intracranial hemorrhage two months after a fall at home,https://english.elpais.com/international/2024-12-10/lula-da-silva-undergoes-surgery-for-an-intracranial-hemorrhage-two-months-after-a-fall-at-home.html
"Donald Trump, US president in advance",https://english.elpais.com/usa/elections/2024-12-09/donald-trump-us-president-in-advance.html
Colombian mercenaries fight alongside paramilitaries in Sudan’s civil war,https://english.elpais.com/international/2024-12-09/colombian-mercenaries-recruited-to-fight-alongside-paramilitaries-in-sudans-civil-war.html
Five signs of market excesses: What dangers lurk beneath the record highs? ,https://english.elpais.com/economy-and-business/2024-12-09/five-signs-of-market-excesses-what-dangers-lurk-beneath-the-record-highs.html
The ‘Bahia Emerald’: The story of a giant cursed gem stolen from Brazil  ,https://english.elpais.com/international/2024-12-09/the-bahia-emerald-the-story-of-a-giant-cursed-gem-stolen-from-brazil.html
France’s leftist leader Mélenchon: ‘Macron cannot endure appointing governments every three months’,https://english.elpais.com/international/2024-12-09/frances-leftist-leader-melenchon-macron-cannot-endure-30-months-of-appointing-governments-every-three-months.html
Jorge Ramos and the tireless fight for credibility ,https://english.elpais.com/culture/2024-12-10/jorge-ramos-and-the-tireless-fight-for-credibility.html
"Vintage ‘jamón,’ the foodie luxury fetching up to €80,000",https://english.elpais.com/lifestyle/2024-12-10/vintage-jamon-the-new-foodie-luxury-fetching-up-to-80000.html
"Chevy Chase, the beloved comedian who was a monster off camera: ‘Not everyone hated him, just the people who’ve worked with him’  ",https://english.elpais.com/culture/2024-12-08/chevy-chase-the-beloved-comedian-who-was-a-monster-off-camera-not-everyone-hated-him-just-the-people-whove-worked-with-him.html
Kate Middleton’s measured return to center stage  ,https://english.elpais.com/international/2024-12-09/kate-middletons-measured-return-to-center-stage.html
"‘Instagram therapy’ offers self-diagnoses and justifications, but it does not solve anything",https://english.elpais.com/lifestyle/2024-12-08/instagram-therapy-offers-self-diagnoses-vocabulary-and-justifications-but-it-does-not-solve-anything.html
"Gang of Four, the last dance against nostalgia from the band that redefined post-punk",https://english.elpais.com/culture/2024-12-09/gang-of-four-the-last-dance-against-nostalgia-from-the-band-that-redefined-post-punk.html
"Marco Grossi, the man behind the success of iLovePDF",https://english.elpais.com/technology/2024-12-08/marco-grossi-the-man-behind-the-success-of-ilovepdf.html
A gang of orcas uses an Ingenious techniques to hunt whale sharks in Mexico   ,https://english.elpais.com/science-tech/2024-12-07/a-gang-of-orcas-uses-an-ingenious-techniques-to-hunt-whale-sharks-in-mexico.html
How do we know dark matter exists if it can’t be detected?,https://english.elpais.com/science-tech/2024-12-06/how-do-we-know-dark-matter-exists-if-it-cant-be-detected.html
The 24 DNA letters linked to autism,https://english.elpais.com/science-tech/2024-12-04/the-24-dna-letters-linked-to-autism-gcaaggacatatgggcgaaggaga.html
How much the minimum wage will rise in California starting in 2025,https://english.elpais.com/economy-and-business/2024-12-08/how-much-the-minimum-wage-will-rise-in-california-starting-in-2025.html
When will COLA 2025 payments be sent? ,https://english.elpais.com/economy-and-business/2024-12-07/when-will-cola-2025-payments-be-sent.html
Texas water and the economic miracle are at risk of evaporating  ,https://english.elpais.com/usa/2024-12-07/texas-water-and-the-economic-miracle-are-at-risk-of-evaporating.html
Russia turns to bartering  ,https://english.elpais.com/international/2024-12-07/russia-turns-to-bartering.html
"Martin Parr, photographer: ‘When the absurdity of the world presents itself, I take the shot’",https://english.elpais.com/culture/2024-12-08/martin-parr-photographer-when-the-absurdity-of-the-world-presents-itself-i-take-the-shot.html
"The old story of defeated empires: ‘The Inca rulers spoiled their children, while the Aztecs were told they were going to die in battle’   ",https://english.elpais.com/culture/2024-12-07/the-old-story-of-defeated-empires-the-inca-rulers-spoiled-their-children-while-the-aztecs-were-told-they-were-going-to-die-in-battle.html
"Ridley Scott’s dizzying career at 87: Big hits, epic flops and multimillion-dollar budgets",https://english.elpais.com/culture/2024-12-05/ridley-scotts-dizzying-career-at-87-big-hits-epic-flops-and-multimillion-dollar-budgets.html
"Notre Dame, the cathedral that reinvented the Middle Ages  ",https://english.elpais.com/culture/2024-12-06/notre-dame-the-cathedral-that-reinvented-the-middle-ages.html
"Hollywood v. Madonna: ‘A bunch of people have tried to write movies about me, but they’re always men’",https://english.elpais.com/culture/2024-12-05/hollywood-v-madonna-a-bunch-of-people-have-tried-to-write-movies-about-me-but-theyre-always-men.html
"Journey to La Rumorosa, Mexico’s UFO town  ",https://english.elpais.com/travel/2024-12-07/journey-to-la-rumorosa-mexicos-ufo-town.html
"Obesity surgery in the time of Ozempic: ‘They are not two competing treatments, but rather complementary ones’",https://english.elpais.com/health/2024-12-03/obesity-surgery-in-the-time-of-ozempic-they-are-not-two-competing-treatments-but-rather-complementary-ones.html
The professionals working for the super-rich   ,https://english.elpais.com/lifestyle/2024-12-08/the-professionals-working-for-the-super-rich.html
Trains that run through buildings and escalators with tolls: ‘The craziest city on the planet’,https://english.elpais.com/travel/2024-12-01/trains-that-run-through-buildings-and-escalators-with-tolls-the-craziest-city-on-the-planet.html
Eddie Redmayne: ‘I still can’t believe I get paid to do this’,https://english.elpais.com/culture/2024-12-06/eddie-redmayne-i-still-cant-believe-i-get-paid-to-do-this.html
‘Black Doves’ turns Keira Knightley into a spy: ‘We all have different versions of ourselves’,https://english.elpais.com/culture/2024-12-06/black-doves-turns-keira-knightley-into-a-spy-we-all-have-different-versions-of-ourselves.html
"Footballers to compete in 50°C heat at 2026 World Cup, study warns",https://english.elpais.com/climate/2024-11-28/footballers-to-compete-in-50c-heat-at-2026-world-cup-study-warns.html
Josep Borrell’s final days at the head of European security,https://english.elpais.com/international/2024-12-07/josep-borrells-final-days-at-the-head-of-european-security.html
Texas’ war on porn,https://english.elpais.com/usa/2024-12-01/texas-war-on-porn.html
"Angela Merkel: ‘I am worried, we have to protect freedom’",https://english.elpais.com/international/2024-11-30/angela-merkel-i-am-worried-we-have-to-protect-freedom.html
"The green revolution, ‘made in China’: The two sides of Europe’s ecological transition ",https://english.elpais.com/economy-and-business/2024-12-08/the-green-revolution-made-in-china-the-two-sides-of-europes-ecological-transition.html
Listen now LOS40 USA,https://los40.us/
The Luigi Mangione Case: Alleged Motive Behind the CEO’s Murder,https://los40.us/2024/the-luigi-mangione-case-alleged-motive-behind-the-ceos-murder-27456.html
"Shakira’s U.S. ‘Las Mujeres Ya No Lloran’ Tour in 2025: Dates, Tickets, Cities…",https://los40.us/2024/shakira-announces-new-u-s-las-mujeres-ya-no-lloran-world-tour-in-2025-dates-tickets-cities-25926.html
EL PAÍS offers free Spanish lessons with Gymglish,https://english.elpais.com/economy-and-business/2021-11-15/el-pais-offers-free-spanish-lessons-with-gymglish.html
Protecting undocumented students: How schools and colleges are responding to Trump’s second term,https://english.elpais.com/usa/2024-12-08/protecting-undocumented-students-how-schools-and-colleges-are-responding-to-trumps-second-term.html
"Pete Hegseth, the Fox host accused of sexual assault who wants to end diversity policies in the US military",https://english.elpais.com/usa/elections/2024-11-19/pete-hegseth-the-fox-host-accused-of-sexual-assault-who-wants-to-end-diversity-policies-in-the-us-military.html
The first battle: Claudia Sheinbaum moves against Trump’s immigration policy,https://english.elpais.com/international/2024-11-22/the-first-battle-claudia-sheinbaum-moves-against-trumps-immigration-policy.html
‘You can’t die over a sneaker’: Armed teenagers terrorize Naples,https://english.elpais.com/international/2024-11-12/you-cant-die-over-a-sneaker-armed-teenagers-terrorize-naples.html
José Mujica’s left returns to power in Uruguay,https://english.elpais.com/international/2024-11-25/jose-mujicas-left-returns-to-power-in-uruguay.html
Venezuela kicks off its most uncertain presidential campaign,https://english.elpais.com/international/2024-11-25/a-horrible-murder-compounded-by-police-negligence-how-sheyla-condor-was-killed-in-peru.html
The return of carry trade in Argentina: A financial maneuver generating 50% profit in dollars  ,https://english.elpais.com/economy-and-business/2024-11-02/the-return-of-carry-trade-in-argentina-a-financial-maneuver-generating-50-profit-in-dollars.html
An economic paradox: When savings are both a good and a bad idea,https://english.elpais.com/economy-and-business/2024-10-30/the-dead-end-of-chips-manufacturing-semiconductors-consumes-as-much-energy-as-entire-countries.html
"Grandiose luxury and 1,400 dead workers: The palace that wanted to be bigger than the Vatican",https://english.elpais.com/culture/2024-11-19/grandiose-luxury-and-1400-dead-workers-the-palace-that-wanted-to-be-bigger-than-the-vatican.html
DNA rewrites the history of Pompeii: The woman with the bracelet was a man and unrelated to the child on her lap ,https://english.elpais.com/science-tech/2024-11-07/dna-rewrites-the-history-of-pompeii-the-woman-with-the-bracelet-was-a-man-and-unrelated-to-the-child-on-her-lap.html
Nadine Burke-Harris: ‘A strong community can reverse childhood trauma’,https://english.elpais.com/health/2024-11-22/nadine-burke-harris-a-strong-community-can-reverse-childhood-trauma.html
The AI sexualization of the Vatican’s mascot and the limits of Rule 34: Everything on the internet can be ‘pornified’,https://english.elpais.com/technology/2024-11-13/the-ai-sexualization-of-the-vaticans-mascot-and-the-limits-of-rule-34-everything-on-the-internet-can-be-pornified.html
‘A devastating cocktail for the face’: Is Ozempic aging us prematurely?  ,https://english.elpais.com/lifestyle/2024-11-02/a-devastating-cocktail-for-the-face-is-ozempic-aging-us-prematurely.html
A ‘don’t text your ex’ shirt and divorce rings: Fashion leads a break-up paradigm shift,https://english.elpais.com/lifestyle/2024-10-25/a-dont-text-your-ex-shirt-and-divorce-rings-fashion-leads-a-break-up-paradigm-shift.html
"Racism, sexism and LGBTQphobia tarnish the rise of women’s basketball in the US",https://english.elpais.com/sports/2024-11-04/racism-sexism-and-lgbtqphobia-tarnish-the-rise-of-womens-basketball-in-the-us.html
"Climbing without a rope, between freedom and psychopathy",https://english.elpais.com/sports/2024-10-22/the-celtics-and-the-curse-of-the-champion.html
